,Pitcher,Opp,K%,BB%,Brl%,GB%,FB%,xwOBA,PPA,LU
0,Tarik Skubal,TEX,0.235,0.072,0.081,0.444,0.287,0.2944444444444445,3.7833333333333337,"Wyatt Langford, Josh Jung, Corey Seager, Jonah Heim, Marcus Semien, Adolis Garcia, Evan Carter, Blaine Crim, Ezequiel Duran"
0,Patrick Corbin,DET,0.256,0.081,0.081,0.39,0.3,0.3062222222222222,3.9511111111111115,"Justyn-Henry Malloy, Gleyber Torres, Riley Greene, Andy Ibanez, Spencer Torkelson, Zach McKinstry, Javier Baez, Dillon Dingler, Trey Sweeney"
0,Bailey Falter,ATL,0.22,0.078,0.096,0.445,0.26,0.3236666666666667,3.902222222222222,"Alex Verdugo, Austin Riley, Marcell Ozuna, Matt Olson, Ozzie Albies, Sean Murphy, Eli White, Michael Harris II, Nick Allen"
0,Bryce Elder,PIT,0.236,0.085,0.088,0.444,0.249,0.3185555555555556,3.988888888888889,"Oneil Cruz, Bryan Reynolds, Andrew McCutchen, Joey Bart, Enmanuel Valdez, ""KeBryan Hayes"", Adam Frazier, Tommy Pham, Jared Triolo"
0,Mitchell Parker,STL,0.196,0.08,0.07,0.403,0.244,0.31755555555555554,3.946666666666667,"Lars Nootbaar, Masyn Winn, Brendan Donovan, Nolan Arenado, Willson Contreras, Luken Baker, Jordan Walker, Yohel Pozo, Jose Barrero"
0,Erick Fedde,WSH,0.23,0.076,0.079,0.497,0.224,0.3188888888888889,3.9122222222222214,"C.J. Abrams, James Wood, Nathaniel Lowe, Josh Bell, Luis Garcia, Dylan Crews, Jose Tena, Riley Adams, Jacob Young"
0,Zack Littell,MIL,0.203,0.09,0.064,0.467,0.239,0.3167777777777777,3.98,"Jackson Chourio, Brice Turang, William Contreras, Christian Yelich, Rhys Hoskins, Sal Frelick, Jake Bauers, Caleb Durbin, Joey Ortiz"
0,Jose Quintana,TB,0.225,0.079,0.071,0.44,0.236,0.3012222222222222,3.831111111111111,"Yandy Diaz, Christopher Morel, Junior Caminero, Danny Jansen, Curtis Mead, Brandon Lowe, Jose Caballero, Taylor Walls, Chandler Simpson"
0,Clay Holmes,CHC,0.21,0.098,0.092,0.401,0.294,0.33777777777777773,3.9033333333333338,"Ian Happ, Kyle Tucker, Seiya Suzuki, Michael Busch, Carson Kelly, Pete Crow-Armstrong, Nico Hoerner, Dansby Swanson, Jon Berti"
0,Jameson Taillon,NYM,0.21,0.094,0.105,0.432,0.254,0.3443333333333333,3.9322222222222223,"Francisco Lindor, Juan Soto, Pete Alonso, Starling Marte, Brandon Nimmo, Mark Vientos, Jeff McNeil, Francisco Alvarez, Tyrone Taylor"
0,Gavin Williams,PHI,0.215,0.086,0.086,0.416,0.278,0.3382222222222222,3.9044444444444446,"Bryson Stott, Trea Turner, Bryce Harper, Kyle Schwarber, Nick Castellanos, Max Kepler, J.T. Realmuto, Alec Bohm, Brandon Marsh"
0,Aaron Nola,CLE,0.221,0.088,0.074,0.413,0.277,0.3055555555555556,4.042222222222223,"Steven Kwan, Daniel Schneemann, Jose Ramirez, Kyle Manzardo, Carlos Santana, Bo Naylor, Gabriel Arias, Nolan Jones, Angel Martinez"
0,Michael Lorenzen,BOS,0.231,0.078,0.09,0.415,0.26,0.32155555555555554,3.9044444444444446,"Jarren Duran, Rafael Devers, Alex Bregman, Kristian Campbell, Wilyer Abreu, Trevor Story, Abraham Toro, Connor Wong, Ceddanne Rafaela"
0,Hunter Dobbins,KC,0.181,0.071,0.075,0.412,0.269,0.3236666666666667,3.794444444444445,"Jonathan India, Bobby Witt Jr., Vinnie Pasquantino, Salvador Perez, Maikel Garcia, Michael Massey, Hunter Renfroe, Drew Waters, Kyle Isbel"
0,Bryse Wilson,MIA,0.241,0.064,0.085,0.455,0.241,0.3033333333333333,3.67,"Xavier Edwards, Kyle Stowers, Eric Wagaman, Jesus Sanchez, Agustin Ramirez, Connor Norby, Matt Mervis, Nick Fortes, Javier Sanoja"
0,Max Meyer,CWS,0.221,0.091,0.052,0.44,0.226,0.3055555555555556,3.907777777777778,"Chase Meidroth, Miguel Vargas, Luis Robert, Edgar Quero, Andrew Vaughn, Josh Palacios, Brooks Baldwin, Josh Rojas, Lenyn Sosa"
0,Hunter Brown,CIN,0.242,0.094,0.078,0.411,0.278,0.3168888888888889,3.9311111111111114,"TJ Friedl, Matt McLain, Elly De La Cruz, Gavin Lux, Spencer Steer, Santiago Espinal, Tyler Stephenson, Jacob Hurtubise, Rece Hinds"
0,Nick Martinez,HOU,0.208,0.073,0.071,0.457,0.245,0.32055555555555554,3.8244444444444445,"Jeremy Pena, Jose Altuve, Isaac Paredes, Christian Walker, Yainer Diaz, Jake Meyers, Victor Caratini, Brendan Rodgers, Cam Smith"
0,Chris Paddack,SF,0.218,0.09,0.086,0.398,0.274,0.32477777777777783,3.966666666666667,"Mike Yastrzemski, Willy Adames, Jung Hoo Lee, Matt Chapman, Wilmer Flores, LaMonte Wade Jr., Heliot Ramos, Patrick Bailey, Christian Koss"
0,Jordan Hicks,MIN,0.211,0.071,0.089,0.402,0.282,0.32088888888888895,3.8455555555555554,"Byron Buxton, Trevor Larnach, Ryan Jeffers, Ty France, Carlos Correa, Brooks Lee, Royce Lewis, Willi Castro, Kody Clemens"
0,Antonio Senzatela,SD,0.174,0.068,0.078,0.438,0.246,0.3302222222222222,3.852222222222222,"Fernando Tatis Jr., Luis Arraez, Manny Machado, Jackson Merrill, Xander Bogaerts, Jake Cronenworth, Gavin Sheets, Elias Diaz, Jason Heyward"
0,Randy Vasquez,COL,0.27,0.068,0.096,0.417,0.319,0.29222222222222227,3.785555555555556,"Brenton Doyle, Jordan Beck, Ryan McMahon, Hunter Goodman, Michael Toglia, Nick Martini, Mickey Moniak, Alan Trejo, Adael Amador"
0,Kyle Hendricks,BAL,0.251,0.078,0.078,0.419,0.267,0.31299999999999994,3.9311111111111114,"Cedric Mullins II, Gunnar Henderson, Adley Rutschman, ""Ryan OHearn"", Ryan Mountcastle, Jackson Holliday, Ramon Laureano, Heston Kjerstad, Coby Mayo"
0,Tomoyuki Sugano,LAA,0.25,0.085,0.096,0.425,0.277,0.3222222222222222,3.888888888888889,"Zach Neto, Nolan Schanuel, Jorge Soler, Taylor Ward, ""Logan OHoppe"", Yoan Moncada, Kyren Paris, Luis Rengifo, Jo Adell"
0,Eduardo Rodriguez,LAD,0.202,0.096,0.097,0.359,0.318,0.34211111111111114,4.023333333333333,"Shohei Ohtani, Mookie Betts, Will Smith, Freddie Freeman, Andy Pages, Miguel Rojas, Max Muncy, Enrique Hernandez, Chris Taylor"
0,Roki Sasaki,ARI,0.193,0.095,0.094,0.453,0.253,0.34344444444444444,3.907777777777778,"Corbin Carroll, Ketel Marte, Pavin Smith, Josh Naylor, Eugenio Suarez, Gabriel Moreno, Lourdes Gurriel Jr., Alek Thomas, Geraldo Perdomo"
0,Luis Castillo,TOR,0.181,0.078,0.081,0.411,0.244,0.3224444444444445,3.79,"Bo Bichette, Vladimir Guerrero Jr., Anthony Santander, George Springer, Daulton Varsho, Alejandro Kirk, Addison Barger, Ernie Clement, Nathan Lukes"
0,Kevin Gausman,SEA,0.246,0.092,0.094,0.399,0.283,0.3234444444444444,4.04111111111111,"J.P. Crawford, Jorge Polanco, Julio Rodriguez, Cal Raleigh, Randy Arozarena, Rowdy Tellez, Leody Taveras, Dylan Moore, Ben Williamson"
0,Osvaldo Bido,NYY,0.237,0.109,0.11,0.408,0.304,0.339,4.055555555555555,"Trent Grisham, Aaron Judge, Ben Rice, Paul Goldschmidt, Cody Bellinger, Anthony Volpe, Austin Wells, Oswaldo Cabrera, Jorbit Vivas"
0,Will Warren,OAK,0.218,0.08,0.085,0.428,0.264,0.3262222222222222,3.7722222222222226,"Jacob Wilson, Tyler Soderstrom, Brent Rooker, Miguel Andujar, JJ Bleday, Shea Langeliers, Lawrence Butler, Nick Kurtz, Luis Urias"
