,Pitcher,Opp,K%,BB%,Brl%,GB%,FB%,xwOBA,PPA,LU
0,Mitchell Parker,MIA,0.225,0.071,0.071,0.455,0.234,0.30811111111111106,3.7455555555555557,"Xavier Edwards, Agustin Ramirez, Jakob Marsee, Otto Lopez, Heriberto Hernandez, Connor Norby, Eric Wagaman, Joey Wiemer, Javier Sanoja"
0,Eury Perez,WSH,0.225,0.075,0.075,0.49,0.217,0.3166666666666667,3.83,"James Wood, Daylen Lile, Josh Bell, Luis Garcia, Dylan Crews, Jorge Alfaro, Robert Hassell III, Brady House, Nasim Nunez"
0,Casey Mize,NYM,0.214,0.091,0.109,0.436,0.254,0.3451111111111111,3.8844444444444446,"Francisco Lindor, Juan Soto, Pete Alonso, Brandon Nimmo, Mark Vientos, Jeff McNeil, Starling Marte, Brett Baty, Hayden Senger"
0,Clay Holmes,DET,0.234,0.079,0.093,0.384,0.298,0.3201111111111111,3.9322222222222223,"Colt Keith, Gleyber Torres, Kerry Carpenter, Riley Greene, Spencer Torkelson, Wenceel Perez, Zach McKinstry, Javier Baez, Jake Rogers"
0,Zac Gallen,TEX,0.209,0.078,0.085,0.412,0.275,0.3124444444444444,3.968888888888889,"Josh Smith, Wyatt Langford, Joc Pederson, Jake Burger, Kyle Higashioka, Cody Freeman, Alejandro Osuna, Ezequiel Duran, Michael Helman"
0,Jack Leiter,ARI,0.227,0.084,0.079,0.455,0.266,0.3114444444444444,3.901111111111111,"Geraldo Perdomo, Ketel Marte, Corbin Carroll, Gabriel Moreno, Adrian Del Castillo, Blaze Alexander, Alek Thomas, Tyler Locklear, Jake McCarthy"
0,Nestor Cortes,BAL,0.269,0.063,0.087,0.46,0.266,0.2913333333333334,3.8844444444444446,"Jackson Holliday, Jeremiah Jackson, Ryan Mountcastle, Emmanuel Rivera, Dylan Carlson, Colton Cowser, Coby Mayo, Alex Jackson, Luis Vazquez"
0,Cade Povich,SD,0.177,0.073,0.081,0.443,0.252,0.3341111111111111,3.8499999999999996,"Fernando Tatis Jr., Luis Arraez, Manny Machado, ""Ryan OHearn"", Ramon Laureano, Jackson Merrill, Jake Cronenworth, Jose Iglesias, Elias Diaz"
0,Braxton Ashcraft,LAD,0.216,0.094,0.105,0.379,0.312,0.3392222222222222,4.045555555555556,"Shohei Ohtani, Mookie Betts, Will Smith, Freddie Freeman, Teoscar Hernandez, Alex Call, Andy Pages, Alex Freeland, Enrique Hernandez"
0,Emmet Sheehan,PIT,0.269,0.094,0.083,0.406,0.314,0.30722222222222223,3.902222222222223,"Jared Triolo, Spencer Horwitz, Bryan Reynolds, Tommy Pham, Andrew McCutchen, Nick Gonzales, Oneil Cruz, Joey Bart, Cam Devanney"
0,Zack Littell,TOR,0.18,0.073,0.087,0.436,0.24,0.33144444444444443,3.75,"George Springer, Addison Barger, Vladimir Guerrero Jr., Bo Bichette, Daulton Varsho, Alejandro Kirk, Ty France, Andres Gimenez, Ernie Clement"
0,Shane Bieber,CIN,0.225,0.078,0.067,0.442,0.243,0.3012222222222222,3.821111111111111,"TJ Friedl, Noelvi Marte, Elly De La Cruz, Austin Hays, Gavin Lux, Spencer Steer, ""KeBryan Hayes"", Jose Trevino, Matt McLain"
0,Brennan Bernardino,CLE,0.23,0.07,0.074,0.393,0.286,0.29644444444444445,3.8333333333333335,"Steven Kwan, Angel Martinez, Jose Ramirez, Kyle Manzardo, Jhonkensy Noel, Bo Naylor, Gabriel Arias, C.J. Kayfus, Brayan Rocchio"
0,Joey Cantillo,BOS,0.235,0.066,0.076,0.439,0.246,0.3121111111111111,3.8388888888888886,"Nate Eaton, Alex Bregman, Trevor Story, Romy Gonzalez, Rob Refsnyder, Jarren Duran, Ceddanne Rafaela, Nick Sogard, Connor Wong"
0,Adrian Houser,SEA,0.245,0.09,0.105,0.397,0.3,0.33266666666666667,3.9588888888888882,"Randy Arozarena, Cal Raleigh, Julio Rodriguez, Josh Naylor, Eugenio Suarez, Jorge Polanco, Dominic Canzone, Mitch Garver, J.P. Crawford"
0,George Kirby,TB,0.23,0.068,0.065,0.515,0.202,0.29555555555555557,3.771111111111111,"Chandler Simpson, Yandy Diaz, Brandon Lowe, Junior Caminero, Josh Lowe, Jake Mangum, Hunter Feduccia, Carson Williams, Bobby Seymour"
0,Ryan Bergert,LAA,0.266,0.072,0.095,0.426,0.274,0.3051111111111111,3.8377777777777777,"Zach Neto, Yoan Moncada, Taylor Ward, Jo Adell, Luis Rengifo, Chris Taylor, ""Logan OHoppe"", Oswald Peraza, Bryce Teodosio"
0,Caden Dana,KC,0.183,0.064,0.083,0.408,0.269,0.3232222222222222,3.776666666666667,"Mike Yastrzemski, Bobby Witt Jr., Vinnie Pasquantino, Maikel Garcia, Salvador Perez, Adam Frazier, Michael Massey, Jac Caglianone, Kyle Isbel"
0,Cade Horton,ATL,0.215,0.09,0.09,0.437,0.254,0.33099999999999996,3.9777777777777774,"Ronald Acuna Jr., Matt Olson, Ozzie Albies, Drake Baldwin, Marcell Ozuna, Michael Harris II, Ha-Seong Kim, Eli White, Nacho Alvarez"
0,Bryce Elder,CHC,0.216,0.089,0.09,0.401,0.281,0.32655555555555554,3.954444444444444,"Nico Hoerner, Michael Busch, Seiya Suzuki, Ian Happ, Carlos Santana, Dansby Swanson, Willi Castro, Matt Shaw, Reese McGuire"
0,Zebby Matthews,CWS,0.228,0.074,0.078,0.394,0.28,0.3138888888888889,3.8699999999999997,"Kyle Teel, Lenyn Sosa, Colson Montgomery, Edgar Quero, Andrew Benintendi, Curtis Mead, Brooks Baldwin, Michael A. Taylor, Chase Meidroth"
0,Yoendrys Gomez,MIN,0.223,0.087,0.096,0.401,0.283,0.32522222222222225,3.8533333333333335,"Byron Buxton, Trevor Larnach, Luke Keaschall, Matt Wallner, Ryan Jeffers, Brooks Lee, Royce Lewis, Edouard Julien, Austin Martin"
0,Jose Quintana,PHI,0.224,0.078,0.099,0.428,0.262,0.33477777777777784,3.848888888888889,"Trea Turner, Kyle Schwarber, Bryce Harper, J.T. Realmuto, Alec Bohm, Harrison Bader, Nick Castellanos, Edmundo Sosa, Weston Wilson"
0,Aaron Nola,MIL,0.221,0.102,0.058,0.474,0.222,0.31466666666666665,4.023333333333333,"Brice Turang, Isaac Collins, William Contreras, Christian Yelich, Jake Bauers, Blake Perkins, Sal Frelick, Anthony Seigler, Joey Ortiz"
0,Matthew Liberatore,OAK,0.246,0.078,0.095,0.437,0.264,0.31344444444444447,3.7288888888888883,"Shea Langeliers, Jacob Wilson, Nick Kurtz, Brent Rooker, Colby Thomas, Zack Gelof, Darell Hernaiz, Lawrence Butler, Willie MacIver"
0,Jeffrey Springs,STL,0.25,0.08,0.087,0.418,0.262,0.31,3.9466666666666663,"Masyn Winn, Ivan Herrera, Lars Nootbaar, Willson Contreras, Thomas Saggese, Nolan Gorman, Pedro Pages, Jordan Walker, Victor Scott II"
0,Jason Alexander,NYY,0.242,0.101,0.141,0.391,0.315,0.3527777777777778,4.051111111111111,"Trent Grisham, Aaron Judge, Cody Bellinger, Jazz Chisholm, Giancarlo Stanton, Ben Rice, Austin Wells, Anthony Volpe, Ryan McMahon"
0,Will Warren,HOU,0.194,0.074,0.088,0.449,0.248,0.33311111111111114,3.717777777777778,"Jeremy Pena, Yordan Alvarez, Jose Altuve, Carlos Correa, Jesus Sanchez, Yainer Diaz, Victor Caratini, Ramon Urias, Taylor Trammell"
0,German Marquez,SF,0.227,0.076,0.096,0.381,0.289,0.31422222222222224,3.913333333333333,"Heliot Ramos, Rafael Devers, Willy Adames, Matt Chapman, Wilmer Flores, Drew Gilbert, Casey Schmitt, Luis Matos, Patrick Bailey"
0,Robbie Ray,COL,0.243,0.059,0.068,0.417,0.274,0.29600000000000004,3.724444444444445,"Tyler Freeman, Ezequiel Tovar, Hunter Goodman, Jordan Beck, Brenton Doyle, Warming Bernabel, Braxton Fulford, Kyle Karros, Ryan Ritter"
