,Pitcher,Opp,K%,BB%,Brl%,GB%,FB%,xwOBA,PPA,LU
0,Brandon Young,NYM,0.209,0.099,0.11,0.428,0.267,0.3496666666666666,4.0,"Brandon Nimmo, Francisco Lindor, Juan Soto, Pete Alonso, Jesse Winker, Jeff McNeil, Luis Torrens, Ronny Mauricio, Brett Baty"
0,Clay Holmes,BAL,0.254,0.079,0.105,0.427,0.281,0.32733333333333337,3.9500000000000006,"Jackson Holliday, Jordan Westburg, Gunnar Henderson, ""Ryan OHearn"", Ramon Laureano, Colton Cowser, ""Tyler ONeill"", Cedric Mullins II, Jacob Stallings"
0,Jack Flaherty,TB,0.199,0.08,0.072,0.471,0.214,0.31866666666666665,3.8722222222222222,"Yandy Diaz, Jonathan Aranda, Junior Caminero, Josh Lowe, Ha-Seong Kim, Jake Mangum, Chandler Simpson, Jose Caballero, Matt Thaiss"
0,Ryan Pepiot,DET,0.228,0.077,0.085,0.387,0.285,0.31977777777777777,3.9499999999999997,"Colt Keith, Gleyber Torres, Riley Greene, Spencer Torkelson, Wenceel Perez, Dillon Dingler, Zach McKinstry, Matt Vierling, Javier Baez"
0,Will Warren,SEA,0.246,0.08,0.093,0.431,0.282,0.31266666666666665,3.9555555555555557,"J.P. Crawford, Julio Rodriguez, Cal Raleigh, Randy Arozarena, Jorge Polanco, Luke Raley, Dominic Canzone, Ben Williamson, Cole Young"
0,Logan Gilbert,NYY,0.248,0.093,0.122,0.418,0.283,0.33533333333333337,4.003333333333334,"Jasson Dominguez, Aaron Judge, Cody Bellinger, Giancarlo Stanton, Jazz Chisholm, Paul Goldschmidt, Austin Wells, Anthony Volpe, Oswald Peraza"
0,Brayan Bello,COL,0.263,0.073,0.089,0.423,0.274,0.3018888888888889,3.8277777777777775,"Tyler Freeman, Hunter Goodman, Mickey Moniak, Jordan Beck, Michael Toglia, Ryan McMahon, Brenton Doyle, Orlando Arcia, Ryan Ritter"
0,Kyle Freeland,BOS,0.258,0.065,0.082,0.467,0.254,0.30166666666666664,3.8755555555555556,"Nate Eaton, Romy Gonzalez, Roman Anthony, Rob Refsnyder, Trevor Story, Ceddanne Rafaela, Jarren Duran, Abraham Toro, Connor Wong"
0,Nick Martinez,MIA,0.225,0.077,0.093,0.443,0.249,0.3368888888888889,3.7211111111111106,"Xavier Edwards, Jesus Sanchez, Otto Lopez, Agustin Ramirez, Kyle Stowers, Connor Norby, Liam Hicks, Heriberto Hernandez, Dane Myers"
0,Eury Perez,CIN,0.244,0.083,0.077,0.424,0.262,0.302,3.862222222222222,"TJ Friedl, Matt McLain, Elly De La Cruz, Austin Hays, Gavin Lux, Spencer Steer, Will Benson, Jose Trevino, Noelvi Marte"
0,Seth Lugo,PIT,0.227,0.078,0.087,0.463,0.233,0.3188888888888889,3.9033333333333338,"Spencer Horwitz, Andrew McCutchen, Bryan Reynolds, Nick Gonzales, Oneil Cruz, ""KeBryan Hayes"", Tommy Pham, Joey Bart, Isiah Kiner-Falefa"
0,Mitch Keller,KC,0.183,0.073,0.077,0.438,0.252,0.3222222222222222,3.801111111111111,"Jonathan India, Bobby Witt Jr., Vinnie Pasquantino, Maikel Garcia, Salvador Perez, Jac Caglianone, Nick Loftin, John Rave, Kyle Isbel"
0,Simeon Woods Richardson,CHC,0.212,0.096,0.098,0.388,0.299,0.33777777777777784,3.9311111111111114,"Ian Happ, Kyle Tucker, Seiya Suzuki, Pete Crow-Armstrong, Michael Busch, Dansby Swanson, Carson Kelly, Nico Hoerner, Matt Shaw"
0,Shota Imanaga,MIN,0.211,0.069,0.084,0.405,0.275,0.31322222222222224,3.8055555555555554,"Byron Buxton, Ryan Jeffers, Willi Castro, Carlos Correa, Royce Lewis, Harrison Bader, Ty France, Brooks Lee, Christian Vazquez"
0,Aaron Civale,TOR,0.19,0.081,0.085,0.436,0.246,0.3262222222222222,3.7988888888888885,"Nathan Lukes, George Springer, Vladimir Guerrero Jr., Bo Bichette, Addison Barger, Alejandro Kirk, Joey Loperfido, Ernie Clement, Davis Schneider"
0,Chris Bassitt,CWS,0.23,0.098,0.073,0.346,0.307,0.3238888888888889,3.923333333333334,"Mike Tauchman, Lenyn Sosa, Andrew Benintendi, Miguel Vargas, Kyle Teel, Luis Robert, Colson Montgomery, Brooks Baldwin, Josh Rojas"
0,Jacob Misiorowski,LAD,0.232,0.088,0.095,0.377,0.3,0.33255555555555555,3.9155555555555557,"Shohei Ohtani, Mookie Betts, Freddie Freeman, Andy Pages, Michael Conforto, Hyeseong Kim, Dalton Rushing, James Outman, Miguel Rojas"
0,Clayton Kershaw,MIL,0.199,0.088,0.064,0.466,0.229,0.31555555555555553,3.9244444444444446,"Sal Frelick, William Contreras, Jackson Chourio, Christian Yelich, Andrew Vaughn, Isaac Collins, Caleb Durbin, Joey Ortiz, Andruw Monasterio"
0,Sonny Gray,WSH,0.198,0.072,0.066,0.464,0.233,0.3234444444444444,3.7333333333333334,"C.J. Abrams, James Wood, Luis Garcia, Nathaniel Lowe, Josh Bell, Brady House, Daylen Lile, Keibert Ruiz, Jacob Young"
0,Jake Irvin,STL,0.219,0.075,0.077,0.412,0.267,0.3111111111111111,3.8666666666666663,"Brendan Donovan, Masyn Winn, Alec Burleson, Willson Contreras, Nolan Gorman, Thomas Saggese, Lars Nootbaar, Pedro Pages, Victor Scott II"
0,Hunter Brown,CLE,0.207,0.089,0.063,0.409,0.276,0.3015555555555556,4.003333333333333,"Steven Kwan, Nolan Jones, Jose Ramirez, Carlos Santana, Daniel Schneemann, David Fry, Angel Martinez, Bo Naylor, Brayan Rocchio"
0,Joey Cantillo,HOU,0.209,0.104,0.057,0.483,0.234,0.30644444444444446,4.011111111111111,"Isaac Paredes, Jake Meyers, Jose Altuve, Cam Smith, Yainer Diaz, Shay Whitcomb, Cooper Hummel, Mauricio Dubon, Kenedy Corona"
0,Jose Soriano,TEX,0.216,0.074,0.093,0.393,0.301,0.31877777777777777,3.8399999999999994,"Josh Smith, Corey Seager, Marcus Semien, Adolis Garcia, Evan Carter, Wyatt Langford, Jonah Heim, Jake Burger, Kyle Higashioka"
0,Nathan Eovaldi,LAA,0.241,0.089,0.109,0.399,0.286,0.3387777777777778,3.96,"Zach Neto, Nolan Schanuel, Mike Trout, Taylor Ward, Yoan Moncada, Jo Adell, Jorge Soler, ""Logan OHoppe"", Luis Rengifo"
0,Nick Pivetta,ARI,0.19,0.085,0.076,0.445,0.258,0.32477777777777783,3.828888888888889,"Corbin Carroll, Ketel Marte, Geraldo Perdomo, Josh Naylor, Eugenio Suarez, Lourdes Gurriel Jr., Jake McCarthy, Alek Thomas, Jose Herrera"
0,Merrill Kelly,SD,0.183,0.074,0.079,0.428,0.262,0.3188888888888889,3.8544444444444443,"Fernando Tatis Jr., Jackson Merrill, Manny Machado, Luis Arraez, Gavin Sheets, Xander Bogaerts, Jake Cronenworth, Trenton Brooks, Elias Diaz"
0,Robbie Ray,PHI,0.217,0.075,0.088,0.438,0.259,0.33255555555555555,3.768888888888889,"Trea Turner, Kyle Schwarber, Bryce Harper, Alec Bohm, Nick Castellanos, J.T. Realmuto, Otto Kemp, Edmundo Sosa, Johan Rojas"
0,Taijuan Walker,SF,0.232,0.09,0.1,0.401,0.293,0.3267777777777778,3.938888888888888,"Mike Yastrzemski, Heliot Ramos, Rafael Devers, Matt Chapman, Jung Hoo Lee, Willy Adames, Dominic Smith, Patrick Bailey, Casey Schmitt"
0,Jeffrey Springs,ATL,0.226,0.095,0.102,0.435,0.265,0.3363333333333334,3.9866666666666664,"Ronald Acuna Jr., Matt Olson, Austin Riley, Marcell Ozuna, Jurickson Profar, Sean Murphy, Ozzie Albies, Michael Harris II, Nick Allen"
0,Didier Fuentes,OAK,0.268,0.075,0.103,0.444,0.268,0.31066666666666665,3.7922222222222217,"Lawrence Butler, Jacob Wilson, Brent Rooker, Nick Kurtz, Shea Langeliers, Tyler Soderstrom, Maxwell Muncy, Zack Gelof, Denzel Clarke"
