,Pitcher,Opp,K%,BB%,Brl%,GB%,FB%,xwOBA,PPA,LU
0,Mitchell Parker,OAK,0.262,0.087,0.093,0.418,0.272,0.30844444444444447,3.8033333333333337,"Shea Langeliers, Nick Kurtz, Brent Rooker, Willie MacIver, Tyler Soderstrom, Darell Hernaiz, Colby Thomas, Luis Urias, Max Schuemann"
0,Jacob Lopez,WSH,0.244,0.067,0.078,0.465,0.239,0.3118888888888889,3.874444444444445,"C.J. Abrams, James Wood, Paul DeJong, Luis Garcia, Riley Adams, Nathaniel Lowe, Daylen Lile, Jacob Young, Robert Hassell III"
0,Logan Gilbert,CWS,0.245,0.074,0.083,0.387,0.277,0.30744444444444446,3.861111111111111,"Mike Tauchman, Lenyn Sosa, Andrew Benintendi, Luis Robert, Colson Montgomery, Curtis Mead, Edgar Quero, Brooks Baldwin, Michael A. Taylor"
0,Shane Smith,SEA,0.234,0.088,0.103,0.399,0.299,0.33366666666666667,3.9366666666666665,"Randy Arozarena, Cal Raleigh, Julio Rodriguez, Josh Naylor, Eugenio Suarez, Jorge Polanco, Dominic Canzone, J.P. Crawford, Cole Young"
0,Paul Skenes,CIN,0.229,0.086,0.068,0.434,0.248,0.3055555555555556,3.851111111111111,"TJ Friedl, Matt McLain, Elly De La Cruz, Austin Hays, Gavin Lux, Spencer Steer, Tyler Stephenson, Jake Fraley, ""KeBryan Hayes"""
0,Brady Singer,PIT,0.237,0.077,0.09,0.45,0.244,0.31166666666666676,3.901111111111111,"Spencer Horwitz, Tommy Pham, Bryan Reynolds, Nick Gonzales, Oneil Cruz, Andrew McCutchen, Liover Peguero, Henry Davis, Isiah Kiner-Falefa"
0,Carlos Carrasco,MIA,0.231,0.093,0.095,0.436,0.218,0.3241111111111111,3.823333333333333,"Xavier Edwards, Kyle Stowers, Agustin Ramirez, Liam Hicks, Otto Lopez, Jakob Marsee, Troy Johnston, Dane Myers, Graham Pauley"
0,Eury Perez,ATL,0.218,0.076,0.079,0.452,0.242,0.31,3.896666666666666,"Jurickson Profar, Matt Olson, Drake Baldwin, Sean Murphy, Michael Harris II, Ozzie Albies, Eli White, Nacho Alvarez, Nick Allen"
