,Pitcher,Opp,K%,BB%,Brl%,GB%,FB%,xwOBA,PPA,LU
0,Tanner Bibee,DET,0.241,0.077,0.092,0.374,0.293,0.3215555555555556,3.968888888888889,"Parker Meadows, Gleyber Torres, Kerry Carpenter, Spencer Torkelson, Riley Greene, Wenceel Perez, Dillon Dingler, Zach McKinstry, Javier Baez"
0,Casey Mize,CLE,0.224,0.085,0.071,0.403,0.277,0.3068888888888889,3.9222222222222225,"Steven Kwan, George Valera, Jose Ramirez, Kyle Manzardo, Bo Naylor, Gabriel Arias, Chase DeLauter, C.J. Kayfus, Brayan Rocchio"
0,Andrew Kittredge,SD,0.17,0.075,0.079,0.432,0.257,0.3357777777777778,3.8899999999999997,"Fernando Tatis Jr., Luis Arraez, Manny Machado, Jackson Merrill, Xander Bogaerts, ""Ryan OHearn"", Gavin Sheets, Jake Cronenworth, Freddy Fermin"
0,Dylan Cease,CHC,0.209,0.095,0.099,0.386,0.301,0.3403333333333333,3.92,"Michael Busch, Nico Hoerner, Ian Happ, Kyle Tucker, Seiya Suzuki, Carson Kelly, Pete Crow-Armstrong, Dansby Swanson, Matt Shaw"
0,Carlos Rodon,BOS,0.234,0.069,0.084,0.445,0.251,0.317,3.852222222222222,"Rob Refsnyder, Trevor Story, Alex Bregman, Romy Gonzalez, Carlos Narvaez, Nate Eaton, Jarren Duran, Ceddanne Rafaela, Nick Sogard"
0,Brayan Bello,NYY,0.244,0.101,0.14,0.39,0.314,0.3533333333333333,4.057777777777777,"Trent Grisham, Aaron Judge, Cody Bellinger, Ben Rice, Giancarlo Stanton, Jazz Chisholm, Austin Wells, Anthony Volpe, Ryan McMahon"
0,Yoshinobu Yamamoto,CIN,0.237,0.084,0.082,0.425,0.269,0.31688888888888894,3.8833333333333337,"TJ Friedl, Spencer Steer, Gavin Lux, Austin Hays, Sal Stewart, Elly De La Cruz, Tyler Stephenson, ""KeBryan Hayes"", Matt McLain"
0,Zack Littell,LAD,0.206,0.092,0.101,0.385,0.305,0.3375555555555556,3.9444444444444446,"Shohei Ohtani, Mookie Betts, Freddie Freeman, Teoscar Hernandez, Max Muncy, Andy Pages, Enrique Hernandez, Miguel Rojas, Ben Rortvedt"
