,Pitcher,Opp,K%,BB%,Brl%,GB%,FB%,xwOBA,PPA,LU
0,Casey Mize,SEA,0.234,0.084,0.105,0.409,0.292,0.33555555555555555,3.8755555555555556,"Randy Arozarena, Cal Raleigh, Julio Rodriguez, Jorge Polanco, Josh Naylor, Eugenio Suarez, Dominic Canzone, Victor Robles, J.P. Crawford"
0,Bryce Miller,DET,0.238,0.076,0.093,0.381,0.293,0.3243333333333333,3.9355555555555557,"Kerry Carpenter, Gleyber Torres, Colt Keith, Riley Greene, Spencer Torkelson, Zach McKinstry, Dillon Dingler, Parker Meadows, Javier Baez"
0,Jameson Taillon,MIL,0.202,0.084,0.065,0.481,0.222,0.3158888888888889,3.933333333333333,"Christian Yelich, Jackson Chourio, Brice Turang, William Contreras, Sal Frelick, Caleb Durbin, Jake Bauers, Brandon Lockridge, Joey Ortiz"
0,Quinn Priester,CHC,0.209,0.095,0.1,0.385,0.302,0.3403333333333334,3.9199999999999995,"Michael Busch, Nico Hoerner, Kyle Tucker, Seiya Suzuki, Ian Happ, Carson Kelly, Pete Crow-Armstrong, Dansby Swanson, Matt Shaw"
0,Cam Schlittler,TOR,0.176,0.08,0.086,0.418,0.254,0.32833333333333337,3.8144444444444443,"George Springer, Nathan Lukes, Vladimir Guerrero Jr., Alejandro Kirk, Daulton Varsho, Addison Barger, Anthony Santander, Ernie Clement, Andres Gimenez"
0,Louie Varland,NYY,0.245,0.102,0.14,0.391,0.313,0.3533333333333333,4.057777777777778,"Trent Grisham, Aaron Judge, Cody Bellinger, Ben Rice, Giancarlo Stanton, Jazz Chisholm, Ryan McMahon, Anthony Volpe, Austin Wells"
0,Yoshinobu Yamamoto,PHI,0.216,0.085,0.094,0.419,0.275,0.3382222222222222,3.898888888888889,"Trea Turner, Kyle Schwarber, Bryce Harper, Alec Bohm, Brandon Marsh, J.T. Realmuto, Max Kepler, Nick Castellanos, Bryson Stott"
0,Aaron Nola,LAD,0.206,0.092,0.101,0.385,0.305,0.3375555555555556,3.9444444444444446,"Shohei Ohtani, Mookie Betts, Freddie Freeman, Teoscar Hernandez, Max Muncy, Andy Pages, Enrique Hernandez, Miguel Rojas, Ben Rortvedt"
