,Pitcher,Opp,K%,BB%,Brl%,GB%,FB%,xwOBA,PPA,LU
0,Chris Sale,WSH,0.249,0.066,0.079,0.446,0.243,0.3105555555555556,3.8333333333333335,"C.J. Abrams, James Wood, Andres Chaparro, Daylen Lile, Riley Adams, Dylan Crews, Brady House, Paul DeJong, Jacob Young"
0,MacKenzie Gore,ATL,0.224,0.084,0.075,0.423,0.295,0.30377777777777776,3.913333333333333,"Jurickson Profar, Matt Olson, Ronald Acuna Jr., Ozzie Albies, Marcell Ozuna, Michael Harris II, Sandy Leon, Nacho Alvarez, Nick Allen"
0,Nick Pivetta,MIL,0.195,0.085,0.07,0.464,0.229,0.3238888888888889,3.921111111111111,"Sal Frelick, Jackson Chourio, Christian Yelich, William Contreras, Brice Turang, Caleb Durbin, Jake Bauers, Andrew Vaughn, Joey Ortiz"
0,Freddy Peralta,SD,0.184,0.074,0.089,0.422,0.26,0.3383333333333333,3.886666666666667,"Fernando Tatis Jr., Luis Arraez, Manny Machado, Jackson Merrill, Ramon Laureano, Gavin Sheets, ""Ryan OHearn"", Jake Cronenworth, Elias Diaz"
0,Justin Verlander,STL,0.192,0.069,0.066,0.448,0.232,0.30922222222222223,3.8400000000000003,"Brendan Donovan, Ivan Herrera, Nolan Arenado, Alec Burleson, Thomas Saggese, Lars Nootbaar, Jordan Walker, Yohel Pozo, Nathan Church"
0,Michael McGreevy,SF,0.243,0.087,0.134,0.413,0.285,0.33666666666666667,3.967777777777778,"Heliot Ramos, Rafael Devers, Willy Adames, Matt Chapman, Bryce Eldridge, Jung Hoo Lee, Christian Koss, Drew Gilbert, Andrew Knizner"
