,Pitcher,Opp,K%,BB%,Brl%,GB%,FB%,xwOBA,PPA,LU
0,Michael Soroka,BOS,0.249,0.076,0.09,0.446,0.276,0.30466666666666664,3.9066666666666663,"Jarren Duran, Roman Anthony, Abraham Toro, Carlos Narvaez, Wilyer Abreu, Trevor Story, Marcelo Mayer, David Hamilton, Ceddanne Rafaela"
0,Lucas Giolito,WSH,0.23,0.074,0.079,0.465,0.239,0.318,3.848888888888889,"C.J. Abrams, James Wood, Luis Garcia, Nathaniel Lowe, Josh Bell, Paul DeJong, Daylen Lile, Riley Adams, Jacob Young"
0,Jesus Luzardo,CIN,0.245,0.075,0.087,0.42,0.276,0.30922222222222223,3.8177777777777777,"TJ Friedl, Matt McLain, Elly De La Cruz, Austin Hays, Spencer Steer, Tyler Stephenson, Rece Hinds, Christian Encarnacion-Strand, Santiago Espinal"
0,Andrew Abbott,PHI,0.216,0.076,0.085,0.439,0.26,0.331,3.7655555555555558,"Trea Turner, Kyle Schwarber, Bryce Harper, Alec Bohm, Nick Castellanos, J.T. Realmuto, Otto Kemp, Edmundo Sosa, Johan Rojas"
0,Colin Rea,STL,0.207,0.078,0.077,0.407,0.259,0.31622222222222224,3.8655555555555554,"Brendan Donovan, Masyn Winn, Alec Burleson, Willson Contreras, Nolan Gorman, Nolan Arenado, Lars Nootbaar, Pedro Pages, Victor Scott II"
0,Miles Mikolas,CHC,0.212,0.096,0.097,0.389,0.296,0.3361111111111111,3.928888888888889,"Ian Happ, Kyle Tucker, Seiya Suzuki, Pete Crow-Armstrong, Dansby Swanson, Michael Busch, Carson Kelly, Nico Hoerner, Matt Shaw"
0,Brandon Waddell,NYY,0.237,0.096,0.134,0.415,0.296,0.3458888888888889,4.0055555555555555,"Trent Grisham, Aaron Judge, Ben Rice, Giancarlo Stanton, Cody Bellinger, Paul Goldschmidt, Jazz Chisholm, Anthony Volpe, D.J. LeMahieu"
0,Marcus Stroman,NYM,0.21,0.093,0.111,0.438,0.256,0.3488888888888889,3.974444444444444,"Francisco Lindor, Starling Marte, Juan Soto, Pete Alonso, Brandon Nimmo, Mark Vientos, Jeff McNeil, Luis Torrens, Brett Baty"
0,Bryan Woo,PIT,0.225,0.079,0.088,0.463,0.233,0.3207777777777777,3.902222222222222,"Spencer Horwitz, Andrew McCutchen, Bryan Reynolds, Nick Gonzales, Oneil Cruz, ""KeBryan Hayes"", Tommy Pham, Joey Bart, Isiah Kiner-Falefa"
0,Carmen Mlodzinski,SEA,0.251,0.093,0.085,0.412,0.28,0.31399999999999995,4.0744444444444445,"J.P. Crawford, Julio Rodriguez, Cal Raleigh, Randy Arozarena, Donovan Solano, Jorge Polanco, Mitch Garver, Dylan Moore, Ben Williamson"
0,Chris Paddack,TB,0.201,0.08,0.082,0.466,0.225,0.327,3.8544444444444443,"Josh Lowe, Brandon Lowe, Yandy Diaz, Jonathan Aranda, Junior Caminero, Jake Mangum, Chandler Simpson, Ha-Seong Kim, Matt Thaiss"
0,Zack Littell,MIN,0.231,0.074,0.095,0.395,0.282,0.32333333333333336,3.8777777777777778,"Byron Buxton, Trevor Larnach, Willi Castro, Brooks Lee, Carlos Correa, Matt Wallner, Ryan Jeffers, Kody Clemens, Harrison Bader"
0,Randy Vasquez,TEX,0.229,0.075,0.084,0.426,0.27,0.31600000000000006,3.841111111111111,"Josh Smith, Corey Seager, Marcus Semien, Adolis Garcia, Alejandro Osuna, Jonah Heim, Jake Burger, Billy McKinney, Ezequiel Duran"
0,Kumar Rocker,SD,0.197,0.073,0.079,0.421,0.269,0.31566666666666665,3.8533333333333335,"Fernando Tatis Jr., Jackson Merrill, Manny Machado, Luis Arraez, Gavin Sheets, Xander Bogaerts, Jake Cronenworth, Trenton Brooks, Martin Maldonado"
0,Eric Lauer,LAA,0.236,0.084,0.105,0.403,0.284,0.3348888888888889,3.966666666666667,"Zach Neto, Nolan Schanuel, Mike Trout, Taylor Ward, Jo Adell, Jorge Soler, ""Logan OHoppe"", Luis Rengifo, Chad Stevens"
0,Connor Brogdon,TOR,0.174,0.084,0.082,0.446,0.237,0.32899999999999996,3.8800000000000003,"Nathan Lukes, George Springer, Vladimir Guerrero Jr., Addison Barger, Alejandro Kirk, Ernie Clement, Andres Gimenez, Davis Schneider, Will Wagner"
0,Slade Cecconi,DET,0.233,0.078,0.084,0.381,0.285,0.318,3.948888888888889,"Colt Keith, Gleyber Torres, Wenceel Perez, Riley Greene, Spencer Torkelson, Zach McKinstry, Dillon Dingler, Parker Meadows, Javier Baez"
0,Reese Olson,CLE,0.215,0.09,0.072,0.394,0.284,0.30444444444444446,4.033333333333333,"Steven Kwan, Kyle Manzardo, Jose Ramirez, Carlos Santana, Lane Thomas, Nolan Jones, Daniel Schneemann, Bo Naylor, Brayan Rocchio"
0,Sandy Alcantara,MIL,0.198,0.092,0.062,0.469,0.226,0.31555555555555553,3.942222222222222,"Sal Frelick, William Contreras, Christian Yelich, Jackson Chourio, Brice Turang, Rhys Hoskins, Isaac Collins, Caleb Durbin, Joey Ortiz"
0,Quinn Priester,MIA,0.217,0.077,0.085,0.457,0.245,0.33111111111111113,3.7522222222222217,"Xavier Edwards, Jesus Sanchez, Otto Lopez, Agustin Ramirez, Kyle Stowers, Eric Wagaman, Liam Hicks, Connor Norby, Dane Myers"
0,Spencer Strider,BAL,0.244,0.081,0.106,0.429,0.28,0.33,3.9722222222222223,"Jackson Holliday, Jordan Westburg, Gunnar Henderson, ""Ryan OHearn"", ""Tyler ONeill"", Colton Cowser, Gary Sanchez, Cedric Mullins II, Ramon Urias"
0,Charlie Morton,ATL,0.213,0.096,0.102,0.437,0.261,0.3416666666666666,3.9844444444444442,"Ronald Acuna Jr., Matt Olson, Austin Riley, Marcell Ozuna, Jurickson Profar, Drake Baldwin, Ozzie Albies, Michael Harris II, Nick Allen"
0,Antonio Senzatela,CWS,0.215,0.093,0.068,0.393,0.292,0.3132222222222223,4.003333333333333,"Mike Tauchman, Chase Meidroth, Andrew Benintendi, Miguel Vargas, Kyle Teel, Lenyn Sosa, Josh Rojas, Brooks Baldwin, Colson Montgomery"
0,Adrian Houser,COL,0.27,0.064,0.078,0.485,0.241,0.2704444444444445,3.863333333333333,"Tyler Freeman, Hunter Goodman, Jordan Beck, Ryan McMahon, Thairo Estrada, Michael Toglia, Brenton Doyle, Yanquiel Fernandez, Ryan Ritter"
0,Ben Casparius,HOU,0.205,0.078,0.068,0.438,0.252,0.3115555555555556,3.8055555555555554,"Isaac Paredes, Jake Meyers, Jose Altuve, Cam Smith, Victor Caratini, Yainer Diaz, Christian Walker, Cooper Hummel, Mauricio Dubon"
0,Lance McCullers Jr.,LAD,0.218,0.091,0.112,0.39,0.314,0.3531111111111111,3.9922222222222223,"Shohei Ohtani, Freddie Freeman, Will Smith, Max Muncy, Teoscar Hernandez, Andy Pages, Michael Conforto, Tommy Edman, Hyeseong Kim"
0,Eduardo Rodriguez,KC,0.191,0.074,0.072,0.442,0.239,0.31722222222222224,3.807777777777778,"Jonathan India, Bobby Witt Jr., Maikel Garcia, Salvador Perez, Mark Canha, Jac Caglianone, Nick Loftin, Freddy Fermin, Drew Waters"
0,Kris Bubic,ARI,0.208,0.078,0.087,0.43,0.273,0.32366666666666666,3.821111111111111,"Ketel Marte, Geraldo Perdomo, Lourdes Gurriel Jr., Eugenio Suarez, Randal Grichuk, Blaze Alexander, James McCann, Tim Tawa, Alek Thomas"
0,JP Sears,SF,0.215,0.081,0.085,0.4,0.284,0.31266666666666665,3.9111111111111114,"Heliot Ramos, Willy Adames, Rafael Devers, Wilmer Flores, Luis Matos, Jung Hoo Lee, Patrick Bailey, Tyler Fitzgerald, Sergio Alcantara"
0,Justin Verlander,OAK,0.301,0.068,0.091,0.451,0.255,0.29733333333333334,3.8211111111111102,"Denzel Clarke, Tyler Soderstrom, Brent Rooker, Nick Kurtz, Maxwell Muncy, Austin Wynns, Luis Urias, Colby Thomas, Max Schuemann"
