,Pitcher,Opp,K%,BB%,Brl%,GB%,FB%,xwOBA,PPA,LU
0,Kolby Allard,LAD,0.208,0.097,0.116,0.363,0.33,0.35766666666666663,4.001111111111111,"Shohei Ohtani, Mookie Betts, Freddie Freeman, Teoscar Hernandez, Will Smith, Max Muncy, Andy Pages, Michael Conforto, Tommy Edman"
0,Clayton Kershaw,CLE,0.261,0.073,0.069,0.408,0.282,0.27666666666666667,3.92,"Angel Martinez, Gabriel Arias, Jose Ramirez, Lane Thomas, Kyle Manzardo, Jhonkensy Noel, Will Wilson, Austin Hedges, Nolan Jones"
0,Jackson Jobe,SF,0.241,0.087,0.098,0.386,0.287,0.31622222222222224,4.026666666666667,"Mike Yastrzemski, Heliot Ramos, Jung Hoo Lee, Wilmer Flores, Matt Chapman, Willy Adames, LaMonte Wade Jr., Tyler Fitzgerald, Sam Huff"
0,Landen Roupp,DET,0.237,0.077,0.095,0.402,0.297,0.3158888888888889,3.8988888888888886,"Kerry Carpenter, Gleyber Torres, Colt Keith, Riley Greene, Spencer Torkelson, Wenceel Perez, Jake Rogers, Trey Sweeney, Javier Baez"
0,Drew Rasmussen,MIN,0.213,0.07,0.076,0.432,0.269,0.3015555555555555,3.927777777777778,"Trevor Larnach, Ryan Jeffers, Carlos Correa, Brooks Lee, Ty France, Kody Clemens, Jonah Bride, Willi Castro, DaShawn Keirsey Jr."
0,Pablo Lopez,TB,0.23,0.073,0.08,0.444,0.236,0.3116666666666667,3.964444444444444,"Yandy Diaz, Josh Lowe, Brandon Lowe, Junior Caminero, Jonathan Aranda, Chandler Simpson, Jose Caballero, Kameron Misner, Danny Jansen"
0,Griffin Canning,CWS,0.218,0.092,0.066,0.429,0.262,0.30477777777777776,3.94888888888889,"Chase Meidroth, Mike Tauchman, Miguel Vargas, Andrew Benintendi, Luis Robert, Josh Palacios, Korey Lee, Lenyn Sosa, Josh Rojas"
0,Shane Smith,NYM,0.205,0.088,0.114,0.422,0.264,0.3491111111111111,4.015555555555555,"Francisco Lindor, Brandon Nimmo, Juan Soto, Pete Alonso, Brett Baty, Jared Young, Mark Vientos, Jeff McNeil, Francisco Alvarez"
0,Freddy Peralta,BOS,0.238,0.074,0.08,0.442,0.247,0.317,3.9322222222222223,"Jarren Duran, Rafael Devers, Kristian Campbell, Wilyer Abreu, Marcelo Mayer, Trevor Story, Abraham Toro, Connor Wong, Ceddanne Rafaela"
0,Brayan Bello,MIL,0.205,0.089,0.066,0.455,0.238,0.3134444444444444,3.9766666666666666,"Brice Turang, Jackson Chourio, William Contreras, Christian Yelich, Rhys Hoskins, Sal Frelick, Caleb Durbin, Jake Bauers, Joey Ortiz"
0,Lance McCullers Jr.,OAK,0.254,0.06,0.087,0.449,0.238,0.2977777777777778,3.7866666666666666,"Lawrence Butler, Jacob Wilson, Brent Rooker, Tyler Soderstrom, Miguel Andujar, Shea Langeliers, CJ Alexander, Luis Urias, Denzel Clarke"
0,Luis Severino,HOU,0.192,0.071,0.068,0.445,0.251,0.3165555555555556,3.7677777777777774,"Jeremy Pena, Isaac Paredes, Jose Altuve, Christian Walker, Victor Caratini, Jake Meyers, Yainer Diaz, Cam Smith, Mauricio Dubon"
0,Zac Gallen,PIT,0.237,0.083,0.091,0.451,0.24,0.31377777777777777,3.9377777777777774,"Oneil Cruz, Andrew McCutchen, Bryan Reynolds, Spencer Horwitz, Alexander Canario, ""KeBryan Hayes"", Adam Frazier, Isiah Kiner-Falefa, Henry Davis"
0,Paul Skenes,ARI,0.192,0.089,0.092,0.449,0.255,0.33911111111111114,3.898888888888889,"Corbin Carroll, Ketel Marte, Lourdes Gurriel Jr., Josh Naylor, Eugenio Suarez, Pavin Smith, Gabriel Moreno, Alek Thomas, Geraldo Perdomo"
0,Kyle Hart,MIA,0.202,0.069,0.084,0.462,0.227,0.3173333333333333,3.6855555555555557,"Agustin Ramirez, Eric Wagaman, Otto Lopez, Connor Norby, Kyle Stowers, Nick Fortes, Ronny Simon, Jesus Sanchez, Javier Sanoja"
0,Sandy Alcantara,SD,0.182,0.067,0.081,0.43,0.258,0.32455555555555554,3.7844444444444445,"Fernando Tatis Jr., Luis Arraez, Manny Machado, Jackson Merrill, Gavin Sheets, Xander Bogaerts, Jake Cronenworth, Luis Campusano, Martin Maldonado"
0,Cade Povich,STL,0.207,0.081,0.073,0.433,0.234,0.3186666666666667,3.9244444444444446,"Lars Nootbaar, Masyn Winn, Brendan Donovan, Willson Contreras, Ivan Herrera, Nolan Arenado, Pedro Pages, Jordan Walker, Victor Scott II"
0,Miles Mikolas,BAL,0.25,0.072,0.072,0.448,0.255,0.29888888888888887,3.9255555555555555,"Jackson Holliday, Ramon Urias, Gunnar Henderson, Ryan Mountcastle, ""Ryan OHearn"", Cedric Mullins II, Dylan Carlson, Heston Kjerstad, Maverick Handley"
0,Zack Wheeler,ATL,0.206,0.086,0.099,0.443,0.254,0.33699999999999997,3.9366666666666665,"Ronald Acuna Jr., Drake Baldwin, Marcell Ozuna, Matt Olson, Austin Riley, Alex Verdugo, Ozzie Albies, Michael Harris II, Nick Allen"
0,AJ Smith-Shawver,PHI,0.213,0.086,0.087,0.415,0.279,0.3362222222222222,3.897777777777778,"Bryson Stott, Trea Turner, Bryce Harper, Kyle Schwarber, Alec Bohm, Nick Castellanos, Max Kepler, J.T. Realmuto, Brandon Marsh"
0,Noah Cameron,CIN,0.228,0.085,0.066,0.416,0.271,0.2992222222222222,3.887777777777777,"TJ Friedl, Santiago Espinal, Elly De La Cruz, Austin Hays, Tyler Stephenson, Spencer Steer, Connor Joe, Matt McLain, Garrett Hampson"
0,Hunter Greene,KC,0.182,0.073,0.067,0.438,0.258,0.3097777777777778,3.855555555555556,"Jonathan India, Bobby Witt Jr., Vinnie Pasquantino, Salvador Perez, Maikel Garcia, John Rave, Michael Massey, Freddy Fermin, Kyle Isbel"
0,Matthew Boyd,COL,0.267,0.073,0.094,0.413,0.298,0.307,3.8000000000000003,"Jordan Beck, Ezequiel Tovar, Hunter Goodman, Ryan McMahon, Brenton Doyle, Michael Toglia, Tyler Freeman, Adael Amador, Jacob Stallings"
0,Tanner Gordon,CHC,0.224,0.098,0.093,0.387,0.288,0.3305555555555555,3.9433333333333334,"Ian Happ, Kyle Tucker, Seiya Suzuki, Pete Crow-Armstrong, Dansby Swanson, Michael Busch, Nico Hoerner, Matt Shaw, Reese McGuire"
0,Tyler Mahle,TOR,0.181,0.08,0.084,0.417,0.244,0.3235555555555556,3.801111111111111,"Bo Bichette, Vladimir Guerrero Jr., Daulton Varsho, Alejandro Kirk, George Springer, Anthony Santander, Addison Barger, Ernie Clement, Nathan Lukes"
0,Jose Urena,TEX,0.215,0.065,0.099,0.4,0.281,0.3232222222222222,3.7411111111111115,"Sam Haggerty, Wyatt Langford, Corey Seager, Josh Jung, Jake Burger, Adolis Garcia, Jonah Heim, Marcus Semien, Kyle Higashioka"
0,Yusei Kikuchi,NYY,0.227,0.098,0.113,0.422,0.289,0.3382222222222222,3.9444444444444446,"Paul Goldschmidt, Trent Grisham, Aaron Judge, Cody Bellinger, Anthony Volpe, Jasson Dominguez, D.J. LeMahieu, Austin Wells, Oswald Peraza"
0,Clarke Schmidt,LAA,0.253,0.081,0.087,0.451,0.26,0.3085555555555556,3.9099999999999997,"Tim Anderson, Nolan Schanuel, Yoan Moncada, Taylor Ward, Jorge Soler, ""Travis dArnaud"", Luis Rengifo, Jo Adell, Kyren Paris"
0,George Kirby,WSH,0.22,0.061,0.071,0.486,0.237,0.30077777777777776,3.73,"C.J. Abrams, James Wood, Nathaniel Lowe, Keibert Ruiz, Luis Garcia, Josh Bell, Robert Hassell III, Jose Tena, Daylen Lile"
0,Trevor Williams,SEA,0.248,0.091,0.095,0.403,0.286,0.31888888888888883,4.032222222222222,"J.P. Crawford, Jorge Polanco, Julio Rodriguez, Cal Raleigh, Randy Arozarena, Rowdy Tellez, Leody Taveras, Dylan Moore, Ben Williamson"
