,Pitcher,Opp,K%,BB%,Brl%,GB%,FB%,xwOBA,PPA,LU
0,Javier Assad,WSH,0.233,0.067,0.084,0.455,0.242,0.3194444444444444,3.81,"James Wood, C.J. Abrams, Josh Bell, Daylen Lile, Luis Garcia, Andres Chaparro, Riley Adams, Robert Hassell III, Brady House"
0,Jake Irvin,CHC,0.226,0.083,0.096,0.398,0.289,0.3253333333333333,3.8899999999999997,"Michael Busch, Ian Happ, Seiya Suzuki, Pete Crow-Armstrong, Nico Hoerner, Willi Castro, Dansby Swanson, Matt Shaw, Reese McGuire"
0,Andrew Abbott,NYM,0.207,0.093,0.106,0.443,0.253,0.34377777777777774,3.8988888888888886,"Francisco Lindor, Juan Soto, Pete Alonso, Mark Vientos, Brandon Nimmo, Starling Marte, Jeff McNeil, Francisco Alvarez, Luisangel Acuna"
0,David Peterson,CIN,0.226,0.074,0.071,0.441,0.247,0.303,3.8044444444444445,"TJ Friedl, Noelvi Marte, Elly De La Cruz, Miguel Andujar, Austin Hays, Spencer Steer, Tyler Stephenson, ""KeBryan Hayes"", Matt McLain"
0,Jack Flaherty,CWS,0.237,0.075,0.073,0.412,0.264,0.2916666666666667,3.8711111111111114,"Edgar Quero, Kyle Teel, Curtis Mead, Colson Montgomery, Chase Meidroth, Andrew Benintendi, Will Robertson, Bryan Ramos, Dominic Fletcher"
0,Shane Smith,DET,0.233,0.081,0.093,0.371,0.294,0.3291111111111111,3.985555555555556,"Colt Keith, Gleyber Torres, Kerry Carpenter, Riley Greene, Spencer Torkelson, Wenceel Perez, Zach McKinstry, Dillon Dingler, Parker Meadows"
0,Johan Oviedo,MIL,0.198,0.087,0.065,0.446,0.238,0.31755555555555554,3.923333333333334,"Brice Turang, Isaac Collins, Jackson Chourio, William Contreras, Sal Frelick, Andrew Vaughn, Jake Bauers, Caleb Durbin, Joey Ortiz"
0,Quinn Priester,PIT,0.236,0.09,0.094,0.441,0.245,0.33511111111111114,3.9633333333333334,"Jared Triolo, Spencer Horwitz, Bryan Reynolds, Tommy Pham, Andrew McCutchen, Nick Gonzales, Oneil Cruz, Joey Bart, Nick Yorke"
0,Dean Kremer,LAD,0.227,0.082,0.104,0.402,0.288,0.3360000000000001,3.894444444444444,"Shohei Ohtani, Mookie Betts, Freddie Freeman, Teoscar Hernandez, Michael Conforto, Andy Pages, Hyeseong Kim, Dalton Rushing, Miguel Rojas"
0,Shohei Ohtani,BAL,0.251,0.082,0.088,0.456,0.257,0.3188888888888889,3.902222222222222,"Jackson Holliday, Jeremiah Jackson, Gunnar Henderson, Ryan Mountcastle, Colton Cowser, Emmanuel Rivera, Dylan Beavers, Samuel Basallo, Coby Mayo"
0,Cam Schlittler,TOR,0.173,0.076,0.084,0.436,0.236,0.33111111111111113,3.7477777777777774,"George Springer, Addison Barger, Vladimir Guerrero Jr., Bo Bichette, Daulton Varsho, Alejandro Kirk, Nathan Lukes, Ernie Clement, Andres Gimenez"
0,Kevin Gausman,NYY,0.246,0.1,0.14,0.39,0.308,0.3523333333333334,4.056666666666667,"Trent Grisham, Ben Rice, Aaron Judge, Cody Bellinger, Giancarlo Stanton, Jazz Chisholm, Paul Goldschmidt, Ryan McMahon, Jose Caballero"
0,Valente Bellozo,PHI,0.22,0.086,0.094,0.427,0.269,0.33488888888888885,3.923333333333334,"Trea Turner, Kyle Schwarber, Bryce Harper, J.T. Realmuto, Brandon Marsh, Harrison Bader, Max Kepler, Alec Bohm, Bryson Stott"
0,Cristopher Sanchez,MIA,0.232,0.082,0.086,0.441,0.277,0.3234444444444444,3.7133333333333334,"Otto Lopez, Agustin Ramirez, Jakob Marsee, Heriberto Hernandez, Eric Wagaman, Joey Wiemer, Maximo Acosta, Victor Mesa Jr., Javier Sanoja"
0,Chris Sale,SEA,0.264,0.093,0.105,0.397,0.295,0.32866666666666666,4.022222222222222,"Randy Arozarena, Cal Raleigh, Julio Rodriguez, Eugenio Suarez, Jorge Polanco, Mitch Garver, Dominic Canzone, Leo Rivas, Luke Raley"
0,Logan Gilbert,ATL,0.196,0.091,0.079,0.421,0.252,0.32966666666666666,3.9699999999999998,"Jurickson Profar, Matt Olson, Ozzie Albies, Drake Baldwin, Ha-Seong Kim, Michael Harris II, Marcell Ozuna, Jake Fraley, Nacho Alvarez"
0,Griffin Jax,CLE,0.229,0.071,0.061,0.406,0.273,0.2851111111111111,3.8800000000000003,"Steven Kwan, Angel Martinez, Jose Ramirez, David Fry, Nolan Jones, Gabriel Arias, Jhonkensy Noel, Brayan Rocchio, Austin Hedges"
0,Gavin Williams,TB,0.239,0.082,0.067,0.493,0.21,0.301,3.8344444444444443,"Richie Palacios, Yandy Diaz, Brandon Lowe, Junior Caminero, Josh Lowe, Jake Mangum, Hunter Feduccia, Carson Williams, Bobby Seymour"
0,Michael Wacha,MIN,0.231,0.084,0.099,0.382,0.293,0.3238888888888889,3.873333333333333,"Byron Buxton, Trevor Larnach, Luke Keaschall, Matt Wallner, Ryan Jeffers, Kody Clemens, Royce Lewis, Brooks Lee, James Outman"
0,Pablo Lopez,KC,0.183,0.064,0.083,0.408,0.269,0.32333333333333336,3.7777777777777777,"Mike Yastrzemski, Bobby Witt Jr., Vinnie Pasquantino, Maikel Garcia, Salvador Perez, Adam Frazier, Michael Massey, Jac Caglianone, Kyle Isbel"
0,Merrill Kelly,HOU,0.209,0.081,0.091,0.44,0.253,0.33355555555555555,3.823333333333333,"Jeremy Pena, Yordan Alvarez, Jose Altuve, Carlos Correa, Jesus Sanchez, Christian Walker, Victor Caratini, Taylor Trammell, Cam Smith"
0,Colton Gordon,TEX,0.217,0.068,0.082,0.407,0.283,0.2972222222222222,3.9311111111111114,"Michael Helman, Cody Freeman, Wyatt Langford, Jake Burger, Kyle Higashioka, Josh Jung, Ezequiel Duran, Dylan Moore, Josh Smith"
0,Michael McGreevy,SF,0.226,0.083,0.098,0.398,0.288,0.3245555555555556,3.907777777777778,"Heliot Ramos, Rafael Devers, Willy Adames, Dominic Smith, Matt Chapman, Jung Hoo Lee, Casey Schmitt, Drew Gilbert, Patrick Bailey"
0,Carson Seymour,STL,0.259,0.073,0.067,0.41,0.281,0.29844444444444446,4.078888888888888,"Lars Nootbaar, Ivan Herrera, Nolan Gorman, Masyn Winn, Jimmy Crooks III, Thomas Saggese, Jordan Walker, Victor Scott II, Jose Fermin"
0,Kyle Freeland,SD,0.191,0.07,0.075,0.463,0.244,0.3218888888888889,3.862222222222223,"Fernando Tatis Jr., Luis Arraez, Manny Machado, Ramon Laureano, Jackson Merrill, Jake Cronenworth, Jose Iglesias, Mason McCoy, Freddy Fermin"
0,Nick Pivetta,COL,0.244,0.06,0.077,0.423,0.276,0.29200000000000004,3.755555555555555,"Tyler Freeman, Mickey Moniak, Hunter Goodman, Jordan Beck, Brenton Doyle, Ezequiel Tovar, Kyle Karros, Yanquiel Fernandez, Orlando Arcia"
0,Jose Soriano,OAK,0.233,0.087,0.103,0.429,0.266,0.3263333333333333,3.774444444444445,"Nick Kurtz, Jacob Wilson, Brent Rooker, Tyler Soderstrom, Shea Langeliers, Lawrence Butler, Zack Gelof, JJ Bleday, Darell Hernaiz"
0,Mason Barnett,LAA,0.264,0.078,0.105,0.417,0.281,0.3141111111111112,3.8899999999999997,"Zach Neto, Yoan Moncada, Mike Trout, Taylor Ward, Jo Adell, Luis Rengifo, ""Logan OHoppe"", Oswald Peraza, Bryce Teodosio"
0,Eduardo Rodriguez,BOS,0.236,0.065,0.076,0.44,0.247,0.31255555555555553,3.8388888888888895,"Nate Eaton, Alex Bregman, Trevor Story, Romy Gonzalez, Rob Refsnyder, Jarren Duran, Ceddanne Rafaela, Nick Sogard, Connor Wong"
0,Payton Tolle,ARI,0.229,0.081,0.064,0.475,0.259,0.28755555555555556,3.9188888888888886,"Ketel Marte, Geraldo Perdomo, Corbin Carroll, Gabriel Moreno, Blaze Alexander, Ildemaro Vargas, Jordan Lawlar, Tyler Locklear, Jorge Barrosa"
