,Pitcher,Opp,K%,BB%,Brl%,GB%,FB%,xwOBA,PPA,LU
0,Colin Rea,BOS,0.229,0.076,0.092,0.445,0.267,0.3138888888888889,3.8577777777777778,"Jarren Duran, Alex Bregman, Roman Anthony, Carlos Narvaez, Wilyer Abreu, Trevor Story, Marcelo Mayer, Ceddanne Rafaela, Abraham Toro"
0,Lucas Giolito,CHC,0.211,0.095,0.1,0.386,0.303,0.3375555555555556,3.9244444444444446,"Michael Busch, Kyle Tucker, Seiya Suzuki, Pete Crow-Armstrong, Carson Kelly, Ian Happ, Dansby Swanson, Nico Hoerner, Matt Shaw"
0,Bailey Falter,CWS,0.226,0.093,0.059,0.417,0.251,0.30622222222222223,3.9755555555555557,"Chase Meidroth, Austin Slater, Edgar Quero, Miguel Vargas, Andrew Benintendi, Luis Robert, Lenyn Sosa, Colson Montgomery, Michael A. Taylor"
0,Jonathan Cannon,PIT,0.227,0.078,0.087,0.463,0.234,0.3188888888888889,3.8988888888888886,"Tommy Pham, Andrew McCutchen, Bryan Reynolds, Nick Gonzales, Oneil Cruz, Joey Bart, Spencer Horwitz, ""KeBryan Hayes"", Isiah Kiner-Falefa"
0,Michael Soroka,SD,0.182,0.073,0.077,0.426,0.261,0.321,3.8455555555555554,"Fernando Tatis Jr., Luis Arraez, Manny Machado, Gavin Sheets, Jackson Merrill, Xander Bogaerts, Jake Cronenworth, Trenton Brooks, Elias Diaz"
0,Dylan Cease,WSH,0.217,0.073,0.073,0.477,0.232,0.3217777777777778,3.7922222222222217,"C.J. Abrams, James Wood, Luis Garcia, Josh Bell, Nathaniel Lowe, Brady House, Daylen Lile, Riley Adams, Jacob Young"
0,Jesus Luzardo,LAA,0.231,0.082,0.101,0.408,0.279,0.3302222222222222,3.9177777777777774,"Zach Neto, Nolan Schanuel, Mike Trout, Taylor Ward, Jo Adell, Jorge Soler, ""Logan OHoppe"", Luis Rengifo, Kevin Newman"
0,Ryan Zeferjahn,PHI,0.216,0.087,0.092,0.417,0.278,0.3367777777777778,3.906666666666667,"Trea Turner, Kyle Schwarber, Bryce Harper, Alec Bohm, Nick Castellanos, Brandon Marsh, J.T. Realmuto, Max Kepler, Bryson Stott"
0,Chris Bassitt,SF,0.233,0.091,0.1,0.399,0.292,0.32466666666666666,3.9366666666666665,"Mike Yastrzemski, Heliot Ramos, Rafael Devers, Matt Chapman, Willy Adames, Jung Hoo Lee, Casey Schmitt, Dominic Smith, Patrick Bailey"
0,Justin Verlander,TOR,0.181,0.078,0.079,0.454,0.225,0.3307777777777778,3.7944444444444443,"Nathan Lukes, George Springer, Vladimir Guerrero Jr., Bo Bichette, Addison Barger, Alejandro Kirk, Joey Loperfido, Ernie Clement, Will Wagner"
0,Sean Manaea,CIN,0.224,0.078,0.07,0.426,0.261,0.3002222222222222,3.826666666666666,"TJ Friedl, Matt McLain, Elly De La Cruz, Austin Hays, Spencer Steer, Noelvi Marte, Tyler Stephenson, Jose Trevino, Santiago Espinal"
0,Nick Lodolo,NYM,0.219,0.09,0.11,0.412,0.27,0.34411111111111103,3.9622222222222216,"Francisco Lindor, Mark Vientos, Juan Soto, Pete Alonso, Brandon Nimmo, Ronny Mauricio, Jeff McNeil, Tyrone Taylor, Luis Torrens"
0,Slade Cecconi,OAK,0.246,0.073,0.099,0.452,0.261,0.3138888888888889,3.7844444444444445,"Lawrence Butler, Jacob Wilson, Nick Kurtz, Brent Rooker, Tyler Soderstrom, Shea Langeliers, Miguel Andujar, Maxwell Muncy, Denzel Clarke"
0,JP Sears,CLE,0.242,0.089,0.056,0.435,0.262,0.27999999999999997,4.044444444444443,"Angel Martinez, David Fry, Jose Ramirez, Carlos Santana, Nolan Jones, Johnathan Rodriguez, Will Wilson, Bo Naylor, Brayan Rocchio"
0,Sandy Alcantara,KC,0.184,0.073,0.079,0.437,0.254,0.32433333333333336,3.8055555555555554,"Jonathan India, Bobby Witt Jr., Vinnie Pasquantino, Maikel Garcia, Salvador Perez, Jac Caglianone, Nick Loftin, John Rave, Kyle Isbel"
0,Seth Lugo,MIA,0.208,0.074,0.077,0.459,0.24,0.31677777777777777,3.7333333333333334,"Xavier Edwards, Jesus Sanchez, Otto Lopez, Agustin Ramirez, Kyle Stowers, Liam Hicks, Dane Myers, Graham Pauley, Nick Fortes"
0,Spencer Strider,NYY,0.233,0.099,0.12,0.405,0.301,0.34199999999999997,3.998888888888889,"Trent Grisham, Cody Bellinger, Aaron Judge, Jazz Chisholm, Jasson Dominguez, Ben Rice, Anthony Volpe, Austin Wells, Jorbit Vivas"
0,Ian Hamilton,ATL,0.216,0.085,0.083,0.471,0.234,0.3174444444444445,3.928888888888889,"Jurickson Profar, Matt Olson, Ronald Acuna Jr., Drake Baldwin, Sean Murphy, Ozzie Albies, Nacho Alvarez, Michael Harris II, Nick Allen"
0,Taj Bradley,BAL,0.251,0.076,0.094,0.434,0.266,0.3194444444444444,3.9155555555555557,"Jackson Holliday, Jordan Westburg, Gunnar Henderson, ""Ryan OHearn"", Ramon Laureano, Colton Cowser, Cedric Mullins II, Coby Mayo, Jacob Stallings"
0,Charlie Morton,TB,0.191,0.074,0.079,0.459,0.223,0.32499999999999996,3.8600000000000003,"Chandler Simpson, Brandon Lowe, Yandy Diaz, Jonathan Aranda, Junior Caminero, Josh Lowe, Jake Mangum, Ha-Seong Kim, Danny Jansen"
0,Patrick Corbin,DET,0.233,0.078,0.092,0.381,0.287,0.32233333333333336,3.9433333333333334,"Matt Vierling, Gleyber Torres, Jahmai Jones, Riley Greene, Spencer Torkelson, Wenceel Perez, Javier Baez, Dillon Dingler, Zach McKinstry"
0,Reese Olson,TEX,0.213,0.077,0.091,0.389,0.298,0.3176666666666666,3.886666666666667,"Josh Smith, Corey Seager, Marcus Semien, Adolis Garcia, Evan Carter, Wyatt Langford, Jonah Heim, Rowdy Tellez, Kyle Higashioka"
0,Kyle Freeland,MIN,0.209,0.067,0.085,0.406,0.274,0.3141111111111111,3.804444444444444,"Byron Buxton, Ryan Jeffers, Willi Castro, Carlos Correa, Ty France, Harrison Bader, Royce Lewis, Brooks Lee, Christian Vazquez"
0,Chris Paddack,COL,0.249,0.061,0.073,0.45,0.248,0.28622222222222227,3.876666666666667,"Tyler Freeman, Mickey Moniak, Jordan Beck, Ryan McMahon, Ezequiel Tovar, Michael Toglia, Yanquiel Fernandez, Austin Nola, Ryan Ritter"
0,Brandon Pfaadt,STL,0.197,0.073,0.063,0.441,0.241,0.30777777777777776,3.876666666666667,"Brendan Donovan, Ivan Herrera, Alec Burleson, Willson Contreras, Thomas Saggese, Masyn Winn, Jose Fermin, Pedro Pages, Victor Scott II"
0,Andre Pallante,ARI,0.191,0.085,0.076,0.443,0.26,0.32433333333333336,3.836666666666667,"Corbin Carroll, Ketel Marte, Geraldo Perdomo, Josh Naylor, Eugenio Suarez, Lourdes Gurriel Jr., Jake McCarthy, Alek Thomas, Jose Herrera"
0,Luis Castillo,HOU,0.258,0.071,0.065,0.393,0.277,0.2870000000000001,3.9066666666666663,"Isaac Paredes, Cam Smith, Jose Altuve, Christian Walker, Victor Caratini, Yainer Diaz, Taylor Trammell, Mauricio Dubon, Brice Matthews"
0,Brandon Walter,SEA,0.25,0.093,0.086,0.409,0.283,0.3135555555555556,4.075555555555557,"J.P. Crawford, Julio Rodriguez, Cal Raleigh, Randy Arozarena, Mitch Garver, Jorge Polanco, Donovan Solano, Dylan Moore, Ben Williamson"
0,Tyler Glasnow,MIL,0.21,0.091,0.069,0.462,0.234,0.32,3.927777777777778,"Brice Turang, William Contreras, Jackson Chourio, Christian Yelich, Andrew Vaughn, Isaac Collins, Caleb Durbin, Jake Bauers, Joey Ortiz"
0,Quinn Priester,LAD,0.231,0.083,0.102,0.392,0.299,0.3363333333333333,3.9044444444444446,"Shohei Ohtani, Mookie Betts, Freddie Freeman, Teoscar Hernandez, Michael Conforto, Andy Pages, Hyeseong Kim, Tommy Edman, Dalton Rushing"
