,Pitcher,Opp,K%,BB%,Brl%,GB%,FB%,xwOBA,PPA,LU
0,Lucas Giolito,HOU,0.199,0.072,0.081,0.457,0.236,0.3214444444444445,3.7333333333333325,"Jeremy Pena, Jose Altuve, Jesus Sanchez, Carlos Correa, Christian Walker, Yainer Diaz, Taylor Trammell, Mauricio Dubon, Ramon Urias"
0,Framber Valdez,BOS,0.233,0.074,0.093,0.445,0.254,0.32022222222222224,3.8711111111111114,"Rob Refsnyder, Alex Bregman, Roman Anthony, Romy Gonzalez, Trevor Story, Ceddanne Rafaela, Abraham Toro, Wilyer Abreu, Connor Wong"
0,Joe Boyle,LAD,0.211,0.093,0.091,0.362,0.284,0.34455555555555556,3.9377777777777774,"Shohei Ohtani, Mookie Betts, Freddie Freeman, Will Smith, Michael Conforto, Andy Pages, Alex Freeland, Tommy Edman, Alex Call"
0,Yoshinobu Yamamoto,TB,0.212,0.082,0.065,0.468,0.237,0.2983333333333334,3.9033333333333338,"Yandy Diaz, Brandon Lowe, Junior Caminero, Josh Lowe, Ha-Seong Kim, Hunter Feduccia, Jake Mangum, Jonny DeLuca, Taylor Walls"
0,Brad Lord,MIL,0.211,0.084,0.058,0.5,0.222,0.3076666666666667,3.8966666666666665,"Brice Turang, William Contreras, Andrew Vaughn, Christian Yelich, Isaac Collins, Blake Perkins, Anthony Seigler, Brandon Lockridge, Joey Ortiz"
0,Logan Henderson,WSH,0.21,0.068,0.071,0.494,0.217,0.31666666666666665,3.8144444444444443,"C.J. Abrams, James Wood, Luis Garcia, Josh Bell, Daylen Lile, Jose Tena, Robert Hassell III, Drew Millas, Jacob Young"
0,Chris Bassitt,KC,0.189,0.079,0.076,0.424,0.268,0.32333333333333336,3.92,"Jonathan India, Bobby Witt Jr., Vinnie Pasquantino, Maikel Garcia, Salvador Perez, Mike Yastrzemski, Adam Frazier, John Rave, Kyle Isbel"
0,Seth Lugo,TOR,0.186,0.071,0.073,0.43,0.243,0.31766666666666665,3.7255555555555557,"Nathan Lukes, Joey Loperfido, Vladimir Guerrero Jr., Bo Bichette, Addison Barger, Alejandro Kirk, Daulton Varsho, Ernie Clement, Myles Straw"
0,Frankie Montas,SF,0.248,0.086,0.103,0.409,0.287,0.3214444444444445,3.927777777777777,"Heliot Ramos, Rafael Devers, Willy Adames, Matt Chapman, Dominic Smith, Casey Schmitt, Jung Hoo Lee, Patrick Bailey, Grant McCray"
0,Carson Whisenhunt,NYM,0.21,0.095,0.104,0.423,0.264,0.3402222222222222,3.961111111111111,"Brandon Nimmo, Francisco Lindor, Juan Soto, Pete Alonso, Starling Marte, Jeff McNeil, Mark Vientos, Cedric Mullins II, Francisco Alvarez"
0,Joey Cantillo,MIN,0.225,0.079,0.083,0.398,0.291,0.31033333333333335,3.8588888888888886,"Austin Martin, Ryan Jeffers, Matt Wallner, Royce Lewis, Kody Clemens, Brooks Lee, Trevor Larnach, Christian Vazquez, Edouard Julien"
0,Jose Urena,CLE,0.228,0.076,0.069,0.423,0.286,0.2987777777777778,3.908888888888889,"Steven Kwan, Daniel Schneemann, Jose Ramirez, Kyle Manzardo, Bo Naylor, Gabriel Arias, Nolan Jones, C.J. Kayfus, Angel Martinez"
0,Edward Cabrera,NYY,0.244,0.094,0.115,0.411,0.295,0.3293333333333333,4.027777777777777,"Trent Grisham, Ben Rice, Cody Bellinger, Giancarlo Stanton, Jazz Chisholm, Jasson Dominguez, Ryan McMahon, Anthony Volpe, Austin Wells"
0,Luis Gil,MIA,0.219,0.118,0.066,0.398,0.2,0.31833333333333336,3.961111111111111,"Xavier Edwards, Kyle Stowers, Agustin Ramirez, Liam Hicks, Otto Lopez, Jakob Marsee, Heriberto Hernandez, Graham Pauley, Troy Johnston"
0,Colin Rea,BAL,0.247,0.067,0.084,0.425,0.249,0.29800000000000004,3.9655555555555555,"Jackson Holliday, Jordan Westburg, Gunnar Henderson, Adley Rutschman, Jeremiah Jackson, Colton Cowser, Dylan Carlson, Coby Mayo, Alex Jackson"
0,Brandon Young,CHC,0.216,0.095,0.102,0.381,0.308,0.3402222222222222,3.922222222222222,"Michael Busch, Kyle Tucker, Seiya Suzuki, Pete Crow-Armstrong, Carson Kelly, Ian Happ, Willi Castro, Nico Hoerner, Dansby Swanson"
0,Bradley Blalock,PIT,0.25,0.079,0.094,0.444,0.249,0.3097777777777778,3.918888888888889,"Spencer Horwitz, Bryan Reynolds, Nick Gonzales, Oneil Cruz, Tommy Pham, Liover Peguero, Jack Suwinski, Henry Davis, Jared Triolo"
0,Mitch Keller,COL,0.229,0.05,0.074,0.411,0.275,0.27566666666666667,3.7466666666666666,"Tyler Freeman, Mickey Moniak, Hunter Goodman, Jordan Beck, Ezequiel Tovar, Warming Bernabel, Thairo Estrada, Yanquiel Fernandez, Orlando Arcia"
0,Jack Perkins,ARI,0.225,0.08,0.058,0.468,0.24,0.2874444444444444,3.8955555555555557,"Corbin Carroll, Blaze Alexander, Geraldo Perdomo, Lourdes Gurriel Jr., Jake McCarthy, Tyler Locklear, Alek Thomas, Connor Kaiser, Jose Herrera"
0,Eduardo Rodriguez,OAK,0.276,0.082,0.087,0.414,0.273,0.30488888888888893,3.8788888888888886,"Max Schuemann, Nick Kurtz, Brent Rooker, Shea Langeliers, Colby Thomas, Austin Wynns, Darell Hernaiz, JJ Bleday, Luis Urias"
0,Jack Kochanowicz,CWS,0.232,0.082,0.08,0.386,0.285,0.3154444444444444,3.873333333333333,"Mike Tauchman, Lenyn Sosa, Andrew Benintendi, Luis Robert, Colson Montgomery, Edgar Quero, Kyle Teel, Brooks Baldwin, Josh Rojas"
0,Sean Burke,LAA,0.251,0.081,0.092,0.435,0.281,0.30900000000000005,3.9300000000000006,"Zach Neto, Nolan Schanuel, Mike Trout, Taylor Ward, Jo Adell, Luis Rengifo, ""Travis dArnaud"", Christian Moore, Bryce Teodosio"
0,Dylan Cease,STL,0.198,0.071,0.069,0.424,0.244,0.3101111111111111,3.8322222222222226,"Brendan Donovan, Ivan Herrera, Alec Burleson, Willson Contreras, Masyn Winn, Jordan Walker, Yohel Pozo, Thomas Saggese, Victor Scott II"
0,Andre Pallante,SD,0.172,0.072,0.084,0.436,0.256,0.33755555555555555,3.8455555555555554,"Fernando Tatis Jr., Luis Arraez, Manny Machado, Jackson Merrill, Xander Bogaerts, ""Ryan OHearn"", Ramon Laureano, Jake Cronenworth, Freddy Fermin"
0,Logan Evans,TEX,0.216,0.087,0.099,0.391,0.29,0.33399999999999996,3.9699999999999998,"Josh Smith, Corey Seager, Marcus Semien, Adolis Garcia, Joc Pederson, Wyatt Langford, Rowdy Tellez, Kyle Higashioka, Alejandro Osuna"
0,Jacob deGrom,SEA,0.234,0.088,0.103,0.4,0.299,0.3318888888888889,3.926666666666667,"Randy Arozarena, Cal Raleigh, Julio Rodriguez, Josh Naylor, Eugenio Suarez, Jorge Polanco, Dominic Canzone, J.P. Crawford, Cole Young"
0,Cristopher Sanchez,DET,0.238,0.072,0.09,0.375,0.286,0.31466666666666665,3.913333333333333,"Jahmai Jones, Gleyber Torres, Andy Ibanez, Spencer Torkelson, Riley Greene, Matt Vierling, Dillon Dingler, Wenceel Perez, Javier Baez"
0,Charlie Morton,PHI,0.226,0.085,0.093,0.417,0.281,0.33255555555555555,3.9244444444444446,"Trea Turner, Kyle Schwarber, Bryce Harper, J.T. Realmuto, Nick Castellanos, Brandon Marsh, Max Kepler, Edmundo Sosa, Bryson Stott"
