,Pitcher,Opp,K%,BB%,Brl%,GB%,FB%,xwOBA,PPA,LU
0,Gavin Williams,DET,0.241,0.077,0.092,0.374,0.293,0.3215555555555556,3.968888888888889,"Parker Meadows, Gleyber Torres, Kerry Carpenter, Spencer Torkelson, Riley Greene, Wenceel Perez, Dillon Dingler, Zach McKinstry, Javier Baez"
0,Tarik Skubal,CLE,0.231,0.075,0.061,0.421,0.266,0.2885555555555556,3.8800000000000003,"Steven Kwan, Angel Martinez, Jose Ramirez, Johnathan Rodriguez, Kyle Manzardo, Gabriel Arias, Brayan Rocchio, Jhonkensy Noel, Austin Hedges"
0,Matthew Boyd,SD,0.168,0.071,0.074,0.443,0.247,0.3302222222222222,3.8777777777777778,"Fernando Tatis Jr., Luis Arraez, Manny Machado, Jackson Merrill, Xander Bogaerts, Gavin Sheets, Jose Iglesias, Jake Cronenworth, Freddy Fermin"
0,Nick Pivetta,CHC,0.209,0.095,0.099,0.386,0.301,0.3403333333333333,3.92,"Michael Busch, Nico Hoerner, Ian Happ, Kyle Tucker, Seiya Suzuki, Carson Kelly, Pete Crow-Armstrong, Dansby Swanson, Matt Shaw"
0,Max Fried,BOS,0.233,0.069,0.083,0.445,0.251,0.317,3.852222222222222,"Romy Gonzalez, Alex Bregman, Trevor Story, Rob Refsnyder, Carlos Narvaez, Nate Eaton, Nick Sogard, Jarren Duran, Ceddanne Rafaela"
0,Garrett Crochet,NYY,0.241,0.084,0.12,0.411,0.287,0.33922222222222215,3.9844444444444442,"Paul Goldschmidt, Aaron Judge, Cody Bellinger, Giancarlo Stanton, Amed Rosario, Austin Slater, Jazz Chisholm, Anthony Volpe, Austin Wells"
0,Blake Snell,CIN,0.228,0.075,0.079,0.433,0.263,0.31433333333333335,3.835555555555556,"TJ Friedl, Noelvi Marte, Miguel Andujar, Spencer Steer, Sal Stewart, Elly De La Cruz, Tyler Stephenson, ""KeBryan Hayes"", Matt McLain"
0,Hunter Greene,LAD,0.224,0.083,0.098,0.404,0.29,0.3297777777777778,3.9588888888888882,"Shohei Ohtani, Mookie Betts, Freddie Freeman, Teoscar Hernandez, Michael Conforto, Andy Pages, Enrique Hernandez, Hyeseong Kim, Ben Rortvedt"
