,Pitcher,Opp,K%,BB%,Brl%,GB%,FB%,xwOBA,PPA,LU
0,Zack Littell,MIA,0.202,0.072,0.072,0.467,0.217,0.31677777777777777,3.695555555555556,"Xavier Edwards, Jesus Sanchez, Agustin Ramirez, Kyle Stowers, Otto Lopez, Eric Wagaman, Dane Myers, Nick Fortes, Javier Sanoja"
0,Janson Junk,TB,0.241,0.081,0.088,0.452,0.24,0.3138888888888889,3.9922222222222223,"Josh Lowe, Brandon Lowe, Yandy Diaz, Jonathan Aranda, Junior Caminero, Jake Mangum, Matt Thaiss, Jose Caballero, Kameron Misner"
0,Bailey Falter,PHI,0.22,0.079,0.093,0.432,0.259,0.3296666666666666,3.815555555555555,"Trea Turner, Bryce Harper, Kyle Schwarber, Alec Bohm, Nick Castellanos, J.T. Realmuto, Edmundo Sosa, Weston Wilson, Johan Rojas"
0,Joe Ross,PIT,0.238,0.078,0.095,0.449,0.25,0.31444444444444447,3.823333333333333,"Oneil Cruz, Andrew McCutchen, Bryan Reynolds, Spencer Horwitz, Alexander Canario, Nick Gonzales, ""KeBryan Hayes"", Endy Rodriguez, Isiah Kiner-Falefa"
0,Michael Soroka,TEX,0.221,0.072,0.095,0.405,0.293,0.319,3.801111111111111,"Josh Smith, Wyatt Langford, Corey Seager, Josh Jung, Evan Carter, Marcus Semien, Adolis Garcia, Jake Burger, Jonah Heim"
0,Patrick Corbin,WSH,0.199,0.069,0.072,0.471,0.234,0.3211111111111111,3.7733333333333334,"C.J. Abrams, Amed Rosario, James Wood, Nathaniel Lowe, Keibert Ruiz, Josh Bell, Alex Call, Luis Garcia, Robert Hassell III"
0,Will Warren,BOS,0.251,0.079,0.087,0.449,0.256,0.31444444444444447,3.9577777777777774,"Jarren Duran, Rafael Devers, Wilyer Abreu, Carlos Narvaez, Marcelo Mayer, Abraham Toro, Trevor Story, Ceddanne Rafaela, Kristian Campbell"
0,Walker Buehler,NYY,0.226,0.095,0.123,0.414,0.303,0.3437777777777778,3.994444444444445,"Trent Grisham, Ben Rice, Aaron Judge, Cody Bellinger, Paul Goldschmidt, Jazz Chisholm, Anthony Volpe, Austin Wells, D.J. LeMahieu"
0,Nick Lodolo,ARI,0.182,0.085,0.087,0.435,0.261,0.33522222222222225,3.867777777777778,"Ketel Marte, Corbin Carroll, Lourdes Gurriel Jr., Eugenio Suarez, Randal Grichuk, Gabriel Moreno, Tim Tawa, Ildemaro Vargas, Geraldo Perdomo"
0,Eduardo Rodriguez,CIN,0.224,0.089,0.06,0.409,0.277,0.2887777777777778,3.938888888888888,"TJ Friedl, Santiago Espinal, Spencer Steer, Tyler Stephenson, Connor Joe, Jose Trevino, Will Benson, Matt McLain, Garrett Hampson"
0,Tarik Skubal,CHC,0.202,0.1,0.088,0.388,0.287,0.3368888888888889,3.9655555555555555,"Ian Happ, Kyle Tucker, Seiya Suzuki, Carson Kelly, Pete Crow-Armstrong, Dansby Swanson, Nico Hoerner, Justin Turner, Matt Shaw"
0,Ben Brown,DET,0.245,0.075,0.093,0.385,0.299,0.31633333333333336,3.946666666666667,"Parker Meadows, Gleyber Torres, Kerry Carpenter, Riley Greene, Spencer Torkelson, Wenceel Perez, Dillon Dingler, Trey Sweeney, Javier Baez"
0,Logan Allen,HOU,0.201,0.068,0.069,0.45,0.245,0.31366666666666665,3.771111111111111,"Jeremy Pena, Isaac Paredes, Jose Altuve, Christian Walker, Yainer Diaz, Jake Meyers, Brendan Rodgers, Cam Smith, Mauricio Dubon"
0,Colton Gordon,CLE,0.217,0.08,0.065,0.405,0.276,0.295,3.9511111111111106,"Steven Kwan, Angel Martinez, Jose Ramirez, David Fry, Carlos Santana, Gabriel Arias, Bo Naylor, Jhonkensy Noel, Will Wilson"
0,Davis Martin,KC,0.187,0.059,0.067,0.462,0.235,0.30766666666666664,3.652222222222222,"Jonathan India, Bobby Witt Jr., Maikel Garcia, Vinnie Pasquantino, Salvador Perez, Jac Caglianone, Drew Waters, Michael Massey, Kyle Isbel"
0,Seth Lugo,CWS,0.217,0.095,0.07,0.431,0.272,0.3068888888888889,3.9977777777777783,"Mike Tauchman, Chase Meidroth, Miguel Vargas, Andrew Benintendi, Luis Robert, Josh Palacios, Kyle Teel, Tim Elko, Josh Rojas"
0,Bailey Ober,TOR,0.179,0.077,0.074,0.469,0.223,0.31866666666666665,3.81,"Bo Bichette, Vladimir Guerrero Jr., Addison Barger, Alejandro Kirk, George Springer, Nathan Lukes, Alan Roden, Jonatan Clase, Andres Gimenez"
0,Eric Lauer,MIN,0.229,0.072,0.096,0.388,0.292,0.3186666666666667,3.83,"Byron Buxton, Trevor Larnach, Ryan Jeffers, Matt Wallner, Ty France, Willi Castro, Royce Lewis, Brooks Lee, Christian Vazquez"
0,Chad Patrick,SD,0.195,0.068,0.074,0.467,0.23,0.31755555555555554,3.83,"Fernando Tatis Jr., Jackson Merrill, Manny Machado, Gavin Sheets, Jake Cronenworth, Jose Iglesias, Tyler Wade, Elias Diaz, Brandon Lockridge"
0,Randy Vasquez,MIL,0.206,0.089,0.067,0.456,0.237,0.31466666666666665,3.9777777777777774,"Brice Turang, Jackson Chourio, Christian Yelich, William Contreras, Sal Frelick, Rhys Hoskins, Jake Bauers, Caleb Durbin, Joey Ortiz"
0,Sonny Gray,LAD,0.208,0.095,0.115,0.364,0.33,0.3576666666666667,3.9988888888888883,"Shohei Ohtani, Mookie Betts, Freddie Freeman, Teoscar Hernandez, Will Smith, Max Muncy, Andy Pages, Michael Conforto, Tommy Edman"
0,Justin Wrobleski,STL,0.192,0.082,0.07,0.427,0.233,0.32288888888888884,3.887777777777778,"Lars Nootbaar, Masyn Winn, Brendan Donovan, Willson Contreras, Ivan Herrera, Nolan Arenado, Alec Burleson, Pedro Pages, Victor Scott II"
0,Antonio Senzatela,NYM,0.24,0.085,0.09,0.472,0.213,0.31366666666666665,3.987777777777777,"Brandon Nimmo, Starling Marte, Juan Soto, Pete Alonso, Jeff McNeil, Brett Baty, Ronny Mauricio, Jared Young, Francisco Alvarez"
0,Kodai Senga,COL,0.255,0.059,0.076,0.453,0.248,0.28633333333333333,3.711111111111111,"Jordan Beck, Thairo Estrada, Hunter Goodman, Ryan McMahon, Brenton Doyle, Orlando Arcia, Keston Hiura, Jacob Stallings, Tyler Freeman"
0,Kyle Hendricks,SEA,0.257,0.084,0.085,0.425,0.275,0.3085555555555556,4.01,"J.P. Crawford, Jorge Polanco, Julio Rodriguez, Cal Raleigh, Randy Arozarena, Rowdy Tellez, Leody Taveras, Cole Young, Ben Williamson"
0,Bryce Miller,LAA,0.242,0.084,0.101,0.403,0.285,0.32922222222222225,4.003333333333334,"Zach Neto, Nolan Schanuel, Mike Trout, Taylor Ward, Jorge Soler, ""Logan OHoppe"", Luis Rengifo, Jo Adell, Chris Taylor"
0,Osvaldo Bido,BAL,0.267,0.08,0.07,0.438,0.262,0.29788888888888887,4.043333333333333,"Jackson Holliday, Adley Rutschman, Gunnar Henderson, Ramon Urias, Coby Mayo, Colton Cowser, Dylan Carlson, Jorge Mateo, Jordyn Adams"
0,Dean Kremer,OAK,0.246,0.074,0.08,0.425,0.261,0.3097777777777778,3.7544444444444443,"Lawrence Butler, Jacob Wilson, Brent Rooker, Tyler Soderstrom, Maxwell Muncy, JJ Bleday, Luis Urias, Willie MacIver, Denzel Clarke"
0,Hayden Birdsong,ATL,0.223,0.089,0.099,0.441,0.258,0.33066666666666666,3.9566666666666666,"Ronald Acuna Jr., Austin Riley, Matt Olson, Marcell Ozuna, Ozzie Albies, Alex Verdugo, Sean Murphy, Nick Allen, Michael Harris II"
0,Spencer Schwellenbach,SF,0.248,0.062,0.085,0.447,0.261,0.3113333333333333,3.8966666666666665,"Daniel Johnson, Heliot Ramos, Jung Hoo Lee, Matt Chapman, Willy Adames, Dominic Smith, Jerar Encarnacion, Tyler Fitzgerald, Andrew Knizner"
