,Pitcher,Opp,K%,BB%,Brl%,GB%,FB%,xwOBA,PPA,LU
0,Mitchell Parker,MIA,0.226,0.071,0.071,0.455,0.234,0.30811111111111106,3.7455555555555557,"Xavier Edwards, Agustin Ramirez, Jakob Marsee, Otto Lopez, Connor Norby, Heriberto Hernandez, Eric Wagaman, Joey Wiemer, Javier Sanoja"
0,Eury Perez,WSH,0.232,0.072,0.084,0.46,0.239,0.319,3.8377777777777777,"James Wood, C.J. Abrams, Josh Bell, Luis Garcia, Daylen Lile, Riley Adams, Dylan Crews, Paul DeJong, Jacob Young"
0,Casey Mize,NYM,0.215,0.092,0.107,0.419,0.264,0.3403333333333333,3.9122222222222223,"Francisco Lindor, Juan Soto, Pete Alonso, Brandon Nimmo, Mark Vientos, Jeff McNeil, Cedric Mullins II, Brett Baty, Hayden Senger"
0,Clay Holmes,DET,0.234,0.078,0.093,0.385,0.298,0.3201111111111111,3.9322222222222223,"Colt Keith, Gleyber Torres, Kerry Carpenter, Riley Greene, Spencer Torkelson, Wenceel Perez, Javier Baez, Zach McKinstry, Jake Rogers"
0,Zac Gallen,TEX,0.225,0.082,0.084,0.401,0.279,0.31155555555555553,3.953333333333333,"Josh Smith, Wyatt Langford, Joc Pederson, Rowdy Tellez, Josh Jung, Kyle Higashioka, Alejandro Osuna, Ezequiel Duran, Michael Helman"
0,Jack Leiter,ARI,0.228,0.084,0.079,0.455,0.267,0.3114444444444444,3.901111111111111,"Geraldo Perdomo, Ketel Marte, Corbin Carroll, Blaze Alexander, Adrian Del Castillo, Gabriel Moreno, Jake McCarthy, Tyler Locklear, Alek Thomas"
0,Nestor Cortes,BAL,0.262,0.071,0.088,0.458,0.261,0.3022222222222222,3.933333333333334,"Jackson Holliday, Jeremiah Jackson, Gunnar Henderson, Ryan Mountcastle, Emmanuel Rivera, Colton Cowser, Coby Mayo, Dylan Carlson, Alex Jackson"
0,Cade Povich,SD,0.193,0.066,0.07,0.474,0.23,0.3188888888888889,3.7911111111111118,"Fernando Tatis Jr., Luis Arraez, Manny Machado, Ramon Laureano, Jackson Merrill, Jose Iglesias, Mason McCoy, Bryce Johnson, Freddy Fermin"
0,Braxton Ashcraft,LAD,0.215,0.093,0.108,0.386,0.307,0.3433333333333333,4.003333333333334,"Shohei Ohtani, Mookie Betts, Freddie Freeman, Will Smith, Teoscar Hernandez, Michael Conforto, Andy Pages, Alex Freeland, Miguel Rojas"
0,Shohei Ohtani,PIT,0.269,0.094,0.083,0.406,0.314,0.30722222222222223,3.902222222222223,"Jared Triolo, Spencer Horwitz, Bryan Reynolds, Tommy Pham, Andrew McCutchen, Nick Gonzales, Oneil Cruz, Joey Bart, Cam Devanney"
0,Zack Littell,TOR,0.173,0.076,0.084,0.437,0.236,0.33077777777777784,3.7466666666666666,"George Springer, Addison Barger, Vladimir Guerrero Jr., Bo Bichette, Daulton Varsho, Alejandro Kirk, Nathan Lukes, Ernie Clement, Andres Gimenez"
0,Shane Bieber,CIN,0.228,0.068,0.06,0.474,0.212,0.2962222222222222,3.901111111111111,"TJ Friedl, Noelvi Marte, Elly De La Cruz, Austin Hays, Gavin Lux, Sal Stewart, ""KeBryan Hayes"", Jose Trevino, Matt McLain"
0,Brennan Bernardino,CLE,0.226,0.069,0.065,0.386,0.287,0.2868888888888889,3.833333333333334,"Steven Kwan, Angel Martinez, Jose Ramirez, David Fry, Kyle Manzardo, Gabriel Arias, Jhonkensy Noel, Brayan Rocchio, Austin Hedges"
0,Joey Cantillo,BOS,0.24,0.077,0.088,0.455,0.242,0.3178888888888889,3.9188888888888886,"Roman Anthony, Alex Bregman, Trevor Story, Romy Gonzalez, Rob Refsnyder, Nate Eaton, Ceddanne Rafaela, Nathaniel Lowe, Connor Wong"
0,Adrian Houser,SEA,0.233,0.089,0.102,0.399,0.299,0.3342222222222222,3.9433333333333334,"Randy Arozarena, Cal Raleigh, Julio Rodriguez, Josh Naylor, Eugenio Suarez, Jorge Polanco, Dominic Canzone, J.P. Crawford, Cole Young"
0,George Kirby,TB,0.212,0.078,0.068,0.508,0.198,0.30788888888888893,3.874444444444445,"Chandler Simpson, Yandy Diaz, Brandon Lowe, Junior Caminero, Josh Lowe, Jake Mangum, Richie Palacios, Carson Williams, Hunter Feduccia"
0,Ryan Bergert,LAA,0.276,0.06,0.094,0.451,0.25,0.2956666666666667,3.775555555555556,"Zach Neto, Luis Rengifo, Yoan Moncada, Jo Adell, ""Logan OHoppe"", Chris Taylor, Matthew Lugo, Oswald Peraza, Bryce Teodosio"
0,Caden Dana,KC,0.183,0.064,0.083,0.409,0.268,0.3232222222222222,3.776666666666667,"Mike Yastrzemski, Bobby Witt Jr., Vinnie Pasquantino, Maikel Garcia, Salvador Perez, Adam Frazier, Jac Caglianone, Michael Massey, Kyle Isbel"
0,Cade Horton,ATL,0.204,0.089,0.074,0.439,0.242,0.3201111111111111,3.898888888888889,"Jurickson Profar, Matt Olson, Ronald Acuna Jr., Drake Baldwin, Ozzie Albies, Michael Harris II, Nacho Alvarez, Jake Fraley, Nick Allen"
0,Bryce Elder,CHC,0.217,0.086,0.094,0.399,0.291,0.33144444444444443,3.8966666666666665,"Michael Busch, Nico Hoerner, Seiya Suzuki, Ian Happ, Carson Kelly, Pete Crow-Armstrong, Dansby Swanson, Willi Castro, Matt Shaw"
0,Zebby Matthews,CWS,0.214,0.08,0.073,0.393,0.28,0.31955555555555554,3.9044444444444446,"Mike Tauchman, Lenyn Sosa, Kyle Teel, Edgar Quero, Colson Montgomery, Curtis Mead, Andrew Benintendi, Chase Meidroth, Brooks Baldwin"
0,Yoendrys Gomez,MIN,0.232,0.084,0.1,0.383,0.295,0.323,3.8588888888888886,"Byron Buxton, Trevor Larnach, Luke Keaschall, Matt Wallner, Ryan Jeffers, Kody Clemens, Royce Lewis, Brooks Lee, James Outman"
0,Jose Quintana,PHI,0.223,0.078,0.099,0.427,0.262,0.33477777777777784,3.848888888888889,"Trea Turner, Kyle Schwarber, Bryce Harper, J.T. Realmuto, Alec Bohm, Nick Castellanos, Harrison Bader, Edmundo Sosa, Weston Wilson"
0,Aaron Nola,MIL,0.206,0.088,0.063,0.47,0.229,0.315,3.9455555555555555,"Brice Turang, Jackson Chourio, William Contreras, Christian Yelich, Jake Bauers, Blake Perkins, Sal Frelick, Caleb Durbin, Joey Ortiz"
0,Matthew Liberatore,OAK,0.232,0.078,0.073,0.441,0.259,0.29644444444444445,3.7222222222222223,"Shea Langeliers, Jacob Wilson, Brent Rooker, Colby Thomas, Darell Hernaiz, Brett Harris, Zack Gelof, Max Schuemann, Willie MacIver"
0,Jeffrey Springs,STL,0.251,0.08,0.087,0.42,0.261,0.31,3.946666666666667,"Masyn Winn, Ivan Herrera, Lars Nootbaar, Willson Contreras, Jordan Walker, Nolan Gorman, Thomas Saggese, Pedro Pages, Victor Scott II"
0,Jason Alexander,NYY,0.242,0.101,0.141,0.391,0.314,0.35277777777777775,4.051111111111111,"Trent Grisham, Ben Rice, Aaron Judge, Cody Bellinger, Giancarlo Stanton, Jazz Chisholm, Austin Wells, Anthony Volpe, Ryan McMahon"
0,Will Warren,HOU,0.199,0.068,0.085,0.474,0.24,0.32488888888888895,3.7155555555555555,"Jeremy Pena, Yordan Alvarez, Jose Altuve, Carlos Correa, Jesus Sanchez, Christian Walker, Yainer Diaz, Mauricio Dubon, Jacob Melton"
0,German Marquez,SF,0.228,0.081,0.096,0.394,0.291,0.3218888888888889,3.9155555555555557,"Heliot Ramos, Rafael Devers, Willy Adames, Dominic Smith, Matt Chapman, Jung Hoo Lee, Casey Schmitt, Patrick Bailey, Drew Gilbert"
0,Robbie Ray,COL,0.24,0.063,0.068,0.432,0.269,0.2911111111111111,3.731111111111111,"Tyler Freeman, Ezequiel Tovar, Hunter Goodman, Jordan Beck, Brenton Doyle, Kyle Karros, Kyle Farmer, Orlando Arcia, Ryan Ritter"
