,Pitcher,Opp,K%,BB%,Brl%,GB%,FB%,xwOBA,PPA,LU
0,Cam Schlittler,BAL,0.262,0.089,0.106,0.429,0.298,0.3244444444444445,3.974444444444445,"Jackson Holliday, Jordan Westburg, Gunnar Henderson, ""Tyler ONeill"", Dylan Beavers, Jeremiah Jackson, Colton Cowser, Samuel Basallo, Coby Mayo"
0,Tomoyuki Sugano,NYY,0.244,0.099,0.14,0.397,0.31,0.35388888888888886,4.066666666666666,"Trent Grisham, Ben Rice, Aaron Judge, Cody Bellinger, Giancarlo Stanton, Jazz Chisholm, Paul Goldschmidt, Ryan McMahon, Anthony Volpe"
0,Jameson Taillon,STL,0.237,0.071,0.082,0.413,0.277,0.3011111111111111,3.9299999999999997,"Lars Nootbaar, Ivan Herrera, Alec Burleson, Nolan Arenado, Nolan Gorman, Thomas Saggese, Jimmy Crooks III, Jordan Walker, Victor Scott II"
0,Michael McGreevy,CHC,0.209,0.095,0.099,0.386,0.3,0.34077777777777774,3.9188888888888886,"Michael Busch, Nico Hoerner, Ian Happ, Kyle Tucker, Seiya Suzuki, Carson Kelly, Pete Crow-Armstrong, Dansby Swanson, Matt Shaw"
0,Trey Yesavage,TB,0.211,0.065,0.083,0.497,0.219,0.31433333333333335,3.7611111111111106,"Chandler Simpson, Yandy Diaz, Brandon Lowe, Junior Caminero, Jonathan Aranda, Christopher Morel, Jake Mangum, Nick Fortes, Carson Williams"
0,Joe Boyle,TOR,0.186,0.083,0.089,0.416,0.262,0.32711111111111113,3.8377777777777777,"George Springer, Nathan Lukes, Vladimir Guerrero Jr., Addison Barger, Davis Schneider, Daulton Varsho, Alejandro Kirk, Ernie Clement, Andres Gimenez"
0,Justin Verlander,COL,0.278,0.061,0.084,0.414,0.271,0.29055555555555557,3.8144444444444443,"Ezequiel Tovar, Hunter Goodman, Blaine Crim, Jordan Beck, Brenton Doyle, Yanquiel Fernandez, Kyle Karros, Warming Bernabel, Ryan Ritter"
0,Kyle Freeland,SF,0.222,0.08,0.094,0.405,0.269,0.3247777777777778,3.9366666666666674,"Heliot Ramos, Rafael Devers, Willy Adames, Matt Chapman, Wilmer Flores, Casey Schmitt, Jung Hoo Lee, Jerar Encarnacion, Andrew Knizner"
0,Jake Irvin,CWS,0.229,0.077,0.075,0.415,0.261,0.3093333333333333,3.9033333333333338,"Chase Meidroth, Kyle Teel, Colson Montgomery, Miguel Vargas, Edgar Quero, Brooks Baldwin, Lenyn Sosa, Dominic Fletcher, Derek Hill"
0,Tyler Gilbert,WSH,0.23,0.066,0.073,0.475,0.225,0.3133333333333333,3.8055555555555554,"James Wood, C.J. Abrams, Josh Bell, Daylen Lile, Jorge Alfaro, Luis Garcia, Brady House, Nasim Nunez, Jacob Young"
0,Connelly Early,DET,0.24,0.079,0.089,0.374,0.284,0.32099999999999995,3.954444444444445,"Jahmai Jones, Gleyber Torres, Wenceel Perez, Spencer Torkelson, Riley Greene, Dillon Dingler, Andy Ibanez, Javier Baez, Parker Meadows"
0,Keider Montero,BOS,0.23,0.076,0.075,0.43,0.269,0.3108888888888889,3.902222222222223,"David Hamilton, Wilyer Abreu, Rob Refsnyder, Masataka Yoshida, Ceddanne Rafaela, Nathaniel Lowe, Carlos Narvaez, Nate Eaton, Nick Sogard"
0,Eury Perez,NYM,0.213,0.091,0.104,0.429,0.254,0.34144444444444444,3.914444444444444,"Francisco Lindor, Juan Soto, Pete Alonso, Brandon Nimmo, Starling Marte, Jeff McNeil, Francisco Alvarez, Ronny Mauricio, Tyrone Taylor"
0,Clay Holmes,MIA,0.216,0.083,0.073,0.438,0.248,0.3213333333333333,3.776666666666667,"Xavier Edwards, Jakob Marsee, Connor Norby, Liam Hicks, Troy Johnston, Griffin Conine, Otto Lopez, Graham Pauley, Heriberto Hernandez"
0,Ranger Suarez,MIN,0.252,0.075,0.093,0.384,0.306,0.3058888888888889,3.8911111111111105,"Byron Buxton, Austin Martin, Ryan Jeffers, Royce Lewis, Kody Clemens, Brooks Lee, Carson McCusker, Ryan Fitzgerald, James Outman"
0,Mick Abel,PHI,0.227,0.083,0.095,0.424,0.267,0.3343333333333333,3.895555555555555,"Harrison Bader, Kyle Schwarber, Bryce Harper, Alec Bohm, Brandon Marsh, J.T. Realmuto, Nick Castellanos, Bryson Stott, Edmundo Sosa"
0,Joey Cantillo,TEX,0.23,0.057,0.08,0.406,0.276,0.28977777777777775,3.8788888888888895,"Michael Helman, Cody Freeman, Josh Jung, Adolis Garcia, Kyle Higashioka, Jake Burger, Donovan Solano, Ezequiel Duran, Dylan Moore"
0,Jacob Latz,CLE,0.234,0.074,0.06,0.424,0.265,0.285,3.8788888888888895,"Steven Kwan, Angel Martinez, Jose Ramirez, Johnathan Rodriguez, Kyle Manzardo, Gabriel Arias, Jhonkensy Noel, Brayan Rocchio, Austin Hedges"
0,Spencer Strider,PIT,0.272,0.089,0.106,0.435,0.267,0.33366666666666667,4.023333333333334,"Oneil Cruz, Jared Triolo, Bryan Reynolds, Spencer Horwitz, Nick Gonzales, Joey Bart, Jack Suwinski, Rafael Flores, Henry Davis"
0,Bubba Chandler,ATL,0.208,0.096,0.091,0.43,0.267,0.33433333333333326,4.0344444444444445,"Jurickson Profar, Matt Olson, Ronald Acuna Jr., Drake Baldwin, Ha-Seong Kim, Michael Harris II, Marcell Ozuna, Nacho Alvarez, Brett Wisely"
0,Robert Gasser,CIN,0.225,0.075,0.078,0.435,0.263,0.31433333333333335,3.8322222222222226,"TJ Friedl, Noelvi Marte, Miguel Andujar, Spencer Steer, Sal Stewart, Elly De La Cruz, Tyler Stephenson, ""KeBryan Hayes"", Matt McLain"
0,Andrew Abbott,MIL,0.203,0.087,0.066,0.453,0.24,0.3143333333333333,3.9377777777777783,"Christian Yelich, Jackson Chourio, Brice Turang, Andrew Vaughn, Isaac Collins, Caleb Durbin, Blake Perkins, Danny Jansen, Joey Ortiz"
0,Michael King,ARI,0.204,0.067,0.059,0.451,0.264,0.29144444444444445,3.8177777777777777,"Geraldo Perdomo, Gabriel Moreno, Adrian Del Castillo, Blaze Alexander, Alek Thomas, Ildemaro Vargas, Jake McCarthy, Jorge Barrosa, Connor Kaiser"
0,Eduardo Rodriguez,SD,0.169,0.074,0.069,0.442,0.247,0.3293333333333333,3.8722222222222222,"Fernando Tatis Jr., Luis Arraez, Xander Bogaerts, Jackson Merrill, Gavin Sheets, Jose Iglesias, ""Ryan OHearn"", Jake Cronenworth, Elias Diaz"
0,Caden Dana,HOU,0.221,0.079,0.083,0.431,0.259,0.3148888888888889,3.8699999999999997,"Jose Altuve, Isaac Paredes, Carlos Correa, Christian Walker, Yainer Diaz, Zach Cole Jr., Jesus Sanchez, Mauricio Dubon, Taylor Trammell"
0,AJ Blubaugh,LAA,0.282,0.08,0.105,0.407,0.282,0.30877777777777776,3.954444444444445,"Nolan Schanuel, Mike Trout, Taylor Ward, Jo Adell, Luis Rengifo, ""Logan OHoppe"", Christian Moore, Denzer Guzman, Bryce Teodosio"
0,Logan Gilbert,LAD,0.198,0.08,0.073,0.397,0.287,0.32044444444444437,3.881111111111111,"Tommy Edman, Mookie Betts, Freddie Freeman, Andy Pages, Michael Conforto, Alex Call, Miguel Rojas, Enrique Hernandez, Dalton Rushing"
0,Tyler Glasnow,SEA,0.257,0.082,0.101,0.411,0.314,0.3214444444444444,3.836666666666667,"Randy Arozarena, Cal Raleigh, Julio Rodriguez, Jorge Polanco, Eugenio Suarez, Dominic Canzone, Luke Raley, Leo Rivas, Harry Ford"
0,Luis Morales,KC,0.181,0.081,0.103,0.407,0.263,0.3483333333333334,3.902222222222223,"Mike Yastrzemski, Bobby Witt Jr., Vinnie Pasquantino, Maikel Garcia, Salvador Perez, Carter Jensen, Jonathan India, Adam Frazier, Jac Caglianone"
0,Michael Wacha,OAK,0.222,0.082,0.101,0.429,0.264,0.33055555555555555,3.7688888888888883,"Nick Kurtz, Shea Langeliers, Tyler Soderstrom, Brent Rooker, Jacob Wilson, Lawrence Butler, Darell Hernaiz, Carlos Cortes, Max Schuemann"
