,Pitcher,Opp,K%,BB%,Brl%,GB%,FB%,xwOBA,PPA,LU
0,Brady Singer,STL,0.252,0.077,0.089,0.43,0.264,0.3131111111111111,3.9422222222222225,"Lars Nootbaar, Ivan Herrera, Willson Contreras, Nolan Gorman, Masyn Winn, Thomas Saggese, Jordan Walker, Pedro Pages, Nathan Church"
0,Andre Pallante,CIN,0.257,0.071,0.062,0.46,0.251,0.3012222222222223,3.852222222222222,"TJ Friedl, Noelvi Marte, Elly De La Cruz, Austin Hays, Gavin Lux, Spencer Steer, ""KeBryan Hayes"", Matt McLain, Will Banfield"
0,Joe Ryan,SD,0.174,0.074,0.076,0.444,0.243,0.332,3.9311111111111114,"Fernando Tatis Jr., Luis Arraez, Manny Machado, ""Ryan OHearn"", Ramon Laureano, Gavin Sheets, Jose Iglesias, Jake Cronenworth, Freddy Fermin"
0,David Morgan,MIN,0.217,0.085,0.088,0.384,0.295,0.3181111111111111,3.8644444444444446,"Byron Buxton, Matt Wallner, Luke Keaschall, Brooks Lee, Ryan Jeffers, Austin Martin, Royce Lewis, Kody Clemens, Mickey Gasper"
0,Lucas Giolito,PIT,0.232,0.083,0.085,0.437,0.245,0.31766666666666665,3.908888888888889,"Jared Triolo, Spencer Horwitz, Bryan Reynolds, Tommy Pham, Andrew McCutchen, Nick Gonzales, Oneil Cruz, Henry Davis, Isiah Kiner-Falefa"
0,Mitch Keller,BOS,0.223,0.078,0.084,0.443,0.251,0.3171111111111111,3.872222222222222,"Roman Anthony, Alex Bregman, Jarren Duran, Trevor Story, Nathaniel Lowe, Masataka Yoshida, Ceddanne Rafaela, David Hamilton, Connor Wong"
0,Brad Lord,TB,0.23,0.065,0.065,0.519,0.201,0.2945555555555555,3.7922222222222226,"Chandler Simpson, Yandy Diaz, Brandon Lowe, Junior Caminero, Josh Lowe, Jake Mangum, Bobby Seymour, Carson Williams, Hunter Feduccia"
0,Ian Seymour,WSH,0.257,0.069,0.085,0.455,0.246,0.30911111111111117,3.855555555555556,"James Wood, C.J. Abrams, Riley Adams, Andres Chaparro, Paul DeJong, Dylan Crews, Brady House, C.J. Stubbs, Jacob Young"
0,Max Scherzer,MIL,0.196,0.085,0.065,0.468,0.229,0.3205555555555556,3.938888888888888,"Brice Turang, Jackson Chourio, Christian Yelich, William Contreras, Sal Frelick, Andrew Vaughn, Isaac Collins, Caleb Durbin, Andruw Monasterio"
0,Brandon Woodruff,TOR,0.203,0.085,0.089,0.427,0.251,0.32466666666666666,3.861111111111111,"George Springer, Addison Barger, Vladimir Guerrero Jr., Bo Bichette, Daulton Varsho, Davis Schneider, Nathan Lukes, Tyler Heineman, Andres Gimenez"
0,Tanner Bibee,SEA,0.239,0.088,0.102,0.402,0.294,0.33244444444444443,3.943333333333333,"Randy Arozarena, Cal Raleigh, Julio Rodriguez, Josh Naylor, Eugenio Suarez, Jorge Polanco, Luke Raley, J.P. Crawford, Cole Young"
0,Bryce Miller,CLE,0.227,0.086,0.077,0.388,0.297,0.30577777777777776,3.9666666666666663,"Steven Kwan, Daniel Schneemann, Jose Ramirez, Kyle Manzardo, Bo Naylor, David Fry, C.J. Kayfus, Nolan Jones, Brayan Rocchio"
0,Kodai Senga,MIA,0.215,0.074,0.072,0.452,0.228,0.319,3.782222222222222,"Xavier Edwards, Jakob Marsee, Agustin Ramirez, Otto Lopez, Liam Hicks, Connor Norby, Troy Johnston, Eric Wagaman, Joey Wiemer"
0,Sandy Alcantara,NYM,0.21,0.095,0.112,0.421,0.269,0.3466666666666667,3.9755555555555557,"Francisco Lindor, Juan Soto, Pete Alonso, Brandon Nimmo, Mark Vientos, Jeff McNeil, Brett Baty, Luis Torrens, Cedric Mullins II"
0,Hunter Brown,LAA,0.275,0.083,0.105,0.391,0.309,0.314,3.9777777777777783,"Zach Neto, Yoan Moncada, Mike Trout, Taylor Ward, Jo Adell, Luis Rengifo, ""Travis dArnaud"", Niko Kavadas, Bryce Teodosio"
0,Jose Soriano,HOU,0.198,0.068,0.085,0.472,0.241,0.3262222222222222,3.714444444444444,"Jeremy Pena, Yordan Alvarez, Jose Altuve, Carlos Correa, Jesus Sanchez, Christian Walker, Yainer Diaz, Mauricio Dubon, Jacob Melton"
0,Michael Wacha,DET,0.234,0.078,0.094,0.383,0.299,0.3197777777777777,3.933333333333333,"Colt Keith, Gleyber Torres, Kerry Carpenter, Spencer Torkelson, Riley Greene, Wenceel Perez, Javier Baez, Zach McKinstry, Jake Rogers"
0,Tarik Skubal,KC,0.186,0.072,0.083,0.394,0.269,0.33266666666666667,3.77,"Maikel Garcia, Bobby Witt Jr., Vinnie Pasquantino, Salvador Perez, Randal Grichuk, Jonathan India, Nick Loftin, Luke Maile, Tyler Tolbert"
0,Martin Perez,NYY,0.231,0.088,0.132,0.403,0.3,0.3515555555555555,3.967777777777778,"Paul Goldschmidt, Aaron Judge, Cody Bellinger, Giancarlo Stanton, Trent Grisham, Amed Rosario, Jazz Chisholm, Anthony Volpe, Ben Rice"
0,Luis Gil,CWS,0.215,0.079,0.073,0.391,0.279,0.3193333333333333,3.902222222222223,"Mike Tauchman, Kyle Teel, Lenyn Sosa, Colson Montgomery, Andrew Benintendi, Edgar Quero, Curtis Mead, Brooks Baldwin, Chase Meidroth"
0,Tanner Gordon,CHC,0.209,0.095,0.101,0.387,0.303,0.33977777777777773,3.897777777777778,"Michael Busch, Kyle Tucker, Seiya Suzuki, Ian Happ, Nico Hoerner, Pete Crow-Armstrong, Carson Kelly, Dansby Swanson, Matt Shaw"
0,Matthew Boyd,COL,0.238,0.064,0.068,0.433,0.265,0.29333333333333333,3.7266666666666666,"Tyler Freeman, Ezequiel Tovar, Hunter Goodman, Jordan Beck, Brenton Doyle, Kyle Karros, Kyle Farmer, Orlando Arcia, Ryan Ritter"
0,Justin Verlander,BAL,0.252,0.077,0.09,0.432,0.268,0.3174444444444445,3.8988888888888886,"Jackson Holliday, Jeremiah Jackson, Gunnar Henderson, Ryan Mountcastle, Colton Cowser, Dylan Beavers, Coby Mayo, Samuel Basallo, Dylan Carlson"
0,Tomoyuki Sugano,SF,0.223,0.084,0.095,0.399,0.291,0.32355555555555554,3.894444444444444,"Heliot Ramos, Rafael Devers, Willy Adames, Dominic Smith, Matt Chapman, Casey Schmitt, Jung Hoo Lee, Luis Matos, Patrick Bailey"
0,J.T. Ginn,TEX,0.216,0.075,0.088,0.41,0.273,0.3135555555555556,4.015555555555555,"Josh Smith, Wyatt Langford, Joc Pederson, Adolis Garcia, Rowdy Tellez, Josh Jung, Jonah Heim, Cody Freeman, Alejandro Osuna"
0,Jacob deGrom,OAK,0.244,0.078,0.094,0.43,0.264,0.31177777777777776,3.7377777777777776,"Lawrence Butler, Shea Langeliers, Brent Rooker, Tyler Soderstrom, Jacob Wilson, Colby Thomas, JJ Bleday, Darell Hernaiz, Zack Gelof"
0,Yoshinobu Yamamoto,ARI,0.225,0.083,0.082,0.437,0.271,0.31277777777777777,3.913333333333333,"Geraldo Perdomo, Ketel Marte, Corbin Carroll, Lourdes Gurriel Jr., Blaze Alexander, Adrian Del Castillo, Gabriel Moreno, Alek Thomas, Tyler Locklear"
0,Brandon Pfaadt,LAD,0.222,0.094,0.111,0.377,0.318,0.3413333333333333,4.029999999999999,"Shohei Ohtani, Mookie Betts, Freddie Freeman, Will Smith, Teoscar Hernandez, Michael Conforto, Andy Pages, Alex Freeland, Enrique Hernandez"
0,Jesus Luzardo,ATL,0.223,0.096,0.085,0.432,0.259,0.3255555555555556,3.993333333333333,"Jurickson Profar, Matt Olson, Ronald Acuna Jr., Ozzie Albies, Marcell Ozuna, Michael Harris II, Sean Murphy, Nacho Alvarez, Nick Allen"
0,Hurston Waldrep,PHI,0.215,0.085,0.094,0.422,0.276,0.3381111111111111,3.8911111111111114,"Trea Turner, Kyle Schwarber, Bryce Harper, J.T. Realmuto, Alec Bohm, Brandon Marsh, Nick Castellanos, Max Kepler, Bryson Stott"
