,Rk,Player,Team,Pos,Primary Pos,Pos Rank,Value,Comments,Link
0,1,Aaron Judge,NYY,OF,OF,1,$14.15,"If we're ranking Ohtani as only a hitter, I think there's a strong case for Judge as the #1",
1,2,Shohei Ohtani,LAD,DH/SP,DH,1,$14.88,"Maybe the steals tick down to 15 and maybe he hits .270? But you can't rank him outside of the top two, IMO",
2,3,Bobby Witt Jr.,KC,SS,SS,1,$12.85,One of the few 30-30-.300 threats in the league. He's the clear #3 overall player.,https://www.mlbdatawarehouse.com/i/181825834/bobby-witt-jr
3,4,Juan Soto,NYM,OF,OF,2,$13.37,"I'm thinking he drops to 15-20 steals, and he's better for OBP/points than standard roto. ",https://www.mlbdatawarehouse.com/i/182025983/juan-soto
4,5,Corbin Carroll,ARI,OF,OF,3,$11.51,"Added a ton of power in 2025 without losing much in SB. Probably not the 50 SB threat we saw early on, but a 25-homer, 35-steal guy easily with a bunch of counting stats (it would certainly help if the DBacks retain Ketel Marte)",https://www.mlbdatawarehouse.com/i/181175066/corbin-carroll
5,6,Jose Ramirez,CLE,3B,3B,1,$12.02,No signs of age in the 2025 data,https://www.mlbdatawarehouse.com/i/182987445/jose-ramirez
6,7,Ronald Acuna Jr.,ATL,OF,OF,4,$13.74,"He's been a 24% K% guy every year since 2023. Didn't have the same speed last year. There's a chance he underwhelms in AVG and SB, but he's still an player with as much ceiling as anybody.",https://www.mlbdatawarehouse.com/i/179720085/ronald-acuna-jr
7,8,Elly De La Cruz,CIN,SS,SS,2,$12.18,A 30-40-.275 potential if he maintains the gains from 2025 (pre-injury). Clear top 6 hitter for me. ,https://www.mlbdatawarehouse.com/i/182026238/elly-de-la-cruz
8,9,Julio Rodriguez,SEA,OF,OF,5,$11.48,"Plate discipline stuff isn't great, so he's docked for OBP leagues, but he's a 30-30 guy with .280 batting average upside",
9,10,Kyle Tucker,LAD,OF,OF,6,$11.41,"Does not have the same upside as these guys around him, but so safe and huge RBI potential in LA",
10,11,Vladimir Guerrero Jr.,TOR,1B,1B,1,$10.89,"Not the highest ceiling in the world, but so safe, still so young, and the team context is strong",
11,12,Fernando Tatis Jr.,SD,OF,OF,7,$11.31,"Feels like there's so much more upside than what he's been giving us, and the floor has been pretty nice",
12,13,Gunnar Henderson,BAL,SS,SS,3,$10.71,"Shook off a slow start nicely. Positive regression coming in LA stuff. Great skills, high floor and high ceiling, and we get a little discount on him after a poor 17-homer season.",https://www.mlbdatawarehouse.com/i/178612600/gunnar-henderson
13,14,Jazz Chisholm,NYY,2B/3B,2B,1,$9.98,"30-30 potential, but a .250 AVG tops? But it's a contract year, baby! I don't think you can go too wrong with Jazz, just build in some extra BA around him",
14,15,Junior Caminero,TB,3B,3B,2,$11.51,"50-homers, .300 batting average upside. Will need to slightly improve in hit tool to get there, and the park shift sucks for him, but it seems like a 35-homer, 100-RBI, .260 batting average floor on top of one of the highest ceilings in the game. ",https://www.mlbdatawarehouse.com/i/180243530/junior-caminero
15,16,Nick Kurtz,ATH,1B,1B,2,$10.43,"50-homer pop, should be a ton of RBI. But with the 30% K%, I'm a bit worried that he could end up with like 36 homers and a .240 batting average.",https://www.mlbdatawarehouse.com/i/179273161/nick-kurtz
16,17,Francisco Lindor,NYM,SS,SS,4,$10.27,"There's not a ton of upside with Lindor, but he's about as safe as they come. 25-20-.250 floor with 30-30 repeat potential.",https://www.mlbdatawarehouse.com/i/182025983/francisco-lindor
17,18,Ketel Marte,ARI,2B,2B,2,$9.67,"Runaway at the position, and that matters quite a bit. Reliable power and average. very high floor.",https://www.mlbdatawarehouse.com/i/181175066/ketel-marte
18,19,Pete Crow-Armstrong,CHC,OF,OF,8,$11.70,"The 60% Swing% keeps him streaky, but the steals are locked in and he shouldn't have an issue getting to 20+ homers again",
19,20,James Wood,WSH,OF,OF,9,$9.88,"Betting on the skills. Elite raw power and speed. Just lost his way at the plate in the 2H of 2025. Needs to get the K% under 30% and pull a bit more, but the HR/SB is nice and the upside is a round one talent.",https://www.mlbdatawarehouse.com/i/176667994/james-wood
20,21,Yordan Alvarez,HOU,OF,OF,10,$9.07,"It's all about the health, but he probably has a better chance of 120+ games than most people think",https://www.mlbdatawarehouse.com/i/182515558/yordan-alvarez
21,22,Zach Neto,LAA,SS,SS,5,$10.48,"He's played at a 25-25 pace in his three years. Good hitter. But limited ceiling due to team context, raw talent, and the strikeout rate. ",https://www.mlbdatawarehouse.com/i/178121572/zach-neto
22,23,Cal Raleigh,SEA,C,C,1,$11.12,"You're buying massively high by investing in Raleigh this year, but he's clearly the tier one catcher all by himself. Be careful in batting average leagues, though!",
23,24,Manny Machado,SD,3B,3B,3,$9.62,"Steady production at 3B. Not the most ceiling I guess, but he's one of the top four 3Bs before a pretty big cliff",
24,25,Pete Alonso,BAL,1B,1B,3,$10.36,"Not the best fit in Camden, but it would have been perfectly fine last year. Don't think he ages the best, but he's still in the prime years and in a decent lineup",https://www.mlbdatawarehouse.com/i/178612600/pete-alonso
25,26,Matt Olson,ATL,1B,1B,4,$9.32,"Routine 30-homer guy with a .240 batting average floor and plenty of RBI. 162 game machine, consistent production.",https://www.mlbdatawarehouse.com/i/179720085/matt-olson
26,27,Austin Riley,ATL,3B,3B,4,$8.74,"Just needs a healthy season to get back to his 35-homer, 90+ RBI ways.",https://www.mlbdatawarehouse.com/i/179720085/austin-riley
27,28,Mookie Betts,LAD,SS,SS,6,$8.04,"R+RBI keeping him in the game, and I think we can have a little power bounce-back after the illness stuff he went through last year",
28,29,C.J. Abrams,WSH,SS,SS,7,$8.00,"Consistent source of playing time and steals while being fine in average and power. He's a good mid-round pick if you need steals, and I still think his best years are ahead of him. Possible mid-season sell high though? Check the monthly splits.",https://www.mlbdatawarehouse.com/i/176667994/cj-abrams
29,30,Wyatt Langford,TEX,OF,OF,11,$10.03,He went 22-22 with injuries and a higher than expected strikeout rate. I think he's a 30-25 guy with a chance at a good batting average in 2026,https://www.mlbdatawarehouse.com/i/181457581/wyatt-langford
30,31,Brent Rooker,ATH,OF,OF,12,$10.75,"Consistent 30-homer guy at this point, but he's 31 now and the batting average is probably .260-.270. Somewhat replaceable, but good to have OF eligibility. He's fine.",https://www.mlbdatawarehouse.com/i/179273161/brent-rooker
31,32,Roman Anthony,BOS,OF,OF,13,$8.95,"Better for OBP/points, but he has round one upside. ",https://www.mlbdatawarehouse.com/i/182986224/roman-anthony
32,33,Rafael Devers,SF,1B,1B,5,$8.43,"Tough park for homers, his K% came up. Lower batting average, no steals. He'll probably be over-drafted.",https://www.mlbdatawarehouse.com/i/181786401/rafael-devers
33,34,Maikel Garcia,KC,3B,3B,5,$9.73,"Some questions about him repeating 15+ homers, but the batting average, steals, and playing time on top of the lineup make him valuable even if he goes back to 8-10 homers.",https://www.mlbdatawarehouse.com/i/181825834/maikel-garcia
34,35,Jackson Merrill,SD,OF,OF,14,$9.99,"Floor seems very nice, and plenty of age-driven upside. I think it's a nice bounce-back, and my projections love him",
35,36,Freddie Freeman,LAD,1B,1B,6,$8.82,"He's definitely lost a step, but he remained a very good hitter last year with another near .300 AVG plus 20+ bombs. Ceiling is capped, but the floor remains very high",
36,37,Cody Bellinger,NYY,OF,OF,15,$9.24,"20+ homers should be safe with returning to NYY. Probably tops out at 12 SB and a .270 AVG, but he's very safe",
37,38,Riley Greene,DET,OF,OF,16,$8.64,"True 40 homer potential, but he doesn't offer much in AVG or SB.",https://www.mlbdatawarehouse.com/i/182515576/riley-greene
38,39,Byron Buxton,MIN,OF,OF,17,$9.21,"Top 10 hitter when healthy, but I'm hesitant to pay the rising price for a 32-year-old with this injury sheet. It all depends on what kind of outfielder replacement value your league gives you. ",
39,40,Corey Seager,TEX,SS,SS,8,$7.31,"So much injury risk, but it's usually still 100+ games and production you can't get from many other guys",https://www.mlbdatawarehouse.com/i/181457581/corey-seager
40,41,Tyler Soderstrom,ATH,OF/1B,OF,18,$8.45,"Solid power-hitting floor. K% is good, profiles for a good batting average. Lots to like, and I think there's more power in the tank.",https://www.mlbdatawarehouse.com/i/179273161/tyler-soderstrom
41,42,Jarren Duran,BOS,OF,OF,19,$8.57,"15-homers, 20-steals floor. Upside for more bombs, but a poor batted ball profile and he's no good against lefties.",https://www.mlbdatawarehouse.com/i/182986224/jarren-duran
42,43,Ben Rice,NYY,1B/C,1B,7,$7.38,,
43,44,Oneil Cruz,PIT,OF,OF,20,$9.17,"I'm starting to question if he has the ceiling. No improvement in K% or air pull stuff, seems like a 25-homer cap? Solid 25-25 potential, and will bounce back a bit in AVG, but Cruz is mostly a two-category contributor.",https://www.mlbdatawarehouse.com/i/177585967/oneil-cruz
44,45,Shea Langeliers,ATH,C,C,2,$7.30,"Was better than Raleigh (standard roto) in the second half. Dropped the K% eight points, was doing it all in the second half. Great floor driven by the playing time and power, and it looks like he could hit .270 now with the lower K%.",https://www.mlbdatawarehouse.com/i/179273161/shea-langeliers
45,46,George Springer,TOR,OF,OF,21,$8.79,"How much regression will hit? All of the underlying stats were good, so that helps, but it feels like one of the biggest ""buy highs"" of recent memory",
46,47,Seiya Suzuki,CHC,OF,OF,22,$9.30,"Great power marks last year, batting average is fine. But the steals dried up and the Cubs might be kinda bad",
47,48,Vinnie Pasquantino,KC,1B,1B,8,$8.10,"Elite source of RBI, very good hitter, but I wonder if he won't drop back to 22 homers or so with just a couple of steals. Park change boost!",https://www.mlbdatawarehouse.com/i/181825834/vinnie-pasquantino
48,49,Josh Naylor,SEA,1B,1B,9,$8.16,"I don't believe the steals come back, which makes him somewhat replaceable. But a solid player, obviously",
49,50,Willson Contreras,BOS,1B,1B,10,$6.39,"Guy still has 25+ homer pop, team/park upgrade to Boston. Still some age and K driven downside",https://www.mlbdatawarehouse.com/i/182986224/willson-contreras
50,51,Jordan Westburg,BAL,3B,3B,6,$8.04,"Good power profile with a nice batting average floor and some upside for 10 steals. He has not stayed healthy, but if he does, he'll be a steal.",https://www.mlbdatawarehouse.com/i/178612600/jordan-westburg
51,52,Bo Bichette,NYM,SS,SS,9,$7.30,,
52,53,Michael Busch,CHC,1B,1B,11,$7.50,"Overperformed a bit last year. More angles-based power than bat speed, but he's a proven good hitter now.",
53,54,Jeremy Pena,HOU,SS,SS,10,$8.09,"Solid floor, 15-15-.260, but I don't see him hitting .300 again. Not much roto upside.",https://www.mlbdatawarehouse.com/i/182515558/jeremy-pena
54,55,Michael Harris II,ATL,OF,OF,23,$8.60,"What a confusing player. Disaster in OBP leagues, but cruises to 15-15 every year. Youth and skill-driven upside, but he's never been consistent.",https://www.mlbdatawarehouse.com/i/179720085/michael-harris
55,56,Geraldo Perdomo,ARI,SS,SS,11,$7.90,"He's likely to regress at least a handful of homers, and possibly a few steals. The lineup around him might be mediocre. I think he'll be way over-priced in 2026",https://www.mlbdatawarehouse.com/i/181175066/geraldo-perdomo
56,57,Nico Hoerner,CHC,2B,2B,3,$7.54,".280 batting average, 30+ steals if he stays healthy. Maybe even 10 homers?",
57,58,Randy Arozarena,SEA,OF,OF,24,$9.42,"Five straight 20-20 seasons, but he's slowing down and his power has always been a bit questionable. And the batting average is low",
58,59,Trevor Story,BOS,SS,SS,12,$6.65,"All kinds of upside with health, but I could see him hitting .230, and it's tough to see him playing 150+ games again",https://www.mlbdatawarehouse.com/i/182986224/trevor-story
59,60,Teoscar Hernandez,LAD,OF,OF,25,$8.58,"Not an encouraging 2025 season, but it's not crazy to think he can get back to 30+ bombs and 100+ RBI with health. But it's a bit risky.",
60,61,Willy Adames,SF,SS,SS,13,$8.24,"Does nothing other than homers, and 30+ homers is tough to achieve in San Francisco",https://www.mlbdatawarehouse.com/i/181786401/willy-adames
61,62,Jackson Holliday,BAL,2B,2B,4,$6.08,"Still super young, key power and K% growth in 2025. Still don't think he's a 30-homer threat, but a 15-25 season seems pretty likely if he can keep developing. And there's plenty of ceiling. I like the floor/ceiling combo feeling I'm getting. ",https://www.mlbdatawarehouse.com/i/178612600/jackson-holliday
62,63,Brandon Nimmo,TEX,OF,OF,26,$8.21,"18+ bombs, 8+ steals. Pretty high floor, but the ceiling doesn't excited me",https://www.mlbdatawarehouse.com/i/181457581/brandon-nimmo
63,64,Hunter Goodman,COL,C,C,3,$7.27,Hit tool seems good enough to keep the power coming. But buying high on a breakout Rockies bat feels more risky than a lot of drafters will think.,https://www.mlbdatawarehouse.com/i/175451426/hunter-goodman
64,65,Xavier Edwards,MIA,2B/SS,2B,5,$6.63,"Five homer max, but 30+ steals and a .280+ batting average are likely. ",https://www.mlbdatawarehouse.com/i/180831407/xavier-edwards
65,66,Dansby Swanson,CHC,SS,SS,14,$7.16,"20-20 last year! Very solid floor, but no real upside, and he's getting old",
66,67,Brenton Doyle,COL,OF,OF,27,$7.58,"Decent buy-low for locked-in playing time with some power and good speed. Subject to huge slumps, very limited counting stat ceiling, but probably an underrated pick in 5 OF leagues.",https://www.mlbdatawarehouse.com/i/175451426/brenton-doyle
67,68,Salvador Perez,KC,C/1B,C,4,$8.23,"Didn't lose any power as a 34-year-old, was unlucky in batting average. Can still hit for a bunch of power. But he's 35 now and maybe doesn't play as much moving forward with some of these young guys showing up?",https://www.mlbdatawarehouse.com/i/181825834/salvador-perez
68,69,Luis Robert,NYM,OF,OF,28,$8.34,"Serious improvements in plate discipline the last two years, career-low BABIP in 2025. Made himself a positive roto value player with the steals alone. There's still some hope, but the injuries, team context, and recent history make him tough to really buy into",https://www.mlbdatawarehouse.com/i/176288033/luis-robert-jr
69,70,Dylan Crews,WSH,OF,OF,29,$8.89,"Injuries derailed 2025, but he has not hit well in the Majors yet. Nothing terrible under the hood. Betting on the tools here. I like him.",https://www.mlbdatawarehouse.com/i/176667994/dylan-crews
70,71,Jo Adell,LAA,OF,OF,30,$9.18,Good to see the K% get down to 26%. But the steals went away and I'm a little afraid the K% could jump back up. Elite raw power and should have an everyday job while he's still in LA.,https://www.mlbdatawarehouse.com/i/178121572/jo-adell
71,72,Lawrence Butler,ATH,OF,OF,31,$8.07,"20-20 player even in a bad year with K% and AVG. Lots of room for growth, and the power/speed gives a nice floor.",https://www.mlbdatawarehouse.com/i/179273161/lawrence-butler
72,73,Drake Baldwin,ATL,C,C,5,$6.99,"Very good hitter, 20+ homer potential with strong ratios. But a 130 GP max? No steals? Will the league adjust?",https://www.mlbdatawarehouse.com/i/179720085/drake-baldwin
73,74,Agustin Ramirez,MIA,C,C,6,$6.33,"One of the few catchers with 25-10 upside, and the K% is low enough to think he can hit for a decent AVG. Seems like a safe option with tons of upside. ",https://www.mlbdatawarehouse.com/i/180831407/agustin-ramirez
74,75,Ceddanne Rafaela,BOS,OF/2B,OF,32,$7.41,"Wild plate discipline makes him streaky, but there's power and speed, and his CF defense should keep him playing",https://www.mlbdatawarehouse.com/i/182986224/ceddanne-rafaela
75,76,Noelvi Marte,CIN,OF/3B,OF,33,$8.05,"Poor plate discipline makes him volatile, could lose some reps because of his defensive inabilities. But a high-risk, high-reward type with nice 3B/OF eligibility.",https://www.mlbdatawarehouse.com/i/182026238/noelvi-marte
76,77,Xander Bogaerts,SD,SS,SS,15,$6.55,"Not much ceiling anymore, and health issues the last two years. But a 15-homer, 20-steal, .265 hitter with job security",
77,78,Alex Bregman,CHC,3B,3B,7,$7.78,"Capped around 25 homers and 5 steals, but he's very safe",
78,79,Taylor Ward,BAL,OF,OF,34,$8.18,"He's getting old! But had a big power season last year and has shown to be a solid hitter for several years now. He could also get traded, and I don't think he has a ton of ceiling, but a solid hitter in multiple ways. ",https://www.mlbdatawarehouse.com/i/178612600/taylor-ward
79,80,Will Smith,LAD,C,C,7,$6.08,"Breakout with the bat in 2025 after lackluster work in 2023-2024. Hesitation is with playing time. Max of 130 games, and less starts tha that",
80,81,Luke Keaschall,MIN,2B,2B,6,$7.16,Will get his fantasy value from steals and batting average. So you're relying heavily on another high LD% and BABIP. Power likely to max out at 15 homers? Solid player but can certainly underwhelm for fantasy purposes.,
81,82,Spencer Torkelson,DET,1B,1B,12,$6.79,"Elite air pull, good enough contact ability. Safe bet for HR+RBI, but not much upside.",https://www.mlbdatawarehouse.com/i/182515576/spencer-torkelson
82,83,Matt Chapman,SF,3B,3B,8,$8.24,Should play a bunch and hit some homers. But the floor/ceiling stuff is ugly for the 32-year-old.,https://www.mlbdatawarehouse.com/i/181786401/matt-chapman
83,84,Royce Lewis,MIN,3B,3B,9,$6.82,"Has not been a good hitter in the last two seasons, but maybe it was due to a lack of health? Started stealing bases again in September. Fine source of power, but everything else is in question.",
84,85,Andy Pages,LAD,OF,OF,35,$7.83,"Defense should keep him in the lineup, and he's been an above average hitter, but the ceiling is pretty low and he's probably the 9-hole guy",
85,86,Jonathan Aranda,TB,1B,1B,13,$6.07,"Higher K% and Cont% than you're comfortable with, and huge BABIP regression is due. Also he's likely in a partial platoon. But he's a good bet for batting average and some RBI with 20+ HR potential.",https://www.mlbdatawarehouse.com/i/180243530/jonathan-aranda
86,87,Jacob Wilson,ATH,SS,SS,16,$4.93,"Single digit risk in HR and SB, but a shoe in to hit .280+ and he'll play a bunch. ",https://www.mlbdatawarehouse.com/i/179273161/jacob-wilson
87,88,Ozzie Albies,ATL,2B,2B,7,$6.43,I don't see much more upside than a 15-15-.250 season. But that works at the 2B position. And there's some counting stat upside if the Braves have another big year. ,https://www.mlbdatawarehouse.com/i/179720085/ozzie-albies
88,89,Chandler Simpson,TB,OF,OF,36,$6.68,"Can steal 70 bags and hit .280. But zero homers and questions about the playing time because of the shaky defense. Tough call to make, but he fits a certain draft strategy.",https://www.mlbdatawarehouse.com/i/180243530/chandler-simpson
89,90,Jurickson Profar,ATL,OF,OF,37,$7.65,"Should play a bunch near the top of the ATL lineup. Has some power and some speed, gets on a base at a good clip. He's fine, but unexciting. ",https://www.mlbdatawarehouse.com/i/179720085/jurickson-profar
90,91,Mike Trout,LAA,OF,OF,38,$7.12,"He's mostly an empty power bat this point. K% spiked to 32%, he stopped stealing bases again. There's no longer that top-20 ceiling when he's healthy. But 30-homers and 90 RBI wouldn't shock anybody. ",https://www.mlbdatawarehouse.com/i/178121572/mike-trout
91,92,Ivan Herrera,STL,C,C,8,$6.58,"Solid bat, high floor. 20-homers, 10-steal potential. But not the biggest ceiling, and there were a lot of injuries last year. ",https://www.mlbdatawarehouse.com/i/180539264/ivan-herrera
92,93,Colson Montgomery,CWS,SS,SS,17,$7.05,"Clearly has 30-homer potential, but the plate discipline, lack of speed, and team context seem to outweigh the benefits that come from the power. Could see him whiffing his way back to the minors for a stint.",https://www.mlbdatawarehouse.com/i/176288033/colson-montgomery
93,94,Yandy Diaz,TB,1B,1B,14,$7.41,"The park change is going to hurt, and he's at the age where you really start worry. A Diaz fade is a pretty safe thing to do in my mind. He's not going to be a huge positive in anything but points leagues. ",https://www.mlbdatawarehouse.com/i/180243530/yandy-diaz
94,95,Ian Happ,CHC,OF,OF,39,$8.92,Super boring and a lot worse if he's only going to steal five bags now. We're hoping for a .250 AVG and 25 bombs for value. Better in OBP leagues.,
95,96,Bryan Reynolds,PIT,OF,OF,40,$8.07,Good buy-low bounce-back candidate. Was unlucky and still hasn't aged out to the point we should be worried. He's back in the OF3 discussion for next year as a safe-ish player you can get at a big discount.,https://www.mlbdatawarehouse.com/i/177585967/bryan-reynolds
96,97,Otto Lopez,MIA,SS/2B,SS,18,$5.67,Solid 15-15 guy with a .250 batting average. More of a floor player than a ceiling one. ,https://www.mlbdatawarehouse.com/i/180831407/otto-lopez
97,98,Jakob Marsee,MIA,OF,OF,41,$9.98,"I believe in the OBP and steals, the power and batting average are much more questionable. I'm into him, but I don't want to go overboard, because he could hit .240 with 12 or so homers if things go wrong. ",https://www.mlbdatawarehouse.com/i/180831407/jakob-marsee
98,99,Isaac Paredes,HOU,3B,3B,10,$4.21,"Basically a one-category roto player (HRs). No steals, probably low AVG, but he can certainly hit 30 bombs if he stays healthy",https://www.mlbdatawarehouse.com/i/182515558/isaac-paredes
99,100,Ramon Laureano,SD,OF,OF,42,$6.97,Can he keep up the newfound production against righties? Will he play daily? It feels pretty risky to buy in on the 30-year-old breakout season,
100,101,Luis Garcia Jr.,WSH,2B,2B,8,$6.30,"Nearly went 20-20 back in 2024. Elite K% gives him batting average upside, but has never put it all together and will sit a bunch against lefties. Better 5x5 guy than OBP/points.",https://www.mlbdatawarehouse.com/i/176667994/luis-garcia-jr
101,102,Jac Caglianone,KC,OF,OF,43,$6.28,"Bad results in 2025, but good indicators. Kept the K% down, high Z-Cont%, and smoked the ball",https://www.mlbdatawarehouse.com/i/181825834/jac-caglianone
102,103,Dylan Beavers,BAL,OF,OF,44,$4.66,"Five tool potential. Impressive skills. Some questions about playing time, but I like his chances. Could be a very good fantasy player. PT questions after the Ward trade",https://www.mlbdatawarehouse.com/i/178612600/dylan-beavers
103,104,Colton Cowser,BAL,OF,OF,45,$6.37,"Big power, decent speed, but lots of strikeouts, some injuries, problems with lefties. Should hang in the lineup with his ability to play CF, but he's a highly volatile player",https://www.mlbdatawarehouse.com/i/178612600/colton-cowser
104,105,Kyle Stowers,MIA,OF,OF,46,$7.79,"I'm hesitant to project his .350 BABIP again even though the xBA backed it up. Lots of whiff, handful of steals only. I think there's real downside with the guy and he'll be a pretty replaceable player. ",https://www.mlbdatawarehouse.com/i/180831407/kyle-stowers
105,106,Sal Stewart,CIN,1B,1B,15,$5.87,"Great power indicators in the minors that carried over to a short sample in the Majors. Should have a track to 1B/DH daily reps, with 10 steal potential as well. High upside, but always a risk with a first year player. ",https://www.mlbdatawarehouse.com/i/182026238/sal-stewart
106,107,Jose Altuve,HOU,2B/OF,2B,9,$7.98,"The age is really getting to him with the .260 xBA last year. Still 20+ bomb potential, but bad AVG and few SB?",https://www.mlbdatawarehouse.com/i/182515558/jose-altuve
107,108,Yainer Diaz,HOU,C,C,9,$6.10,"Batting average fell due to some bad luck. I'm wondering if he won't lose some DH reps, but a good bet for 125+ games, .270+ batting average, and 15+ homers",https://www.mlbdatawarehouse.com/i/182515558/yainer-diaz
108,109,Francisco Alvarez,NYM,C,C,10,$4.66,"Big-time power, could be a smash breakout catcher if he can stay healthy.",https://www.mlbdatawarehouse.com/i/182025983/francisco-alvarez
109,110,Brandon Lowe,PIT,2B,2B,10,$6.81,"Well over 30 now, injury questions, platoon questions, park downgrade (trade?), not much other than the power. But the power is good!",https://www.mlbdatawarehouse.com/i/180243530/brandon-lowe
110,111,Jorge Polanco,NYM,2B,2B,11,$6.00,Feels like you're buying high after a resurgent 2025 season that came out of nowhere. Not much skill other than a potential to hit ~25 bombs.,https://www.mlbdatawarehouse.com/i/182025983/jorge-polanco
111,112,Alec Burleson,STL,1B/OF,1B,16,$7.61,"Good batting average, 20-homer pop, handful of steals. He's just ""fine"" across the board.",https://www.mlbdatawarehouse.com/i/180539264/alec-burleson
112,113,Alejandro Kirk,TOR,C,C,11,$5.27,"Limited power and no steals, and he won't play every day. But he's a high floor hitter, very skilled",
113,114,Kyle Teel,CWS,C,C,12,$4.88,"Enormous potential if he can develop some more power. Batting average looks solid with a great launch angle profile. 15+ homers, 10 steals, .270 average with a bunch of walks.",https://www.mlbdatawarehouse.com/i/176288033/kyle-teel
114,115,Dillon Dingler,DET,C,C,13,$3.04,"Very strong hitting stats. Not a ton of upside, but seems like he could hit 20 bombs with a high batting average.",https://www.mlbdatawarehouse.com/i/182515576/dillon-dingler
115,116,Heliot Ramos,SF,OF,OF,47,$7.48,"Seems like 25-homers, .260 average, ten steals is the absolute ceiling. Lots of downside across the category board.",https://www.mlbdatawarehouse.com/i/181786401/heliot-ramos
116,117,Masyn Winn,STL,SS,SS,19,$6.89,"Safe playing time, does a little bit of everything. No ceiling, but a fine floor. I could see 15-15 with a .260 batting average.",https://www.mlbdatawarehouse.com/i/180539264/masyn-winn
