,rank,player_name,positions,organization,eta,comp,prime_skills,ranking_explanation,previous_rank,hit_grade,plate_approach_grade,power_grade,speed_grade,other_tool_grades
20,28,Bryce Eldridge,1B,Giants,Debuted,Taller Matt Olson with more gaps in the hit tool to work on,"Big time power potential at a huge 6’ 7” 223 lb., but he needs to close the gaps in his swing in order to avoid being over exposed to strikeouts.  He’s done a much better job at showing a good eye for walks, but the K rate and swinging strike issues are still existent. The 68.7% contact rate and 81.3% Z-contact% are below average, but the quality of contact is great with a 16.2% barrel rate and a solid 13 degree average launch angle.  The power is legit with a 114.6 max EV and 108.5 90th percentile EV.","Eldridge has big time power potential and the athleticism to rack up doubles in the event San Francisco bay winds hold back the power ala Brandon Belt.  He will have to work through the long swing to close the gaps in his contact%, but San Francisco has been aggressive with him.  He got off to a late start this season due to an injury, but he fought his way all the way up to the majors with 25 bombs in 102 minor league games.  This battle between Briceno and Eldridge is a close one to me, Eldridge has greater power potential and at his age is incredibly impressive (see age adjusted wRC+), but Briceno’s more well rounded approach is more attractive to me longer term.  However, I pick Eldridge over Briceno in shorter term leagues due to the proximity.",19,45/50,40/45,65/70,30/30,
21,29,Josue Briceno,C/1B,Tigers,Early 2027,Joey Votto mechanics,"Huge 6’ 5” catcher who has already started to move off to 1B due to the size and with a plus hit tool and plate skills, while the power came along in the Arizona Fall League in 2024 where he cranked 17 extra base hits, including 10 bombs including a .433/.509/.867 slash line.  The power continued forward into this season, but the contact rate decreased from 84% last year to 76.4% this season, but that drop is worth the power uptick if that’s the tradeoff and he has been pushed hard up levels this season - so I expect some rebound once he settles in at the higher levels.  There are also good power angles here as he has a near 50% flyball rate that is not yet factored into the fScores.  Briceno has put up a 114.3 max EV and had a ridiculous 107.5 90th percentile EV in 2024.","He’s big, strong, has a great eye and can make contact, which is why the Tigers are starting to move him away from catcher as this is a guy you want to focus on hitting.  He’s playing a bit young for the level, but unfortunately is a max four category contributor as stolen bases are a complete non-factor in his game, which dumps him behind Bazzana even though he has a potential full grade upside in the power department.",29,50/60,55/60,55/65,30/30,
22,30,Rainiel Rodriguez,C,Cardinals,2028,Agustin Ramirez w/ more power and less speed,"Big time power potential with plus to plus, plus exit velocities for his age (105.1 90th percentile EV and 111.1 max EV) and a great, mature plate approach as well as crazy pull power (I saw him hit the second longest homer in Roger Dean of anyone I have seen there, including pro players).  The hit tool tracks to be above average to plus, keeping in mind he’s still only 18-years-old and he continues to get better the longer he’s at the level.","Rodriguez has a sky high power ceiling at catcher / DH and is a little short to move off position to 1B.  He’s a solid, but not fantastic defender at catcher with a good arm and may see some time in LF or 3B at some point just based on the Cardinals catching depth so there may be a Josh Donaldson-like move around the field.  I have seen a lot of Rainiel Rodriguez in person and every time I see him the plate approach and contactability improve, so there’s no reason to think he won’t develop into a power hitting stud.  The hit tool and plate approach launch his potential over many guys with way better proximity, but not enough to bump him ahead of Eldridge (who is already in the majors and has 7-8 inches of height on Rodriguez) or Briceno who is a similarly talented hitter with a bigger body and a more developed hit tool vs. the power / quality angle profile of Rodriguez.",40,50/60,60/65,55/70,40/35,
23,31,Ryan Waldschmidt,OF,Diamondbacks,Mid 2026,Righty Lars Nootbaar,"Big OF who can play in CF and has great plate skills with an above average hit tool to pair with a solid power and speed combo.  He hits the crap out of the ball and had some of the highest exit velocities in the 2024 draft.  Waldschmidt is a little overly passive for someone who has some insane tools statcast wise (ala Lars Nootbaar), but thankfully he has increased his in-zone aggressiveness since my last ranking of him, though he still is not as aggressive as I would like.  The line drive rate is an insane 31.3% at AA as he also gets to optimal angles.  Waldschmidt has plus power with a 109 mph 90th percentile EV and 112.5 max EV.","I always love when guys walk more than they strikeout and Waldschmidt is a guy who can possibly do this through the minors.  I expect Waldschmidt to debut at some point next year and if his development continues to a league average hit tool, combined with his natural athleticism and batting eye would make him a potential All Star level player. Rodriguez has a safer hit / power combo despite being younger than Waldschmidt and thus gets the edge in my rankings even though I don’t expect any speed out of him as he has a progressively elite hit / power combo.",31,45/50,65/65,55/65,55/60,
24,33,Joshua Baez,OF,Cardinals,Late 2026,Byron Buxton / Jo Adell mash up,"Baez is a big, toolsy OF the Cardinals drafted in the second round of the 2021 draft with a much improved hit tool from a 65% contact rate in 2024 to a 75.1% contact rate in 2025 with solid angles for power.  Baez has mashed with a max EV of 114.4 in 2023 and in 2025 he has recorded another 114 EV bomb.  He ran a 106.6 90th percentile EV in 2023 and we don’t have all the numbers for what he has done this year, but he has 30/30 type tools if he can put the hit tool together.  The contact rates continued to improve throughout the season and was over 80% from August 1st onward as he finished the season with homers in three consecutive games.","Baez has had a roller coaster minor league career after a very strong 2022 season, but a rough 2023 and 2024 kind of made him fall off the prospect rankings table - until this season, where he is definitely back!  He has no splits troubles and there’s a chance the hit tool could trend to above average based on the linear progress he made in 2025.  Baez changed his stance to be more upright as the season progressed ala Byron Buxton and notched a .301/.401/.537 slash with 8 bombs in his final 150 PAs.",85,45/55,50/50,60/65,65/60,
25,34,Carter Jensen,C,Royals,Debuted,Bo Naylor mechanics w/ a bit of a Will Smith batted ball profile,"Jensen is a beast of an athlete for a catcher.  The Royals are the masters at developing stud catchers it would seem - with the Cardinals.  He has some solid pull power while also showing the ability to hit the ball the other way, which should keep him from getting shifted to death.  Jensen notched a subpar 73.8% contact rate on the season, but a very good 86.4% Z-Contact and he makes good quality contact within the zone as evidenced by his 16.3% barrel rate and 107.3 90th percentile which has resulted in an insane 59.6% hard hit rate at AAA and an over 23% line drive rate, so while he has below average contactability, the quality of contact is excellent and boosts his overall hit tool.","Jensen’s walk rates increased as he moved up levels, but unfortunately for aggression's sake his swing rates decreased in turn without much of a drop in K rates.  Jensen hits the ball consistently hard and even in his major league small sample size was hitting the ball hard and hitting to optimal angles with new max EVs which push his power potential up to over plus.  While Jensen has the proximity and has shown more consistent angles to Baez to date, Baez actually has better contact rates and has a big time edge in the speed category.",69,55/55,50/55,55/65,50/45,
26,36,Jett Williams,2B / SS / OF,Mets,Early 2026,"Jose Altuve build, Bryson Stott-like production","Plate skills and speed, the contact tool is still developing, but should ultimately be a good tool for Williams, as he has gotten the hit tool close to his pre-injury 2023 levels with an 80.1% contact rate.  He has non-zero power and because he has a quick swing can get to a surprising number of extra base hits.  He has a max 108.4 EV in a small sample size of statcast data this year and could run into a couple 20 homer seasons, but will likely live in the 15 homer range who can steal 30-40 bags.","Jett is an interesting player who should have some position flexibility and has a bit of a mighty mouse in him despite the smaller stature.  If he can get to a league average hit tool, the advanced plate approach and speed will carry him to fantasy relevance, however he needs to improve efficiency on the basepaths in order to get a forever green light.  There’s proximity here, but I’ll take Jensen’s banked attack angles and EVs to the speed and better plate skills of Williams.",43,45/50,60/60,45/55,60/60,
27,37,Bryce Rainer,SS,Tigers,Late 2027,Lefty Carson Williams mechanics with a better hit tool and plate skills,"Big lefty bat with a nice stroke that should lead to an average hit tool with very good line drive angles (11.1% barrel rate and 23% line drive rate, though he did hit the ball on the ground too much and has poor air pull rate, which could limit his power upside).  He has already shown plus power at the plate with an elite 90th percentile EV of 107.9 and a max EV of 111.6 with some wheels to boot.  He was also a pitcher and has a killer arm, so should be a prime defender as well.  Sans injury, Rainer might have worked his way into the top 20 prospects by year’s end, so now is the time to buy before he has a ridiculous Spring Training and everyone remembers him.","The eye is solid with a 21.7% chase rate and there are no split concerns as he’s actually hit lefties better than righties with a nice reverse split hitting .318/.462/.500 against lefties.  Rainer has been completely overshadowed by Konnor Griffin, but he is a very good prospect in his own right and could be a nice dynasty value since he’s avoided all the hype of some other similarly successful prep prospects.  His EVs are impressive and his ability to get to barrels, but he needs more consistency in his angles in order to optimize his offensive profile. Jett Williams gets the edge primarily only because of about a two year proximity gap.",35,40/50,50/60,55/65,50/55,
28,39,Kaelen Culpepper,SS,Twins,Mid 2026,Dansby Swanson,"Kaelen Culpepper is showing a very nice hit tool and plus plate approach this season with a little power and speed on the side as the Twins first rounder from last season.  Culpepper is running an average contact rate at 76% and is running a reported 105.9 90th percentile EV with a 110.3 max EV on the season.  Culpepper has a slight reverse split, however the approach and power doesn’t change much - so this may just be a coincidence.  His ability to hit to angles is more or less below average at an average 10 degree LA, but he has hit to a near 50% groundball rate; though his flatter swing path should lead to more line drives and less ground balls as he continues to develop.","Culpepper has gone from a solid potential starter to a near guaranteed major league regular who will have fantasy value as an above average across the board player in the mold of a Dansby Swanson (who was my comp at the beginning of the year and that has really carried forward).  He’s a safe 15/20 bet with who will hit .230-.270 in the majors while he is in his 20s and unlike other Twins prospects, he has yet to have a major injury slow him down as of this writing… I just knocked on wood.  Culpepper gets some points for proximity and for being well rounded, but some of the guys with more unique / elite tools get the edge for me this go around, for example, Bryce Rainer’s power potential.",34,45/50,55/60,55/55,60/55,
29,40,Josuar Gonzalez,SS,Giants,2029,"Wander Franco (I know, the name is as bad as Voldemort, but it’s true)","Switch hitting kid with a nice swing from both sides of the plate and plus power from both sides, already showing some loud power tools with a wood bat.  He has some wheels as well and projects out as a very well rounded player as long as the hit tool continues to develop as he ages through the levels. The 78.9 Contact% is actually excellent compared to most of the DSL players and he walked more than he struck out, so you have to love the hit profile.  The only exit velocities available are that he has a reported 104 90th percentile EV in the DSL this year, which is fantastic for his age.","Gonzalez was widely seen as the top international signee from last year and has firmly established himself as a legit dude after the DSL season this year.  It will be fun to track him next year, as he could be on a Made-esk track if the Giants place him in low A to start the season (though it should be noted the Giants have been relatively conservative in promoting their prospects outside of Bryce Eldridge).  Gonzalez is raw as a DSL guy, but I think he ultimately has higher upside than Willits thanks to the power, providing a more well rounded profile with big time star potential.  However Culpepper gets the edge with his proximity and sneaky 20/20 upside. Top 150 Rank:  116",,45/55,50/60,40/60,60/65,
30,41,Eli Willits,SS,Nationals,2028,Bigger Jimmy Rollins type,"Willits is best known at being a very well-rounded player and could be kind of a highschool JJ Wetherholt type (with less power) where he will just kind of be boringly good at every level.  We basically have no EV data on Willits publicly available since 2024, so there’s no point to repeat those numbers.  There’s not a ton of public data yet, so I’m going to get a lot on feel from the video we have available and small sample sizes.  The contact in his debut is what really stands out.","Willits should be a very solid across the board player and will be on my rankings for the next 3-4 years or so as he makes his way levels, so hopefully in 2-3 years I’m not writing about prospect fatigue on him.  His rank is based more on my gut feel and projecting off not a lot of video, rather than hard data and a ton of video / in-person looks.  The good thing is, I should get to see him a decent amount next Spring Training.  Willits likely has a bit more upside than Culpepper, but with limited data and Culpepper’s massive proximity edge, he gets the nod in the pecking order.",55,50/60,45/55,35/45,60/60,
31,42,Nate George,OF,Orioles,2028,Jackson Chourio light,"George was a high schooler drafted out of the 16th round who has been one of the bigger breakout guys this year.  George has a potentially plus hit tool and demonstrated the ability to get to great angles at low A with a fantastic 31.3% line drive rate, that has not yet translated to high A.  He has plus, plus speed, but he is not the greatest baserunner, having been caught stealing 25 times this year.  I don’t have a full ticket of exit velocity data on George, but he has recorded a 108 max EV this year after recording a max 104 last year in high school.  The biggest concern is the angles are geared toward doubles and gap power, rather than home run power.","It should be noted George does have some reverse platoon issues hitting only .208/.328/.283 against lefties.  George has a lot of potential and has demonstrated above average contactability and plate skills for his age, but needs to work on angles and his baserunning to maximize his skillset.  He’s a high risk, high reward type based on his current profile, but he has extremely high upside thanks to a great hit tool in line with some of the top 2025 draftees like Willits.",113,50/60,45/55,30/45,55/70,
32,43,Dax Kilby,SS,Yankees,2028,Skinny Gunnar Henderson,"Kilby’s a lean, projectable kid who already hits the ball harder than you would think looking at him, notching some ridiculous EVs in his small sample size debut to go with having top five run times in the 2025 draft class for those who participated in the combine, showing off some good base running ability in his debut and has shown a better than expected hit tool in his debut making him one of my favorite players to target in FYPDs, despite achieving terrible angles.  There’s room for a ton of projectability as he adds muscle to the frame and develops the hit tool for better attack angles.","Kilby might have an ultimately safer profile to George being a more efficient runner with higher power potential, but George has done it for a year in pro ball and has proven to have a solid to plus hit tool over the full course of a season, which gives him the edge - plus one year in a proximity boost.  On the other side of the coin, I jumped Kilby over Ralphy based on the potential to be a five tool player while Ralphy as a corner guy does not have the speed component to his game, limiting his fantasy upside.",N/A,45/55,50/60,45/60,60/65,
33,44,Ralphy Velazquez,1B/OF,Guardians,Late 2026,Lefty Only Victor Martinez,"Great hit tool with power, plate skills and some speed - he had some bad luck in 2024 and performed extremely poorly in high A, but has had a major rebound this summer getting a promotion to AA where he finished the season on an absolute tear.  The hit tool is tracking to be a solid above average.  We don’t have 2025 statcast data, but last season Ralphy notched a max EV of 115 including a 105 90th percentile EV and 16% barrel rate showing he can get to optimal angles all under the age of 20.  His second half slash between both levels was .325/.406/.581 with 10 bombs.","Velazquez was the Guardians first round pick, so this isn’t coming out of nowhere, but he has been especially impressive in CPX and A ball in 2023 and after a rough 2024 has rebounded for a very nice 2025 season, improving his ability to limit strikeouts at a very manageable 14.3% K rate in the second half which boosted his total slash and ability to create damage.  He’s moved off catcher permanently, which is probably for the better to get his bat into the lineup regularly.  He projects as a very solid Top 150 Ranking:  83",,55/55,50/55,60/65,35/30,
34,45,George Lombard Jr.,SS,Yankees,2027,Barry Larkin light,"He has a plus, plus plate approach with an average hit tool (73.6 contact% and solid, but not great angles), but some extreme athleticism that hasn’t had a chance to play up yet (outside of the speed) since he’s been advanced aggressively age-to-level in a Cole Young-esk way.  Lombard added some muscle to his 6’ 2” frame this offseason, but it hasn’t resulted in much of a power uptick as of yet.  He’s a doubles guy right now, but could grow into more power as he has reportedly hit the ball over 110 mph, though the highest max EV on record is 108.4 and his 90th percentile from 2024 when we had data was 102.4, but is likely higher post muscle spurt.","Lombard was mashing high A with a .329/.505/.488 line, but has struggled a bit since making the transition to AA as a 20-year-old to a still solid 103 wRC+.  Age-to-level a 50-65 point bounce is fair, as Lombard’s adjustments to AA and a hopeful increase in power production are key indicators for his future value moving forward.  He hasn’t really put up the numbers you would like to see, but tools wise and under the hood he’s been impressive on an age to level basis.  I give Lombard the edge over Nimmala as he has a better plate approach, hit tool and speed; while Nimmala has a higher power upside.",69,40/50,50/60,40/55,65/60,
35,45,Eduardo Tait,C,Twins,2027,A lefty version of the Contreras brothers,"Eduardo Tait has a nice lefty swing with some big power potential, especially for a catcher and made it to A ball in 2024 as a 17-years-old.  Come for the super high EVs for his age and stay for the productively aggressive hit approach that results in a fair number of barrels.  He did have a rough second half after being traded from the Phillies to the Twins, but he’s a catcher and we should remember he had to learn an entire new pitching staff and is responsible for a lot more than standard position players.  A young catcher getting traded mid-season isn’t exactly easy, so we should provide some grace on his post trade numbers from 2025.","Tait has put up some incredibly impressive numbers for this age and I love the swing and power.  He’s also good defensively as someone who got eyes on him at A ball this season, hanging in to catch Andrew Painter.  There is a little bit of a split concern, as he is not good against lefties and as a lefty catcher it means he might have kind of a strong-side platoon thing going on once he’s in the majors, but catchers sit a couple days a week anyway, so maybe it doesn’t even really affect his total per season plate appearances compared to other starting catchers.",42,50/60,30/40,55/70,30/30,
36,46,Ethan Holliday,SS/3B,Rockies,2028,JD Drew in the infield,"Holliday is much bigger than his older brother Jackson Holliday by 4” height and another 30 pounds, thus he’s closer to his dad, Matt Holliday’s, bulk and has a closer toolset to his dad, but as a lefty infielder rather than righty outfielder.  He likely has a higher power upside than his father (recording a 111 mph max EV already), but will hit for lower averages, as he’s running a very poor 57.4% contact rate through his first 78 PAs in pro ball.  It’s funny people are freaking out about the hit tool already and I would be lying if I didn’t say the terrible contact rate is at least slightly concerning, but we are talking about a guy who has a crazy support system working out with his brother and dad all offseason.  Let’s chill a bit on the pessimism.","Holliday has dropped to fifth in my FYPD rankings after the debut, so while again I preach patience with him, I’m also not going to sit on my laurels so while I have dropped him a little, I’ve seen some people dropping him out of the Top 100 and out of their top 10-15 in the FYPD rankings.  Tait gets the edge to Holliday, because for guys who are the same age, Tait has done it at pro ball and has put up a stronger hit approach and louder EVs.",25,25/45,30/55,45/65,45/45,
37,47,Arjun Nimmala,SS,Blue Jays,Late 2027,Leaner Carlos Correa who could put up some Troy Tulowitzki type numbers,"He should stick at SS long-term as a solid defensive player with a good all fields hit tool that currently projects as better gap power than homerun power.  He’s young with a solid frame and brings a lot more power than you might expect for his age.  He maxed out with a 107 EV last season with a 90th EV of 102.3 (solid for his age), but only had a recorded 105.7 in the limited statcast data we have available from high A.  He’s rocking only a 72.3% contact rate with poor angles this year at high A as there seems to be a lot of ground outs or fly outs as he misses with the bat on barrels for line drives.","It has been a tale of two halves for Arjun Nimmala.  Since June 15th, he’s been hitting .178/.273/.288 with only 3 homers.  Before June 15th Nimmala hit .267/.351/.483 with 10 homers.  Nimmala has a higher upside than Montes, hence the ranking above him despite the terrible second half.  He’s adjusted off bad halves successfully before.",31,30/45,50/50,40/60,55/50,
38,48,Braden Montgomery,OF,White Sox,Late 2026,Bigger Jasson Dominguez with less speed,"Athletic, switch hitting power hitter.  He has an arm as a former pitcher as well and a quick, short swing where he gets to the ball no matter where it’s thrown.  Montgomery is a true switch hitter with no split to speak of, he’s a boss on both sides of the plate which is a boon this day in age, though he does appear to have a better eye from the left side of the plate.  He explodes on the ball from the left side of the plate level with the zone and seems to have more of an upper cut on his swing from the right side.  The contact rates have unfortunately dropped from average-ish at low A (74%) to a well below average (67%) at high A and AA, but he does have a high quality of contact with an over 23.5% line drive rate on the season that increased as he went up levels.  Montgomery has recorded some elite power numbers with a 115 max EV and an above average 106.4 90th percentile EV.","Montgomery has a volatile range within each skillset.. Below average contact, above average quality of contact.  Below average reach rate, above average walk rate.  Slow acceleration (poor baserunning 67% SB rate), high top end speed.  Montgomery has proven to be very streaky players over the course of the season and has some loud tools, especially the power that make him very interesting, but he’s still pretty raw and needs to refine his hit tool and approach otherwise he’s just a switch hitting Trent Grisham.",46,35/50,35/40,55/65,45/55,
