,rank,player_name,positions,organization,eta,comp,prime_skills,ranking_explanation,previous_rank,hit_grade,plate_approach_grade,power_grade,speed_grade,other_tool_grades
39,48,Lazaro Montes,OF,Mariners,Early 2027,Shades of an OF Matt Olson,"Big strong kid with fantastic power from the left side and a solid eye. The power is up this year from last year, but he is also striking out quite a bit more as the hit tool seems to be getting worse from a contact standpoint (62.7% contact on the season and 57.7% at AA), while the angles are still very good (15% barrel rate in 2024).  He hits the ball very hard with a reported 116 max EV and a 106.3 90th percentile EV this season and","Montes killed it in low A last season and then struggled when he was first bumped up to high A, but he did finish the season strong.  From August on Montes hit .333/.459/.604 with 7 bombs and 3 steals.  The strikeout rates have ticked up, the contact has ticked down and he has not been good against lefties with a .208/.282/.432 slash, so I have concerns as the current approach is not sustainable for a major league hitter and while Spencer Jones has a higher speed potential that’s fun for fantasy, Montes is only 20-years-old and has more time to further develop the hit tool in the minors as he was at least running a 72% contact at A ball.",24,30/40,35/45,65/70,35/30,
40,49,JoJo Parker,SS/3B,Blue Jays,2028,Roman Anthony-esk light swing mechanics,"Parker has a good swing for staying back on the ball and has a toe tap with big time coil before he strides into the ball from the back of the box.  As noted with some of the other high school guys, a lot of what I’m going on is a small amount of video, some limited sabermetrics and high school stats.  He had a max EV earlier in the season of 99.3, but due to his consistent swing and good angles he has a mid 20s power upside.","Parker was one of my favorite players in the draft class and has a swing that portends to eventual pull power that should play up as scouts report he has good barrel presence.  He hasn’t done anything yet in pro ball to move up my rankings, but upon re-evaluation of my FYPD ranks and where I like him vs. other FYPD guys, this is just where he should really end up in my rankings with more research done this off-season.  He’s a safer bet long term than Braden Montgomery, but Montgomery gets the edge based on the EVs and the proximity bump.",71,45/60,50/55,30/55,50/50,
41,49,Mike Sirota,OF,Dodgers,2027,Julio Rodriguez Light,"Sirota has an advanced plate approach and big time athleticism with a power / speed combo that pops as long as he can hit at least at an average level (73.4% contact rate this season).  He’s a twitchy hitter in the box with quick hands that lead to explosive gap power along with some great quality of contact with a 26% line drive rate on the season.  Sirota had a recorded max EV of 113 and a 90th percentile EV of only 102.6, but this was only in limited sample size - the line drive rate and extra base hit ability show there is a plus power tool.","Sirota is one of the top breakout prospects of 2025, but unfortunately is out for the rest of the season so his numbers are locked for the season, the speed is there (though he hasn’t shown it in the steals department) and I trust the contact and plate skills a bit more, even in only a small sample size in the minors.  The baserunning did not match the speed this year, but there is more potential than what we have seen on the back of the baseball card.  Sirota ran a 189 wRC+ on the season and has only played at levels where he is above or at the average age.  I bump him ahead of Spencer Jones as the hit tool and plate approach are significantly better, while the tools are only slightly worse.  Montes gets the edge to me despite me trusting Sirota’s tools more right now, just because of the age-to-level power being so impressive.",71,40/45,60/65,55/65,45/55,
42,50,Michael Arroyo,2B,Mariners,Late 2026,More athletic Ronnie Belliard build with a good Jorge Polanco-ish profile.,"Short swinging stocky athlete with quick hands and a ton of power in his fire hydrant frame along with some speed.  He has a good plate approach and above average contact tool, which led to the 2024 breakout that has now carried over to 2025.  Arroyo has recorded up to a 109.7 max EV in 2025 and we don’t have barrel or launch angle data on him, but the 23.7% line drive rate, under 35% groundball rate and reports of consistent hard contact with doubles power lead us to the conclusion he’s a plus angles hitter with an above average hit tool.  Arroyo has a 76.5% contact rate on the season and is a classic sum of the parts is greater than the whole type of guy when all his above average tools are working in coordination.","Arroyo is a really solid player who is consistently good at advanced levels for his age, but tools-wise he is practically tapped out for what we should physically be able to project.  There’s always a chance some improved bat speed could boost his hit or power tool a ½ grade, but while he’s incredibly stable, he’s a high floor, lower ceiling guy.  I like Arroyo more for points leagues at more of a top 40 prospect, but considering roto as well, there are guys like JoJo Parker who just have a higher hit and power ceiling from the latest draft class and proximity be damned, I’m going for the hit/power upside.",32,55/55,55/60,55/55,45/45,
43,52,Zyhir Hope,OF,Dodgers,Late 2027,Lean Josh Naylor,"Shorter dude with quick hands and a high impact lefty swing with some major pull power.  Hope started the season hot, but finished with a cool .220/.345/.339 slash in the second half.  The contact rate is way down to a lackluster 67.2%, but he’s still showing a good eye at the plate and reportedly has hit (when recorded) to a 90th percentile EV of 108.5 (keeping in mind we don’t have public EV data for him), but he did hit a 470 foot bomb in the Arizona Fall League and he gets good angles with a more than 25% line drive rate, though he has pulled the ball less this year which has hurt him a bit in the HR/FB totals.","Hope’s hit tool has regressed as the season has gone on, though he does have some sneaky speed and should hit for more power as the quality of contact itself is good when the ball hits wood.  He needs to reign in the strikeouts and take more chances in-zone instead of accepting walks if he’s going to do the most damage he can in the lineup, otherwise he may be more of a solid #6 hitter type rather than a middle of the order guy.  Arroyo gets the edge to Hope in my rankings for hitters as he has a better hit tool and a much more consistent, mature approach",33,40/45,45/55,50/65,55/55,
44,52,Jordan Lawlar,SS,Diamondbacks,MLB (on IL),Trea Turner light,"Lawlar has a nice power swing, but it may affect his contact ability in the majors - he has all fields power and ridiculous speed, he’s a very aggressive base runner and puts himself in good positions to make things happen on top of having way above average plate discipline for his age. Lawlar put up a 75.1% contact and 83.2% Z-Contact at AAA, which are average-ish, but the angles were very good with a 10.6% barrel rate and 15 degree launch angle, but his trouble with breakers has killed him in his small major league sample size.  He puts up a solid 88.8 average EV, 104.3 90th percentile and a great max EV of 113.3 showing he doesn’t get close to his top level power enough, so there is room for growth.","Lawlar has had a rough time in the majors after mashing at AAA, but the biggest issue might be his lack of regular playing time.  It’s tough to judge him when he’s popping in for pinch hits instead of starting and it may just take a little time for him to warm up, but the minor league numbers show us a solid player on the field when he’s healthy with more room to grow in his power potential.  The keys for Lawlar are health, learning to hit off speed pitches and regular playing time.  The health is what drops him to this spot in my rankings and I nearly placed him below Spencer Jones because of his lack of health, but Jones’ hit tool is just so bad that I’m not sure he can make it in the majors - he’s such a wild card.",17,45/50,45/55,50/60,65/65,
45,53,Spencer Jones,OF,Yankees,Early 2026,Joey Gallo w/ more speed,"He’s huge at 6’ 6” and has ridiculous power potential with decent speed to boot. He has a ton of sneaky speed to go along with the huge power potential, but the swing has some massive holes in it and has gotten progressively worse (73.2% contact rate in 2023, 61.6% in 2024 and 60.9% in 2025).  The contact part of the hit tool is bad, but the quality of contact is great as he has a 17.9% barrel rate and 14 degree average launch angle on the season, which is the only reason I give him a potential 40 grade on the hit tool. Developing a consistent (even if below average) contactability is what he will live or die by in the majors.","He has changed his stance a number of times this season which has lead to major inconsistencies from week to week, with a .181/.274/.250 slash in his last 19 games and he had hit .423/.478/.962 in the 19 games prior to that.  At the end of the day, the stats look good, but it’s a weird journey to get there and it might not be fun in a weekly H2H league.  He’s basically the living, breathing risk reward line for “go big or go home.”",72,30/40,35/35,60/75,60/60,
46,54,Franklin Arias,SS,Red Sox,2028,Righty Luis Arraez with a tad more power potential and better glove,"Good plate skills with above average power, really quick bat speed and hands and great speed.  He has an elite hit tool, one of the best in the minors with a 89.5 Contact% in high A.  He’s also shown the ability to steal some bags and has non-zero power with the power actually improving at high A from low A.  The highest recorded max EV for Arias is only 105, but that was also back when he was at A ball and we had those readings, while he has an average-ish for his age 102.6 90th percentile EV.  He has at least an average ability to get decent angles on the ball with a solid doubles profile, but has yet to translate that to homerun power.","I learned my lesson by only ranking Jacob Wilson in the 60s… don’t underestimate an advanced hit tool in young guys that could still add power or speed.  He has a 105 wRC+ in high A as a 19-year-old, with which an age-to-level bump would give him another 50 points.  The speed potential has unfortunately fallen off this year, but I think there could be 10-15 homer upside for a guy who should be a consistent .280 plus hitter.  Having Arias ranked right next to Spencer Jones is hilarious because they are polar opposite players, but I give Jones the nod based on proximity and that the power/speed tools are just more tantalizing for most fantasy baseball leagues.",22,65/70,55/60,35/45,40/40,
47,55,Chase DeLauter,OF,Guardians,Late 2025 / Early 2026,Hunter Pence (without the speed) and lefty Matt Holliday mash,"DeLauter made his debut (finally) in the post-season for the Guardians.  He’s shown a really strong hit tool (82.8% contact rate and 85.6% Z-contact) and has some unrealized power in his small sample size at the minor league level (107 90th percentile EV and 110 max EV).  The pull power from his college days and the ability to mash extra base hits regularly is tantalizing, but he needs to show some health and stay on the field to realize his potential.","DeLauter just can’t stay healthy and that’s tanked his prospect profile a bit for me.  Every time he’s healthy and I think I’m back in on him, he gets hurt again.  If he could stay healthy he has a .270-.280 profile with 25 homerun upside plus a ton of doubles power.  If he didn’t have the health issues, he would be up in the 30s of my prospect rankings, but I do still like him and the fact he was on the Guardians post-season roster means he should break camp as a starter in 2026.",60,55/60,65/65,55/60,40/40,
48,57,Jonny Farmelo,OF,Mariners,Late 2027,Charlie Blackmon,"Big long levered lefty with some big time power / speed potential with quick back speed.  He tends to coil up as the pitch is coming in and unleashes to make some nice driving contact that I think will lead to a big doubles profile.  The hit tool has been down this year from 80% in 2024 to 65.4% in 2025, but the slug has been up as he hit three doubles in a row once he returned from injury.  Farmelo had a 103.2 90th percentile EV in 2024 as a 19-year-old and he has hit to excellent angles when healthy.","Farmelo missed the second half of the season in 2024 after suffering a right knee injury that required surgery and then missed a large part of 2025 with a couple more injuries.  We haven’t seen the speed this year or the hit tool, but his previous outcomes have shown these skills exist.  This is almost a good, but injury riddled tier between Farmelo and Emmaneul Rodriguez.  I give the edge to Farmelo though as I believe his hit and speed tools have greater potential.",49,35/50,45/60,50/60,55/65,
49,59,Carson Williams,SS,Rays,Debuted (in MLB),Trevor Story outside of Coors w/ better defense,"Power, speed, OK-plate skills the only thing this kid is missing right now is the hit tool (62.7 Contact% and 77.1 Z-Contact%).  He has quick hands and changed his stance from a slight crouch to be more upright since last year, but those Ks need to go down for him to reach his potential as a 20/20 type with a good walk rate in the majors.  He does have a high quality of contact which balances out the terrible general contact rates as he’s running a 40.6 SweetSpot%, 12% barrel rate, 25.6% line drive rate and 107 90th EV which are all phenomenal.  The power is plus as he hits the ball hard consistently with great angles when he does make contact and has put up an 111.7 max EV.","The power and speed skills are both still intact and his ability to take a walk, but the contact rates have always been horrendous.  The good news is he will get playing time because the defense is phenomenal and the power / speed will play, I bumped him over Emmanuel Rodriguez since he is already in the majors and I think he just generally hits to better angles which bumps his hit tool in my mind via quality of contact.",62,35/40,40/45,60/60,60/60,
50,61,Theo Gillen,OF,Rays,2028,"Smaller, more toolsy Parker Meadows","Gillen has great timing at the plate, nice load and really gets on pitches with a sweet and powerful lefty swing.  He has a nice sized athletic build and should develop into a power / speed threat.  He played SS in highschool, but with a weak arm has moved off to the OF.  The hit tool is performing better than I had expected out of the gate with a 74.3% contact rate and only a 8.8% SwStr%, while he’s shown a fantastic eye at the plate, but he has been a little too patient with only a 34.3% Swing%.  He’s been getting to better angles this year with a plus air-pull rate, as he’s also lowered the groundball rate and increased the linedrive rate.  I have not found publicly available max EVs since high school, but this year he has a reported 103.2 90th percentile EV, which is good for his age.","Gillen is a bit of a flier as a high school athlete in a system that can get crowded with Tampa, but there is a good power / speed skill set here that will play up in this system if he can develop the hit tool - as a lot of Rays guys have good power and speed and never develop the plus hit tool.  His plate approach and angles will help the hit and power tool play up and he has been a burner on the basepaths this year despite rookie reports of only above average run times.  I spotted Gillen between DeLauter and E Rod (the injured bros), because I think DeLauter has a very safe profile if he can ever stay on the field while E Rod has louder tools, but there’s a chance he’s a faster Miguel Sano.",112,40/50,60/65,40/55,60/60,
51,64,Emmanuel Rodriguez,OF,Twins,,Rafael Devers meets Max Muncy with speed (credit to James Anderson),"Great eye and insane power (114.6 max EV in 2024 and a 107.7 90th percentile EV in 2025) with a tad of speed mixed in despite being a bigger boy, quick hands though.  Like many of these guys, Rodriguez has to work on his hit tool a bit and cut down on the strikeouts.  The power and speed potential is ridiculous, but he has not been able to get anywhere near his potential thanks to injuries, inconsistencies and strikeouts as the contract rate has not been able to develop (66.7% contact rate and 76% Z-Contact%).","He’s dealt with injuries the last couple of years, but has been good on a per plate appearance basis, despite too many strikeouts and a high three outcome potential.  Rodriguez is a former top 10 prospect for me who has great potential if he can improve the hit tool and limit the strikeouts.  He’s almost a tempered down version of Spencer Jones, but the lack of a developed hit tool pushes him below guys like Arias and Willits.",25,30/35,55/55,55/65,50/55,
52,65,Charlie Condon,OF,Rockies,Late 2026,Less athletic righty Cody Bellinger,"Condon is all about the power, but how much of the power will translate from college and can he hit breaking pitches are the big questions.  He’s a big time fastball hunter and guys at the higher levels might expose him on breakers.  He has a long body, but keeps his hands in so he doesn’t get exposed inside.  He smashes pitches up in the zone and it will be interesting to see if he can keep the strikeout rate down as he’s only making contact on 68.4% of his swings and this has downticked since he reached AA, however the contact he is making is with excellent angles as he has a 28% line drive rate on the season and a 49% pull rate.  Condon put up some killer EV numbers in college, but I don’t have any sure things in pro ball.","Condon’s home/away college splits are incredibly concerning amongst the rumors of SEC teams using a live feed in the dugout when at home (.482/.530/1.125 HOME vs. .279/.367/.698 ROAD).  Thankfully we are finally starting to see what he can do healthy this year after a terrible transition to the minors in 2024 and while there is some volatility in the contact profile, the angles he’s showing are a pleasant surprise.  E rod gets the nod over Condon as he has closer proximity, a better plate approach (despite all the Ks) and more speed.",45,40/45,45/45,50/70,35/40,
53,66,Justin Crawford,OF,Phillies,Cup of coffee 2025,Carl Crawford w/ less power (Taller Juan Pierre perhaps?),"Speed, lightning speed like his dad.  The hit tool is plus or better and the plate skills are improving.  We may also get 10-15 homer power to go along with the rest of the tools, once he improves his ability to get to quality contact.  Crawford has an 84.7% contact rate and 91.4% Z-Contact rate along with an over 65% Z-swing - so the hit tool is very solid.  The crazy thing is his raw power is also not bad, despite no homers, because he is not barreling balls (only 3.1%) and hitting the ball on the ground more than 60% of the time.  He has decent 103.1 90th percentile and 110.6 max EV this year.","Crawford has performed like a stud leadoff hitter at an advanced level for his age throughout his time in the minors.  The lack of power in his profile will stop him from ever reaching the top level of prospects, but he’s projected as an effective source of speed and batting average for the future and could get into 15 homer power if he can translate his raw power into game power (needs to improve angles and get the ball off the ground).  Condon gets the edge with his power upside, but Crawford is underrated and could be the next iteration of the speed guys like Victor Scott to hit the majors and should be up this season, but first needs to get more quality angles and also needs to improve efficiency on the basepaths.",47,60/65,50/55,35/45,60/70,
54,68,Emil Morales,SS/3B,Dodgers,2028,Fernando Tatis Jr. light,"Big, athletic shortstop with high end power potential and decent speed.  He has the Fernando Tatis Jr. swing which has led to a similar batted ball profile (though beware of the high swinging strike rate as an average hit tool is likely the best case outcome with a 73% contact rate).  Morales has a reported 102.6 90th percentile EV which is good at his age and when you combine his projected growth as a big 6’ 3” kid with the optimal angles he gets to there is a lot of power upside here.","It’s hard to rate the younger complex / DSL guys, but Morales is up to A ball now and it should be noted the plate skills have actually improved from complex to A ball.  There’s a lot of potential here with Morales and skills-wise I like him better than guys like Condon, but the proximity gives and raw hit tool that needs a lot of refining (unlike a guy like Edward Florentino) bump him below some rough around the edges proximity guys like Spencer Jones and Condon.",114,30/45,30/50,45/65,50/50,
55,72,Hector Rodriguez,OF,Reds,Early 2026,Wilyer Abreu and Michael Harris II mash (as hitters),"Rodriguez has fire hydrant build as a 200 pound 5’11” player with a short, quick swing that leads to a plus hit tool (83.3 contact% and 90.6 Z-Contact%) though he misses a tad on his swings (strange 5.2% barrel rate still leading to a 29.9% line drive rate). Rodriguez has a much improved plate approach this season and above average power (106.1 90th percentile EV and 110.7 max EV) and a potential 20/10, gap hitter profile that can really boom in Cincinnati.  He’s good enough against lefties to avoid the strongside platoon risk many lefties face.","The biggest issue Rodriguez faces is a lack of barrels that leads to inconsistencies across his batted ball profile that diminishes would could be a 65 hit tool and a sure fire 55 grade power as the batted ball spread is all over the map, though he still tends to find the gaps and pile up a number of liners.  Parker has a higher upside than Rodriguez, though Rodriguez is close to the majors and gets some proximity bump; the difference is a potential All Start in Parker vs a guy I expect to end up as a solid regular, but not a major DUDE in Rodriguez.",109,60/60,50/55,50/55,45/45,
56,82,Demetrio Crisantes,2B,Diamondbacks,2027,Mini Xander Bogaerts,"Crisantes has a greater than plus grade hit tool (86.1 Contact%) and advanced plate approach to go along with decent doubles power and above average base running skills.  He’s a thinner dude right now, but his bat can pay up for doubles power that may end up leading to 20 homer power if he can trend closer to his career max EV (117.3 max EV in complex in 2023, but only a recorded 106.5 in a small sample size in 2025).  The 90th percentile EVs he posted 2024 were 102.5.  The hit tool will get him to the bigs and if the power develops, it will make him an All Star.","Crisantes was looking to make a big rise on the list, but he’s missing the rest of 2025 to get shoulder surgery, which will likely delay his debut for an additional season and could stifle the development of his power tool.  He would have been ranked in the 70-80 range had it not been for the injury.",108,60/65,60/65,40/45,50/50,
57,84,Aroon Escobar,2B/3B,Phillies,2027,Jean Segura,"Escobar has a fire hydrant build at 5’ 10” and 180 pounds and with simple swing mechanics and a naturally laid back load that leads to a solid hit tool (75.5% contact rate and 88.3 Z-Contact%) with a plus plate approach and emerging power to pair with above average speed.  I admittedly wasn’t the biggest fan of the profile this offseason due to the lack of extra base hits, but the power has appeared this year with a 104.7 90th percentile EV and exceptional 27.5% line drive rate which has brought about the extra base hits in 2025, including a great 110.8 max EV for a 20-year-old middle infielder - though is quality of contact is still only below average to average.","Escobar is a solid to above average player who profiles as a good second baseman, who could jump to plus hit and power tools as he develops further that would boost him to more of a Ketel Marte light type of ability, because the EVs are great for his age.  Escobar has higher power and speed outcomes to Hector Rodriguez, tools-wise, but Rodriguez is also closer to the majors and will get a nice Great American Ballpark bump.",80,45/55,50/50,50/55,50/50,
58,86,Alfredo Duno,C,Reds,2027,Shades of Salvador Perez with better plate skills / not as good defensively,"Duno is listed at 6’ 2”, 210 pounds, but I have seen him in person a couple times this year and think he’s quite a bit bigger.   The plate skills are elite and help the below average hit tool play up a bit (69.9 Contact% and 75.1 Z-Contact%), but despite lower end contact the quality of contact is fantastic as he’s rocking a 12.8% barrel rate and 15 degree average launch angle on the year.  The power is fantastic as he has a 106 90th percentile EV and 111.3 max EV on the year and he’s still only 19-years-old!","Duno missed most of 2024 with injuries, but has bounced back in 2025 to be one of the most exciting catching prospects in baseball.  He’s more athletic than he looks as such a big dude and is pretty solid behind the plate.  He may move to secondary DH or 1B duties at some point ala Salvador Perez to keep the power bat in the lineup, but he has enough defensive skill to stick at the position.  He slots behind Baez since Baez adds the speed upside and proximity to the table and ahead of Irish, who has the better hit tool and contact stroke, but Duno ultimately has a much better eye and a higher power outcome, plus will likely stick to catcher unlike Irish.",153,40/45,55/60,55/70,40/30,
