,rank,player_name,positions,organization,eta,comp,prime_skills,ranking_explanation,previous_rank,hit_grade,plate_approach_grade,power_grade,speed_grade,other_tool_grades
0,1,Konnor Griffin,SS/OF,Pirates,Late 2026,Light Fernando Tatis Jr. with an Elly de la Cruz statistical profile,"Griffin is a big righty with a good arm as a high school pitcher and he has some massive power upside.  The high stance and high and tight hands in his swing reminds me of Fernando Tatis Jr. and like Tatis, he will probably have plenty of swing and miss to go with the damage. Tools for days here as Griffin has already posted a max EV of 114.2 and has a 90th percentile EV of nearly 108.  The hit tool is better than expected, but still might only tune in at slightly above league average as he could do better on the angles ala Elly de la Cruz coming up (52% groundball rate and only 7 degree average launch angle).","Griffin has the highest upside of any prospect in baseball and has shown this season to have a much safer hit tool than previously expected after some changes to his batting stance.  He could maximize his skillset further by becoming more efficient on the basepaths and improving his bat path for better angles to generate a higher level of quality contact.  Griffin seemingly improved upon being promoted from low A to AA throughout the course of the season and while some think he will break camp, I doubt the Pirates will allow him to skip AAA and think the absolute best case scenario for promotion would be June or July sans a team friendly long-term contract.",1,50/55,45/55,60/70,70/70,
1,2,Kevin McGonigle,2B / SS,Tigers,Early 2026,"Chase Utley wannabe, but the profile might be more like Nomar Garciaparra","This kid has an insane hit tool and plate skills with developing power.  Despite lackluster angles in our limited statcast data available with only a 6.3% barrel rate and a 103.6 90th percentile, he has recorded much higher max EVs to last year constantly touching 111 and reportedly hitting 112 mph.  He’s a doubles machine with 31 doubles in only 88 games this year.","It’s hard to show concern for a guy with such a honed hit tool and a nicely developing power stroke, however the speed has taken a dump this year as he went from 22 steals and only 2 caught stealing last year to only 10 steals and 7 times caught stealing this year.  There are also some injury concerns I have that nobody wants to discuss, but he only played in 74 games last year after breaking a hamate bone and this year has only played in 88 games after starting the year late from a high ankle sprain.  Griffin has a higher power/speed upsides, but in a points league, I’m probably picking McGonigle first overall.",4,60/70,70/70,55/60,45/50,
2,4,Samuel Basallo,C / 1B,Orioles,Debuted,Kyle Schwarber with a better hit tool,"Solid plate discipline and crazy power for his age, Bassallo has improved as the season has gone on in regards to quality of contact and angles.  The dude is built for his age with fast hands, but a tight / weird batting stance.  He will likely move off the catcher position full-time because of Rutschman.  The contact rates are slightly below average (but we should also be considering his age), but the quality of contact numbers are ridiculous as he’s rocking a 21.5 barrel% and 15 average LA on the season with more line drives and flyballs coming as the season has gone on.","Basallo has massive power potential as he is currently rocking a 108.3 90th percentile EV, 115.9 max EV and 94.2 average EV as a 20-year-old the majority of the season at AAA.  He doesn’t have wheels and luckily it sounds like the Orioles have a plan for playing time as a backup C and DH so I wouldn’t worry too much about playing time.  He may have the highest age adjusted wRC+ due to his performance way above expected at AAA and the MLB.  He is a max four category guy, so that will always limit his fantasy ceiling outside of points leagues.",3,50/60,50/60,65/70,35/40,
3,5,JJ Wetherholt,2B/SS/3B,Cardinals,Early 2026,Corbin Carroll / Marcus Semien mash-up,"Wetherholt hits the crap out of the ball for a smaller guy, is athletic and has a great eye at the plate.  He has quick, an easy swing and great bat control that will likely lead to an early career high doubles profile that later translates into more power as he gets closer to his peak.  Wetherholt has an average EV of 91.4 this season at AAA with a 109.2 max EV to go along with an aggressive in zone approach with a high propensity for quality contact with an 11.9 barrel% and great angles with an aptitude to hit to all fields with a near 25% linedrive rate.","Wetherholt is probably the most well-rounded prospect in this rankings update and should have a number of .280/.370/.480 seasons in the majors with 20/20 outcomes from what will likely either be second or third base.  In AAA he played 12 games at third, 24 games at SS and only 3 games at second base.  It will be interesting to see where the Cardinals fit him in around Masyn Winn, the assumption is he plays primarily second base, but I think he has the defensive chops to play third base.  Wetherholt has a very high floor and while there are prospects lower in the rankings with a higher ceiling, Wetherholt appears to be a lock as an All Star caliber player and while he doesn’t have an elite tool like Basallo’s power, his super power is consistency in all assets of the game.",6,60/65,65/70,50/55,55/60,
4,6,Max Clark,OF,Tigers,Late 2026,Corbin Carroll,"Multi-sport athlete; has a really nice hit tool, a lot of speed and should develop more power as he ages.  He’s likely to develop more into a speed first, 15-20 homer type based on the small sample size of what we have seen in the minors and pre-draft, though there is room for growth as his low A max EV last year was 106.7 and he’s recorded up to a 111.2 max EV this year in limited data samples.  While the hit tool is already 70 grade from a contact standpoint, it’s subpar in regards to squaring up despite a much improved batted ball profile and angles since getting to AA.  My biggest worry is the power tool at this point, especially from a split standpoint where all ten of his homers have come against righties this season, while last year he actually hit lefties better than righties, but he is working hard this offseason to hone his power swing. With his speed, he should be more aggressive on the basepaths.","Clark was drafted primarily for the potential of his tools, but his hit tool and plate skills are the most impressive pieces of his profile right now.  He looks like he could be one of the better players in baseball when he makes it to the big leagues - I would like to see him swing more aggressively in the zone, but funny enough the profile almost resembles Riley Greene with slightly less power, but a lot more speed, though he needs to be more aggressive on the basepaths.  If Clark can run more and better utilize his speed, he could regain top prospect status prior to graduation.",2,60/70,60/70,45/60,55/70,
5,7,Jesus Made,SS,Brewers,Late 2027,Smaller switch-hitting infield Christian Yelich profile and swing mechanics,"We don’t have a lot of statcast data on Made yet, but we have a recorded max EV of 111 at high A and a reported 90th percentile EV of 103.9 with an advanced hit tool on both sides of the plate.  Made is a true switch hitter with no split concerns though the slash as a righty is a bit better despite a higher K rate against lefties.  Made is aggressive on the basepaths, but needs to clean up the steals game a bit having been caught stealing 13 times this year.","Made’s plate skills and athleticism have been impressive this season and though he has a leaner, but more twitchy type athleticism to him.  He’s playing way above age-to-level just like Clark and others like De Vries and Walcott, but has tended to a stronger all around profile with a higher floor and just as high of a ceiling.  Most will have Made ahead of Clark and I get it, but Clark is such a beast when it comes to work ethic and I believe the speed for him is all about when he starts aggressively running, not if - still love made obviously as he is a potential future #1 prospect.",8,55/65,55/60,50/60,60/65,
6,9,Edward Florentino,OF,Pirates,2028,Lefty Julio Rodriguez with potentially a better hit tool,"Florentino is a big, twitchy lefty with a large stride in his swing and is definitely the largest riser from the last ranking to this one after demonstrating a smooth transition to A ball with a plus to potentially plus, plus hit tool thanks to maybe the best angles in baseball.  The power is fantastic and Florentino is the master of fScores with the highest grade of anyone in the minors.","The hit tool is only dampered by the fact he could afford to be more aggressive in-zone to avoid Emmanuel Rodriguez syndrome as he climbs the ranks and he does have some trouble against lefties, at least a low A.  Florentino has the highest upside to anyone not named Griffin or McGonigle, but we have to keep the fact he’s only played up to low A in tow in order to reign in an accurate ranking.  Further proximity also affects this ranking, but he’s still top 10 and may be a future #1 at some point after some guys in front of him graduate.",12,60/70,55/60,50/65,60/60,
7,10,Walker Jenkins,OF,Twins,Mid 2026,Larry Walker / OF Freddie Freeman,"Big, strong lefty for his age and one of the top five guys from the 2023 draft class. He has a ton of pull power, but can hit for extra base hits through all fields.  Jenkins’ carrying tool thus far has been the combo of his plus hit tool, alongside an above average plate approach, but he has not yet developed the power his big frame should get into and he needs to work on his angles - though the angles and power did improve significantly toward the tail end of the season when he got healthy.","It should be noted despite too many injuries, Jenkins has still managed to climb to AAA at the age of 20 and have strong numbers.  If he had consistent health he would be seen as a consensus top 10 prospect, but I suspect others will weigh the lack of plate appearances and the back of baseball card stats against him - providing some nice value in dynasty leagues.  Jenkins profiles more as a points league darling due to an average to above average expected output in the steals department.",7,60/70,55/65,50/60,55/50,
8,11,Luis Pena,SS/3B,Brewers,Mid 2027,Righty only Francisco Lindor mechanics meets a light Jose Ramirez skillset,"Pena is a shorter build for a 3B ala Jose Ramirez and has a good hit tool with an 78.5% contact rate that has taken a beating at high A.  While you might think I’m crazy to compare Pena to Jose Ramirez, J Ram was basically a non-prospect seen as just a slightly solid player around the board.  Pena has a drastic edge on him from prospecting standards.","Pena has struggled a bit in his high A small sample size by being too patient, which has resulted in both a lower contact rate and high K rate at the level with only a 37.6% swing rate.  If Pena were more aggressive at the plate he would run into better counting stats, but for now as he transitions up levels, though the upside is there we must be a tad hesitant to bump him ahead of higher proximity guys.  Jenkins gets an edge to Pena with a higher floor, while they have similar ceilings.",15,55/65,50/55,50/60,60/65,
9,12,Aidan Miller,SS,Phillies,Mid 2026,Royce Lewis w/ More Athleticism and Health,"This dude is an athlete, I had a live look on him and he’s really just a super athlete and a gamer.  A lot of people thought he would move off SS to 3B, but he looks super smooth and athletic and he should stay at SS as long as he can.  He has above average to plus tools across the board with an improved hit tool this year and a great ability to pull the ball in the air plus quality attack angles, but Miller is still pretty raw and seems to run into issues when he gets to a new level, then adapts. He’s young for the level at AAA and with improved athleticism he may be able to stick at SS if the Phillies wanted to move Trea to 2B as he ages, but Miller will likely land at 3B.","Miller’s improved hit and speed in 2025 have changed his career arc from being a potential Matt Shaw type to being a level above, he has All Star potential if not greater if he continues to progress at the current rate.  Pena has more of a track record in the hit and speed departments and while Miller should get to more power, he has had less consistency in his MILB career, though it’s close because he also has much closer proximity to the majors than Pena.  Pena gets a slight edge due to a safer floor.",38,55/60,55/60,55/60,65/60,
10,13,Sebastian Walcott,SS,Rangers,Early 2027,"Fernando Tatis Jr. - light, similar build and swing","Super raw, a huge 19-year-old kid with raw power for days (115.1 EV posted this spring).  He needs to further develop the hit tool and plate skills, but the tools are there and he debuted at high A as a 17-year-old.  He ran an improved hit tool in the second half and hit .323 with an 82% contact rate in the final month of the season, but the power was lacking.  Ultimately the raw power and power ceiling are extremely high and he will get to the homers, the concern is if there will be a trade-off in the hit tool to get there.  He also walked more than he struck out over this period.","The kid is still super raw and we are seeing the talent develop starting mid-season from a set of tools into a baseball player.  Walcott is in this middle zone at this point where he has been pushed very hard, very fast by the Rangers as he’s a 3-4 years younger than the average player in AA hence the age adjusted wRC+ of 187 which is higher than anyone else we have looked at in the top of the rankings outside of Samuel Basallo who is now in the majors.  Some patience is needed here with Walcott.",10,45/50,50/60,45/65,55/50,
11,14,Leo De Vries,SS,Athletics,Mid 2027,Switch hitting Alfonso Soriano at SS,"De Vries has super high upside across the board and is a potential five-tool switch hitting talent who has continually played at a high age-to-level.  De Vries is absolutely electric and has a long swing despite quick hands, giving me that Soriano feeling. His contact rates improved after some transition with the Athletics and he gets to good angles. De Vries became more aggressive at the plate with the Athletics with an increased swing rate which will help his hit tool trend to plus considering his age to the level he’s at and he has a max EV at 110, however the 90th percentile is only at 102.1 mph and he has been caught stealing 8 times this year.  I do have some splits concerns as he absolutely destroyed righties from the left side, but struggled against lefties from the other side of the plate.","De Vries is a year behind Walcott, but since the two have traversed up the prospect rankings list together as a sort of athletic SS tandem way above age to level it’s hard not to compare them.  Ultimately De Vries has better foundational mechanics and appears to have better bat speed, while Walcott is bigger and has a higher power ceiling with more raw athleticism and that’s what gives him the edge when I compare the two.",14,50/60,55/55,50/60,40/50,
12,16,Dylan Beavers,OF,Orioles,Debuted,Kyle Tucker mechanics with a Jarren Duran skillset,Big lefty outfielder who killed it in the doubles department last year and is not transitioning some of that into homerun power in 2025.  There’s a potential 20/25 player here if he can hit enough to make it work as the 105.4 90th percentile EV and 111.6 max EV portend to at least 20 homer power. The hit tool has progressed dramatically since last season as he now has a well above average 89.5 Z-Contact% and 82.6 Contact% with only a 19.4% chase rate with excellent angles as he has rocked an average 17 degree launch angle this year and solid 9.3% barrel rate; he has a good bat for line drives.,"Beavers had a very strong 2024 and has only gotten better in 2025.  I’ve been one of the higher guys on Beavers the last year or two and I expect him to finish higher on my list than others, as I think his hit tool could be greater than plus and the transition to the majors may depend on a his above average plate approach tracking to plus to see if he can avoid falling into inconsistencies.  Beavers has a very high floor thanks to the evolution of his hit tool and while some younger shortstops like De Vries and Walcott have higher ceilings for power the proximity bump and sure hit tool of Beavers draws him a little closer to that higher tier of guys in my ranking than in most.",21,60/65,60/60,55/55,60/55,
13,17,Eduardo Quintero,OF,Dodgers,Late 2027,Shades of Wander Franco as an OF with less power and more speed,"Fantastic plate skills (only a 19.4 chase rate in 2024) and a heck of an athlete;  Quintero has a solid hit tool with a knack for barreling the ball and brings a ton of athleticism to the plate.  He’s taken it to another level this season from a power and speed angle, performing at a now elite level, I just wish I had statcast data on him as the best I have is a reported 106.6 90th percentile EV in 2024, which is killer for last season at 18-years-old.","The hit tool has room to improve if he can be a little more aggressive in zone to generate more contact.  Quintero has top 5, or higher, prospect upside depending on who comes and who goes within the next year or so, as he will probably move up the rankings as long as the production and improvements in the underlying metrics persist.  Quintero did run into some trouble when first promoted to high A, but he improved once he had a few weeks at the level and balanced back into his standard profile with slightly less power.  Quintero has a higher power upside than Beavers, but Beavers has a better hit tool and thus safer floor - combined with proximity gives Beavers the edge in my rankings.",18,50/55,60/65,50/60,60/65,
14,19,Colt Emerson,SS/3B,Mariners,Early 2026,Bigger Brendan Donovan w/ more power potential,"Great hit tool for his age and plate skills for a big lefty who is still developing and has some solid wheels.  He still hasn’t developed the doubles power into homer power, but the transition is occurring as he’s had 9 bombs and a .508 slug in the second half.  Emerson has been reported to have a 115 max EV this year and did record a 112 max EV this spring, plus he’s carried a solid 104.3 90th percentile EV this season as the power is emerging, though the contact rate has dipped a bit as he increased levels, though he still managed a strong zone-contact.","This kid has moved up levels fast, because he takes professional ABs for his age.  Emerson changed his swing this year, adjusting from a leg kick to a toe tap in an effort to stay back more and better incorporate his lower half to get to more power and we have seen the results as noted through the last 50 games or so and while he still doesn’t get great angles, during this time he has reduced his groundball rate from about 51% to 47%.  He has a plus skill at making contact, but sans the last 50 games he’s below average at generating optimal attack angles, which balances out his hit tool to mid.  It’s possible he has fixed these issues and we are seeing a new Emerson, but only time will tell. There are rumors Emerson could break camp with the Mariners and while he has a very high floor, the ceiling is not as high as Beavers or Quintero as he will not have the steals upside for fantasy baseball.",23,55/65,55/60,50/60,50/55,
15,20,Caleb Bonemer,SS/3B,White Sox,Late 2027,Bobby Witt Jr. light mechanics w/ a potential Gunnar Henderson light outcome,"Great bat speed with an insane eye for his age, Bonemer is a well-built shortstop who may end up moving to third with plus tools across the board.  Bonemer has a quick, powerful swing that reminds me of Bobby Witt Jr. and was one of the high end prep bats picked in the second round last season.  Bonemer has shown a plus ability to control his bat through the zone to get to hit the ball hard at optimal angles with a crazy ability to pull the ball through the air as well in an Isaac Paredes-like manner.  He reportedly has a 105.4 90th percentile EV on the year with a 19.7% barrel rate and 14.3 average launch angle, optimal for line drives - though we don’t have this data at MLB Data Warehouse.","Bonemer has a high ceiling as a guy who I would predict will move off shortstop to 3B eventually with a strong ability to make quality contact at a consistent rate.  He should grow into some more natural power which will turn his doubles power into homer power.  He may ultimately have a higher upside than Colt Emerson with I think greater power and speed potential, though a likely worse hit tool, but Emerson gets the edge thanks to higher proximity and a second half breakout at a higher level than Bonemer.",24,55/60,60/65,55/60,55/60,
16,21,Sal Stewart,1B/3B,Reds,Debuted,Manny Machado light,"Big dude who should develop more power, but for now has a fantastic plate approach and hit tool for his age.  He’s been one of my guys since 2023 when I had a live look on him in Jupiter, Florida.  He might end up moving off the position to first full-time, because he’s a big boy.  He has a plus hit tool (potentially plus, plus with his great angles), plus plate skills, an ability to get to some killer angles with an all fields approach and mid-to-upper 20s home run power potential.","Stewart is a bigger dude and I don’t see him stealing more than 10 bags as he’s a good baserunner with below average speed, just as I don’t really see him spending a lot of time at 2B despite him leaning out.  He’s a nice, well-rounded player and has continued to develop a better and better hit tool and power tool as he has advanced levels. Stewart is an incredibly safe player and I bumped him even mid-write up from 27 to 21 ahead of Carson Benge as I jumped his hit tool to a potential 70 grade - which gives him the edge over Benge who has five tool potential.",36,60/70,55/60,55/60,45/40,
17,22,Carson Benge,OF,Mets,Early 2026,Evan Carter / Colton Cowser mash up,"Benge is an athletic OF who was a two-way player in college and hits to all fields.  He’s raw since he’s transitioning from being a two-way player, but there’s a lot of upside to open up now that he’s only focusing on hitting.  Benge has a good ability to make contact and get to barrels, but doesn’t have the most consistent launch angles.  He has a spray profile like JJ Wetherholt that will likely result in more doubles than homer power, but he was improving through the year from the beginning to the end.","Benge is an interesting player who I think has 20/20 upside with a good batting average and while he hasn’t completely eliminated the splits concerned I was worried about earlier in the year, he has definitely improved upon these concerns and I believe has locked himself into a full-time (non-platoon role) heading into the 2026 season sans some unforeseen signings by the Mets. I jumped Emerson and Bonemer over Benge despite Benge being great at the end of the year as Emerson has continued his power uptrend with a very strong second half and Bonemer has a higher ceiling than both - high enough that to me it outweighs the proximity of Benge.",22,55/60,55/60,55/55,55/55,
18,23,Josue De Paula,OF,Dodgers,Mid/Late 2027,Lefty Jordan Walker that can actually get the ball in the air,"Big kid has a body that power can grow into with a solid hit tool as he already produces above average contact rates and plus angles.  De Paula has a great eye, but is a little too passive at the plate with only a 37% swing rate.  The power should develop further as he grows into his big 6’ 3” frame, he’s only maxed out at a recorded 108.5 EV (Future’s Game homer), but has a 105.8 90th percentile EV, which is very good.","De Paula has a long way to go in his power development, but the frame and the 90th percentile EVs are on track.  A more aggressive approach at the plate could lead to more strikeouts and less walks, but could also lead to more damage created and a higher batting average.  The sub par angles and the lack of aggression will limit his ultimate upside until he can grow into these tools, hence the drop in my rankings where I recognize the upside, but am hesitant due in him fulfilling the upside based on a lot of guys failing with similar approaches of late ala the aforementioned Jordan Walker.",13,50/55,55/60,45/65,55/55,
19,25,Travis Bazzana,2B,Guardians,Mid 2026,Daniel Murphy with more athleticism and quickness,"Bazzana has the killer Oregon State hit tool and has professional experience already with wood bats, playing in Australia as a pro while he was a teenager.  He has power and speed, but to what degree will both show up as a pro is the big question to me, as the game power just appeared in 2024 and is relatively a newer tool.  The contact rates are above average and he hits to excellent doubles power angles with a 31% line drive rate, though he also hits the ball on the ground too much and has a well below average air pull rate.","Bazzana will always be compared with JJ Wetherholt since the Guardians picked him first overall and may have a tad more power and speed potential to Wetherholt, but Wetherholt has a stronger hit tool and a grade better plate approach.  The injuries and lack of game power thus far are pulling Bazzana down and De Paula only gets a slight edge to Bazzana due to his age-to-level bump and the higher power potential.",16,50/60,55/60,50/55,60/60,
