,rank,player_name,positions,organization,eta,comp,prime_skills,ranking_explanation,previous_rank,hit_grade,plate_approach_grade,power_grade,speed_grade,other_tool_grades
59,88,Ike Irish,C/1B/OF,Orioles,Mid/Late 2027,Will Clark light,"Irish is a fluid lefty hitter with a repeatable swing with a plus hit / power profile.  He was a barrel rate stud in college, but now swapping to wood we will see how it affects the insane 22.9% barrel rate he put up.  He has an 80.6% contact rate through 9 games in pro ball, though he had angles issues with a 47% groundball rate in college.  Irish has put up a 112 max EV with the wood bat, so there is some plus power potential in the bat if he can put the ball in the air.","Irish has the potential to be a middle of the order bat, but likely more in the 5-6 hole of the lineup where maybe we could see something like a lefty Nick Castellanos production.  Irish should be a solid player and fly through the minors as long as he can limit the strikeouts.",N/A,60/60,40/50,50/60,40/40,
60,91,Colby Thomas,OF,Athletics,Debuted (in MLB),Taylor Ward mechanics and Adolis Garcia-like outcomes,"Thomas has all fields power and does a great job of shooting the ball through the gaps.  He has an open stance with hands up, loaded pre-pitch.  He’s an extra base hit machine and may run into some strikeout issues as the hit tool is driven by quality contact (9.4% barrel rate in the majors with a strong air-pull rate), rather than by contact (65.8% contact% in the majors and 82.1% Z-contact).  He hits the ball very hard with a 115.9 max EV on the season, but doesn’t often get to his top of the line power with only a 105 90th percentile EV.","Thomas has 30-35 homer power and can steal another 10-15 bags on top of it, but he will live and die by the contact rates, if he can hit .230-.250 then he will play for fantasy, but if he’s striking out more than 30% of the time, he will be a completely unsustainable fantasy asset.",57,30/40,20/35,55/65,50/50,
61,92,Moises Ballesteros,C,Cubs,Debuted (but in AAA),Lefty only Pablo Sandoval w/ more pop,"Ballesteros has a plus hit tool (81.5 Contact% and 86.6 Z-Contact%) and power for a catcher, but he has a bad body ala Pablo Sandoval, which may negatively affect him down the line.  He showed even more power in the Arizona Fall League and is advanced as a hitter for his age with 6 bombs there and the exit velocities are above average (105.9 90th percentile and 112.3 max EV).","Ballesteros is a pure hitter with a 122 wRC+ as a 21-year-old at AA and AAA ball, and rates out as someone who could be an Alejandro Kirk with power or young Pablos Sandoval as a catcher type and should try to get in better shape if he wants to optimize his plus hit tool.  The issue for Ballesteros is he does not have the height to play 1B nor the athleticism to play in the OF, so he’s basically stuck as a catcher / DH option only, which limits his offensive potential from a playing time perspective and the Cubs have some decent options this year at catcher.",64,60/60,50/50,55/55,25/20,
62,93,Juneiker Caceres,OF,Guardians,2028,Mini Lefty Bryan Reynolds mash w/ Ronny Mauricio mechanics,"Caceres has a nice tight swing where he coils in with a leg kick, but without much of a stride and can pack a punch for a leaner middle infielder, he just turned 18-years-old a week before this writing.  He has a plus hit tool, hitting to an 82.6% contact rate with a solid doubles profile as far as angles, but he’s not likely to get into power as the flyball rate is below average.  He’s reported to have hit a 108 max EV in the DSL last year and this year has a 105.9 90th percentile EV, which is insane for his size and age.","The two biggest issues holding Caceres down is a lack of great angles as he does not hit enough flyballs to get to 20 homer power and without major angle changes, he’s just profiling as a high batting average, big doubles guy.  He hits the ball hard frequently, but needs to get the ball into the air to maximize his profile.  Ballesteros gets the call over Caceres right now due to the proximity bump, even without a position at the moment and I’d go Caceres over Rojas because of the stronger power potential.",N/A,50/60,55/60,50/60,40/45,
63,94,Jefferson Rojas,SS,Cubs,Late 2026,Smaller Xander Boegaerts,"Rojas has a good hit tool (81.3% contact rate in AA) and enough power and speed to fill all categories.  He ran a 103.3 90th percentile EV last year as a 19-year-old which portends to a solid 50-55 power tool and a good pull rate, but he could still work on angles and squaring up the ball as he’s been hitting a lot of groundballs at AA (almost 50%).","Rojas is young for his age-to-level, which is a boost to his potential as he had a great season in high A before getting the jump to AA as only a 20-year-old and has a career high home run total already this year, so the power is developing.  The Cubs have actually had some trouble as an organization finishing the development of some of their guys and I don’t necessarily trust them to get the most out of Rojas - but I like him as a very well rounded player that looks to me like a future starter and I give his org mate Ballesteros a slight edge for proximity.",N/A,50/55,55/60,40/50,55/50,
64,96,Felnin Celesten,SS,Mariners,Late 2027,Switch hitting Gunnar Henderson light,"Celesten is a good sized switch hitting, athletic shortstop who has shown some stellar tools, but has yet to get into his raw power (reported 90th percentile EV of 104 in complex in 2024) despite getting to better angles in 2025.  He needs to get the ball in the air and despite having a good feel for finding the holes in the defense, the power is still down post injury as is the hit tool (73.2 contact%), so I think he has lost some bat speed recovering from the broken hamate last year.  Right now he’s all potential.","I’m a big Felnin fan as the big switch hitting SS prospect had a broken hamate bone last season which are known for sapping power, so it’s tough to wonder how long it takes to fully heal for a hitter to the point of power returning, especially in a younger, developing player who has to adjust on the fly.  I believe in the talent and don’t want to ding him too much, even though the production hasn’t been what I would have hoped for, but it’s hard to hate on a 109 wRC+ from a guy who is still a little young for the level by two years 35-50 points.",47,35/45,40/50,40/55,55/60,
65,97,Cooper Pratt,SS,Brewers,2027,Giant Ha-Seong Kim,"Pratt is a huge athletic SS that is far away as a high school guy, but has light five-tool potential, especially due to his size. He has a long, exaggerated leg kick in his swing that I’m not a fan of, but the longer levers have not been an issue on his ability to get to the ball with a 78.5% contact rate on the year and solid angles (keep in mind he’s hitting in the Southern League this year, which is infamously difficult).  The lack of power is a bit concerning as he’s only reached a reported 106.5 max EV and 100.7 90th percentile EV on the year.  His speed is above average, rather than plus, but he has very good baserunning skills.","Pratt could grow into 20 homer power due to his size, but for now he works off a killer plate approach teamed with speed.  Pratt has some excellent upside and some of the numbers should be taken with a grain of salt, as he’s hitting in a bad hitting environment and deserves a boost, but the lack of power still is starting to become concerning in regards to his ultimate upside.  Pratt is rocking a 115 wRC+ as a 20-year-old at AA most of the season, which is good for a 165-170 theoretical wRC+.",53,45/50,60/65,35/45,60/55,
66,98,Dalton Rushing,C,Dodgers,Debuted,Daulton Varsho without the baserunning ability,"Stout kid with a quick swing and nice lefty pull power with great plate discipline and an average hit tool.  The lack of speed definitely dings his max potential a bit for fantasy purposes, but he has the skills to be a regular starter if the Dodgers can clear the room for him - which still hasn’t happened as of this writing.  The hit tool has fallen off from 77.7% contact at AAA to 67% contact in the MLB, which is partly due to a lack of consistent playing time.  Rushing is not a 38% K guy, that will decline once the small sample size is neutraled out.  The power has measured greater in the majors than at AAA with a 112 max EV against the 108 he had in AAA, while he consistently hits the ball hard with an average EV over 90.","Rushing is still a decent prospect, but the Dodgers tend to let some of their guys stew and he’s older for the level.  He’s played games at LF and at 1B in the minors, but has only played catcher for the Dodgers thus far, so it appears unlikely he plays at either of those positions pending an injury.  The Dodgers roster crunch dings him in my rankings a bit and caps his potential, but he’s a solid bat all around.  Rushing has the ability to hit 25-30 bombs in a season if he gets full-time at bats, but the hit tool is worse than what he was credited for once promoted and he needs consistent at bats to finish / polish off his development.  The shortstops, Celesten and Pratt have some higher upside and get the edge to Rushing who is a bit blocked and it’s stifling his development some.",54,40/45,50/60,55/55,30/40,
67,99,Tyson Lewis,SS,Reds,2028,Bigger lefty Matt McLain,"Lewis is an athletic freak that we have heard a lot about from everyone out in Arizona, especially after some monster EVs he has put up with a rumored 119.4 max EV (but also hit a homer at a 114.8 max EV and he has a ridiculous 107.9 90th percentile EV.  At 6’ 2” 195 lbs, he is one of the strongest players I’ve seen live - all lean muscle and insane upside if he can manage even average contact.  He has a powerful lefty swing with great wheels, but the hit tool (63.9% contact rate and 69.3% Z-Contact%) and plate skills (20.8 SwStr%) grade out as poor.  The quality of contact is great for a doubles profile, but not for a masher as he has a 33.3% line drive rate and 11.1% barrel rate at A ball, but needs to work on pull and air rates in the offseason with only a 9 degree average launch angle.","There’s a real risk that Tyson Lewis is just the SS version of Spencer Jones or Carson Williams with even more power and speed.  Lewis is a player of extremes and unless he spends some serious offseason time on refining his contact, he is going to be a polarizing player the next few years and I give him a slight edge to Level despite Level being a much safer player as we are going tools vs. a good contact / bad angles hitter at the same stage in their development.",124,20/40,25/40,55/70,65/70,
68,100,Jhonny Level,SS,Giants,2028,Asdrubal Cabrera and Light Francisco Lindor mash,"Level is a switch hitting fire hydrant type SS at 5’10” with a plus plate approach, good hit tool featuring a 78% contact rate (though he has had a lot more success on the right side of the plate) with a lot of pre-swing hand movement ala many late 90s / early 2000s hitters.  The power is mostly coming from the left side of the plate and he needs to work on angles as the quality of contact that he has shown in A ball is poor.  Level does have power potential if he can work on angles as he’s logged max exit velocities of 111.8 and 112 this year, which is potential above plus at his age.","Level has plus tools across the board and is getting into some very nice power for a kid who is barely 18-years-old with a 100.7 90th percentile exit velocity in the DSL as a 17-year-old.  He’s oddly run some lower BABIPs in DSL and CPX, which the opposite is usually the case, but part of that is he has had some low line drive rates at both levels - so it will be interesting to see his barrel numbers once that data is available.  I’m not the biggest fan of Arquette and think there’s a lot of moving parts without elite feature in a sub part hit package.",145,45/50,50/60,35/60,55/55,
69,101,Aiva Arquette,SS,Marlins,2027,Wiry Carlos Correa / Kris Bryant hybrid,"Arquette is a huge, lean 6’ 5” shortstop with an open stance and a lot of bat wiggle.  We’ve only seen a small sample size in the minors thus far (17 games), but as a longer lever player he has a subpar hit tool that only got to average-ish angles (but the ability to go to all fields) with a metal bat and has hit too many balls on the ground in his small sample size.  Arquetter reportedly has posted a max EV of 104 with wood in the Cape Cod league last year and he ranked in the 92nd percentile of EVs in college last year - indicating a potential plus hit tool.","I’m not as big on Arquette as others are (as you can see based on my ranking), I don’t necessarily buy the power upside as more than mid 20s, because he doesn’t get to the best angles and he has a decent number of holes in his swing.  Despite not being as good of an athlete, Rushing is a better pure hitter and gets the edge to Arquette in my rankings.",N/A,35/45,40/50,45/55,50/50,
70,105,Edgar Montero,SS,Athletics,2029,Juan Soto mechanics meets shades of a bigger Ozzie Albies profile,"Montero has an athletic switch hitting 6’ 2” build with a very simple and easy toe tap setup that replicated Juan Soto’s mechanics - not a surprise for a young Dominican hitter, but he does it well.  Montero has a potential plus plate approach with the rare higher walk rate than strikeout rate in his second go at the DSL, chopping his swinging strike rate more than half from last year.  The contact rate is a rough 67.3%, but even a super hit tool guy like Juneiker Caceres bumped his contact rate from 72% to 84% once he hit complex, so there’s a likelihood of a big jump once Montero gets state-side.  Montero has a strong pull/air approach having jumped his pull rate more than 20% year over year, so we are seeing a ton of angles growth this year.  Montero has a reported 104.7 90th percentile EV and 87.5 average EV, which are both great for his age, demonstrating some plus power upside.","Montero is a long way off, hence how far down my rankings he is despite how much I like him.  He was the most consistently great player week-to-week in the DSL this year as I was doing my weekly Top 10 player articles for Fantasy Pros and as you can see, he compiled excellent stats across the boards - it would be great to see him take the jump to A ball next year rather than getting stuck in Complex.  Arquette and Rushing have a multi-year proximity bump over Montero, even though I think Montero may have higher upside.",N/A,30/50,40/55,45/55,50/50,
71,106,Cris Rodriguez,OF,Tigers,2029,A Rod mechanics / George Springer mash,"Rodriguez is a big dude for his age with a 68.3% contact rate on the year and a fairly standard batted ball profile.  The power and speed tools are what really makes Rodriguez stand out against some of the other top DSL performers over the past year.  Rodriguez had a reported 90th percentile EV of 103.1 in 2024 in youth Dominican leagues as a 16-year-old and we have no data on how his exit velocities may have improved this year, but there’s 30 homer potential in this bat.  The Tigers paid Rodriguez a $3.2 million bonus, so they obviously like the potential.","Unlike Montero, while Rodriguez is a year younger and that counts for something, the plate approach is lacking with a classic DSL aggressiveness in his profile.  There’s a 30/15 type profile here in his peak if Rodriguez develops properly and cuts the swing and miss, though like Montero he’s years away and this is just my little DSL pocket in these rankings.",N/A,25/50,20/40,40/60,50/50,
72,108,AJ Ewing,OF,Mets,2027,,"Ewing runs an above average hit tool with a 79.5 Contact% and 88.9 Z-Contact% with decent enough angles at a 7.4% barrel rate and 10 degree launch angle when he was at A ball and we have that data - this also resulted in 46.3% line drive rate, but that was only at the A ball level.  While in A ball Ewing showed decent enough hard hit data, despite only mashing three homers on the year with a 108.7 Max EV, 103.6 90th percentile EV and a 90.6 average EV, which are all good enough to reach 15 homers, but he gets the ball in the air less than 30% of the time, so the angles are not great for power.","Rodriguez has a more well rounded profile than Ewing and gets the edge in my rankings, while Ewing then gets the call over Wilken who is an extreme in the other direction of power vs. speed, but Ewing’s above average hit tool could develop into a plus hit tool and if he can fix some of the angles issues it will make him a more well rounded player.",N/A,50/55,55/60,30/40,70/70,
73,110,Aron Estrada,2B,Orioles,2027,Mini Ohtani mechanics w/ an Ozzie Albies like profile,"Estrada is a small 5’8” switch hitting shortstop who caught my attention doing the T-10s as I noticed he’s only 20-years-old in AA with a solid 79.3% contact rate and some potential above average tools and an aggressive approach (51.2% swing rate).  The power for Estrada is developing as he’s been getting to better angles at AA dropping the GB rate closer to 40% and raising the flyball profile.  He hits the ball harder than you would think for a small dude, getting to a 112 max EV earlier this year and reportedly hitting 102 90th percentile EVs in the 2024 season, which based on these numbers and the change in attack angles, he has a lot more power to grow into.","I love Estrada’s swing, high hands, simple toe tap in the box and a nice load that gets him into way more power than you think he would be capable of and reminds me of a mini switch hitting Shohei Ohtani.  Estrada is rocking a 138 wRC+ on the season and is more than two years young for the level, so deserves a theoretical bump of another 50-65 points to a 190-ish wRC+, if the power can uptick Estrada could be a Top 100 guy by the offseason rankings.",N/A,50/55,40/45,40/55,65/60,
74,111,Harry Ford,C,Mariners,Late 2025,"J.T. Realmuto light (less power, better discipline)","Ford has great plate skills and he’s a great athlete, but the biggest change this year is the power finally showing up.  He’s done a great job improving the hit tool this season as his contact rate has risen nearly 5% to a solid 78% with an 84.1 Z-Contact%.  Ford gets to slightly above average angles as well with an 8.8% barrel rate, 23.2% line drive rate and 9 degree average launch angle this year.  Ford’s power this season has ticked up to average-ish despite hitting way too many balls on the ground as he’s netted a 103.5 90th percentile EV and 109.3 average EV on the season.","Ford is a good athlete so there’s a chance he moves off to the OF where he played a little in 2024.  This year he has only played at catcher and DH and though he might move off a bit, he should keep the catcher designation as the backup to Raleigh even if it’s not his primary position in the bigs.  He should get a September call up based on his performance and the only thing to hate this year is the drop in stolen bases after coming off three consecutive 20+ steal seasons.  Ford has a 127 wRC+ and is still at least one year young for the level, so he theoretically should net an 150 wRC+ when considering age-to-level.  I give Estrada an edge to Ford as I think Estrada has more power potential and Ford being a catcher and not yet playing off position may affect his total ABs ala Dalton Rushing.",133,50/55,65/70,45/45,50/55,
75,112,Ryan Clifford,1B / OF,Mets,Early 2026,Vinnie Pasquantino with more Ks,"This kid has a big time power and a decent eye to take a walk.  The hit tool has gone from sub par to above average at AAA (as I have previously mentioned the AAA environment is great for hitters and terrible for pitchers) as his contact rate has gone from 74.9% to 83.3% with a 93.5 Z-Contact%.  I’m not sure how much I buy that, but it is definitely factored into this ranking and his potential hit tool, though the angles haven’t been great with only a 6.9% barrel rate and 6 degree average launch angle in the small AAA sample size, the AA angles were a bit better, though still only average.  The max EV is only 111, though I’m sure he’s hit it harder when we haven’t had the data based on his profile and his 90th percentile EV is sitting at a very good 107.1 mph.","The power is legit at a young age, he might struggle at times with strikeouts, but he actually does have a good approach with only a 22.6% chase rate at AAA. He needs to swing in the zone more though, as a 52.9% Z-Swing% is way too passive.  I jumped Clifford of Wilken even though I think Clifford is probably at best a 30-35 homer guy based on the lower EVs and worse angles, but he makes much better contact and has a little more athleticism that will raise his batting potential batting average to be a good 20 points higher than Wilken and that matters. Top 150 Ranking:  N/A",,45/55,50/55,60/65,35/30,
76,114,Angel Genao,SS,Guardians,Late 2026,Shades of Tommy Edman w/ a better hit tool and less speed,"Athletic switch hitting middle infielder with a classic hit and speed type profile with a little power built in.  He’s a small dude and will have a limited power upside, but he does have 15 homer power just based on how much hard contact he generates in the smaller frame.  He was a .300 plus hitter on both sides of the plate, so he is a legit switch hitter that will stick with a great hit tool (81.2% contact rate) and solid angles, but ideally the GB% would decrease.  The stolen bases are down this year, as is the power stroke - likely due to his injury or lack of a normal pre-season program.  Interestingly Genao gets close to his max EV pretty regularly having posed a 105 max EV and 104.1 90th percentile EV","The Guardians have a lot of these hit first switch hitting middle infielders and while Genao might be the best of their massive middle infield crop behind Bazzana, they haven’t exactly hit on all of them (see Rocchio and Gimenez).",92,50/60,55/55,45/50,55/60,
77,115,Brock Wilken,3B,Brewers,Mid 2026,Righty Max Muncy,"This dude has massive power, but the question is if the hit tool can be average enough to allow him to mash 30-40 homers.  His contact rate is up to 72.5%, which is good enough with his power and he has a top notch eye, the strikeout rates should tick down as the swinging strike rate of 9.5% portends to better future outcomes.  Wilken has a near 60% pull rate so the air/pull here is ridiculous for a guy who has put up a 115 max EV and a 108.1 90th percentile EV back in 2023 when we had those numbers for him.","Brock Wilken missed time in 2024 after getting hit in the eye with a pitch and it messed up his entire season.  Don’t get too excited about his low average this year either, as he’s been hitting in the Southern League which is basically the opposite minor league version of the PCL (that or the low A FSL), though Biloxi is about league average in wOBA.  I’m taking Wilken over Caissie gun to my head, as I trust his approach more despite that I know best case scenario he’s probably a .220-.240 hitter because he is so slow with the sub-average hit tool.",88,40/40,50/60,60/70,30/25,
78,117,Owen Caissie,OF,Cubs,Debuted (in MLB),Cody Bellinger meets Joey Gallo,"The power is legit for this big lefty OF (115.5 max EV in 2024 and around 91.9 average EV with a 107.7 90th percentile EV this season), but the hit tool (73 Contact% and 81.5 Z-Contact% at AAA) and plate skills need some serious work.  He also hits to good angles and is able to barrel the ball well when he does make contact with a 17.5% barrel rate and 25.8% line drive rate at AAA this year.  There is a lot of power potential here however, it will likely come in a strong-side platoon role, because his numbers against lefties are horrendous with a .225/.355/.371 slash against same-handed pitching.","Caissie has always played young for the level and I expect more power to develop based on the exit velocities, but the hit tool has to catch up in order for this to happen.  These are the major hurdles that will determine whether or not Caissie leans toward good Cody Bellinger production or bad Joey Gallo production, while the EVs keep his prospect status afloat.  A lot of people will have Caissie as a Top 100 guy, but he’s basically all power at this point with a lot of questions in the approach and hit tool - plus he can’t hit lefties, so he’s likely a platoon bat.",118,40/40,30/40,55/70,35/40,
79,118,Tommy Troy,2B / SS,Diamondbacks,Early 2026,Matt McLain light / Maikel Garcia mash,"I was really high on Troy when he first came on the scene and his hit tool has improved as the season has gone on from below average to a potential solid 50 at this point (75.8 contact%, 87.2 Z-Contact%), but he does have above average gap power (24.1% line drive rate, despite still getting below average angles with only a 6 degree average launch angle and 3.7% barrel rate at AAA - that have lead to a 51.9% GB rate). Troy has double plus speed with a much improved plate approach as well that could result in a 15/25 potential profile.  He has a 5’9” fire hydrant type build with a big leg kick in his swing and the AAA data thus far doesn’t portend to much power with a 103.8 max EV on the year and poor 99.8 90th percentile EV, but it’s only been 23 games, while he had a 108 max EV last season","Troy jumped out as a standout post draft in the fast lane to a quick promotion.  He killed it in his debut, but then struggled in 2024 and has fallen off most lists - but a solid season in 2025 is rebounding him back into prominence - at least as a notable prospect.",119,45/50,50/55,40/45,55/50,
