,rank,player_name,positions,organization,eta,comp,prime_skills,ranking_explanation,previous_rank,CH_grade,CU_grade,Command_grade,FA_grade,FA2 (92-94 mph)_grade,FA2 (93-97 mph)_grade,FA2/FS (92-96 mph)_grade,FA4 (93-96 mph)_grade,FA4 (94-100 mph) w/ arm side run_grade,FC_grade,FS_grade,KC_grade,Kick CH (84-89 mph)_grade,SI_grade,SL_grade,ST_grade,SW_grade
42,128,Ben Hess,SP,Yankees,Mid/Late 2026,Lance Lynn with more heat,"Big 6’5” 255 pound starter the Yankees picked in the first round from Alabama who hits up to 99 mph on the heater (but lives 93-96) and has a traditional well rounded curve, slider change up arsenal and throws from a low release point despite the size. The curve is his best breaker as a traditional 12/6 with a lot of arc, while the slider is a vertical gyro slider (which also gets labeled as a cutter) and the change up has some nice movement and could develop into a plus pitch. He can also sometimes get some sinker action on the fastball for some arm-side run.","Hess has worked through some command issues this season, but since the start of July has shown much improved command each start.  The dude is a horse throwing 80+ pitches most times out in an era where those types of pitchers are fewer and fewer.  Hess has a 2.70 JA ERA (SIERA) this season and has an above average arsenal playing on a plus fastball, which should ultimately result in a good #3-4 starter. Perales gets the edge to Hess with the better fastball combined with the splitter that could make him a #2 starter, but Hess is a fairly safe bet to be a major league starter by this time next year.",135,50/55,50/55,35/45,60/60,,,,,,,,,,,50/55,,
43,131,Gage Wood,SP,Phillies,Mid 2026,Mini Zach Wheeler mechanics meets Ryan Helsley,"Wood was the first round pick for the Phillies this year and has an insane fastball with beautiful IVB from a low release point, plus some arm-side run and great command. He’s a shorter, athletically built starter who would be a beast in the bullpen, but has the arsenal to become a starter with a high velo, power curve with nice drop as his primary secondary.  Wood also throws a tight gyro slider / death ball, but has gone on the record saying he may replace that pitch in his arsenal with something else.","There’s some thought Wood could come up in the pen for the Phillies for the playoff run, but he has not yet pitched at pro ball.  Wood had an injury shortened season after a shoulder issue and had spent previous seasons in the pen.  Wood is likely to develop some additional secondaries around the fastball and curve now that he’s in pro ball, it will be fun to watch, because those two pitches are ridiculous, if he can get a slider or sweeper with horizontal break and pair that with a good splitter or change up, watch out!  I give Hess the edge to Wood only because he’s guaranteed to be a starter and Wood is not, while Wood’s command gives him a huge edge to Brandon Clarke, despite having only two pitches vs. three.",N/A,,65/65,50/65,70/70,,,,,,,,,,,40/45,,
44,134,David Hagaman,SP,Diamondbacks,2027,Nick Pivetta / Jose Soriano mish-mosh,"Hagaman is a big righty drafted in the fourth round out of West Virginia in 2024.  He was a reliever in college, but is being converted to a starter in the minors this year, hence the lower innings total, not to mention he is coming off internal brace procedure.  Hagaman throws from a ¾ arm-slot and gets a ton of ride on the fastball up in the zone and has a nasty 2/8 vertical gyro slider with a ton of break.  Hagaman also has a new 85 mph 2-plane curveball that he developed since coming to the Diamondbacks with -10 VB (it really behaves more like a sweeper).  Hagaman also has vastly improved command since returning from the procedure.","Hagaman first came onto my radar post trade to the Diamondbacks when Chris Welsh mentioned he liked him better than Mitch Bratt - so I dug in and now that I did, I agree completely.  He’s rocking a 2.10 JA ERA (SIERA) and has been getting deeper and deeper into starts with three fantastic starts in a row as of this writing.  He needs to work to higher pitch counts to get bumped higher in my rankings, but be on alert, the arsenal is good with potential to be great and the stuff is better than Suarez, hence the bump over.",N/A,40/45,50/55,45/60,60/65,,,,,,,,,,,60/65,,
45,135,Kendry Chourio,SP,Royals,2028,Smaller Jose Fernandez,"Chourio is a 6’0 righty with some ridiculous velocity for his age, there’s some wonderful video of him in A ball with yellow smoke that looks like a Vietnam / Agent Orange situation.  He has some decent ride on the fastball, but nothing great and a very nice 2-plane breaking curve against a circle change that he throws inside to righties and down and away to lefties.  His biggest asset right now is his ability to locate the fastball, while he has some trouble with control on the curve, the movement is great on it.","Chourio has a long way to develop, but the velocity and ability to command his pitches at this age is excellent.  Watching him, he reminds me of Jose Fernandez and has the same arsenal to match.  He’s running a 2.68 JA ERA (SIERA) at A ball as a 17-year-old, which is insane.  Hagaman has a deeper arsenal and is closer proximity-wise than Chourio to the majors and thus gets the edge.",N/A,40/50,55/60,45/60,55/60,,,,,,,,,,,,,
46,137,T.J. Nichols,SP,Rays,Mid/Late 2026,Shades of Logan Gilbert,"Nichols was good last year, but has been a completely different pitcher stuff wise in 2025 and is a name everyone should be watching as a former 6th rounder out of Arizona in 2023.  He’s a big 6’ 5”, lean righty with a mid 90s fastball and great extension.  The command is borderline elite with a really nasty 2-plane 85-88 mph slider.  He has top notch command with and has only issued more than 2 walks in a game twice all season and the change up is an oft used, but developing pitch with splitter like tendencies.","Nichols has been throwing 80-100 pitches every time out since the end of May and is built up for a 2026 promotion as he’s pitched to a 2.34 JA ERA (SIERA) on the year.  I like Hagaman’s arsenal a bit better and give him the edge over Nichols and while I also like Clarke’s arsenal better - Nichols has way better command - not close really and is destined to be a starter, he looks like a workhorse that could be a solid #3 starter or great #4.",N/A,40/50,,60/65,55/55,,,,,,,,,,,55/60,,
47,139,Tink Hence,SP,Cardinals,Early/Mid 2026,Dylan Cease,"Tink has some serious ride on his fastball that averages in the mid / high 90s - guys swing under it a lot.  The gyro slider is pretty sick and to counter the riding fastball, guys swing over it a lot.  The change up is a plus to plus, plus pitch with some insane horizontal break to it and as per the above numbers Tink is one of the better pitchers on a per inning rate in the minors, but is a smaller dude and has dealt with injury seasons the last couple of years, including the majority of this year.  The curve is pretty much a slower version of his slider with a very similar break and he started throwing a sinker this year that has some nice horizontal break to it, but has not had the chance to develop due to the injuries.","The big question about Tink has always been durability as a smaller stature for a starter at 6’ 1”, he can build up and maintain his electric stuff deeper into games. He showed in May of 2024 he can consistently pitch into the sixth and seventh innings, but injuries since then have slowed him down.  I made the note last year that hopefully he’s not the next Alex Reyes, but at this point there might be a 40-50% chance he ends up in the pen, rather than as a starter and if he does, he could be electric, because the stuff is great.  Here’s a quandary, Tink is better than Nichols per inning, but Nichols is a workhorse; while Tink and Clarke have pretty similar innings / buildup problems, however Tink has much better command than Clarke and gets the nod.",98,60/65,40/50,40/50,55/65,,,,,,,35/40,,,,55/60,,
48,143,Brandon Clarke,SP,Red Sox,Mid 2026,Robbie Ray with higher velocity,"Clarke is a big lefty drafted in the fifth round who didn’t pitch last year and has had insanely ridiculous numbers since his debut.  This is a name that should be on everyone’s list this year - he should be a quick riser.  He hits 100 mph from the left side (lives around 96-97); though the pitch lacks significant vertical break and a ridiculously nasty horizontal sweeper against an even sharper 2/8 gyro slider that is effective against righties and lefties, plus a change with nice movement, but poor placement.  Clarke is also phenomenal at getting groundouts, with a 63.9% GB rate on the year.","The sweeper / slider combo is downright dirty as the gyro slider bridges the fastball and sweeper.  The Red Sox drafted this guy out of local college in Florida (State College of Florida Manatee - Sarasota) in one of the best finds in recent memory, reminiscent of when the White Sox found Chris Sale at Florida Gulf Coast.  Clarke has been pretty bad since the All Star Break, despite still posting a 2.97 JA ERA (SIERA) entirely thanks to atrocious command.  His stuff is insane, but there is major bullpen risk here.",67,40/45,,20/40,60/60,,,,,,,,,,,60/65,,55/60
49,144,David Davalillo,SP,Rangers,Late 2026,Bryan Bello / Reese Olson mash,"Davalillo led the minors in ERA last season and is pacing to be a competitor again this season.  He’s a shorter 6’1” righty of slight build that throws two fastballs (with the 2-seamer as a better pitch than the 4-seamer), but has some killer breaking pitches between a sharp vertical gryo slider / cutter, a beast of a split changeup and a big vertical breaking curve (a slow curve and a sweeper with similar depth, but quicker break) and generates a ton of ground balls along with the Ks.  He’s a groundball machine with a 48.8% GB rate.","Davalillo is smoking guys at the lower levels with his movement, but without the killer fastball or dominant foundational pitch, I do have some concerns about how his stuff might play or how his strikeouts might downtick against higher levels of competition - though he does have a nice kitchen sink approach and is already proven to be a pitcher, not a thrower.  I wouldn’t say he has any particular elite pitch, but he’s a smart pitcher that knows how to use what he has to be effective.  Davalillo has a 2.63 JA ERA (SIERA) on the year and is having a bit of a rough time translating to AA.",144,,50/55,55/60,45/50 [50/50 on 2 seam],,,,,,55/55,50/55,,,,,,50/55
50,145,Santiago Suarez,SP,Rays,Late 2027,Freddy Peralta light,"Suarez is a command first pitcher with a 93-97 MPH fastball featured by some decent ride and a changeup with some split characteristics, along with a nice cutter / slider combo.  He’s a big righty at only 6’ 2” and has gained a couple ticks of velocity since he was on this list a year ago.  Suarez uses the cutter / gyro slider that breaks horizontally against righties and the changeup against lefties, while the slider has a 1/7 vertical break to it and might also be registered as a power curve.","Suarez has missed a good chunk of the year due to a triceps / shoulder injury, which has affected his ranking from the last update, but he’s back now and has a 2.27 JA ERA (SIERA) on the season, despite having some odd reverse split issues as righties have a .784 OPS against him and lefties only have a .360 OPS, because he throws the changeup against righties outside of the zone and has to rely on the cutter and slider for righties.  Clarke and Suarez are almost opposites because Suarez is kind of ho-hum with great command vs. Clarke’s 100 mph from the left side.  I’ll go Clarke for now as Suarez is still rebounding from injury and pitching injuries are scary.  Suarez and Davalillo are a bit similar, except Davalillo has a better track record of health and more pitches to draw on.",114,40/45,,60/70,55/55,,,,,,50/50,,,,,55/55,,
51,147,Bryce Cunningham,SP,Yankees,Early 2027,Lucas Giolito / Luis Castillo mash,"Cunningham is a big dude at 6’5” and 230 pounds and has a mid 90s fastball that tops out at 97 with ride high in the zone, a plus change up with a good amount of arm-side run, a sub par gyro slider and a brand new 1/7 curveball.  He also has plus command of the zone and is already built to throw 90 plus pitches each time out.","Cunningham has the pedigree and build to move through the minors fast pending health, especially since he’s already built up.  The fastball and change was proven by Logan Henderson to work at the next level, but obviously if he can continue to develop one of the breakers, then we are really talking. Cunningham spent a good amount of time on the IL and just returned for three baby starts so far and has gotten knocked around a bit, he doesn’t quite look the same - but I won’t hold it too much against him.  I like the stuff better than what Suarez and Davalillo have in their pockets, but he doesn’t have the same consistency or pitchability yet and needs to develop that part of his game or improve the breakers to get there - as even the 3.22 JA ERA (SIERA) will tell us.",142,60/65,45/50,45/55,60/60,,,,,,,,,,,40/45,,
52,149,Elmer Rodriguez-Cruz,SP,Yankees,Late 2026,,"Rodriguez-Cruz was my 6th man in my last rankings update, but the lanky righty has pushed his way onto the list this time around after some big velo gains after moving from the Red Sox to the Yankees.  He’s a lot of legs coming at you from a ¾ arm-slot, which may cause some deception.  He has five pitches that all play off each other without a traditional fastball, which is strange.  The sinker has some ridiculous movement, but I think it would ultimately play better with a four seamer that has some ride to play off of it, rather than just the change up which has the same break as the sinker, except slower.  The cutter and curve play off each other as the cutter has a nice 12/6 movement profile, just like the curve - which is kind of vanilla.  He also has a gyro slider, which is sometimes now melded with a cutter that has a tight 2-plane break to it and is interesting because most gyro sliders are just a cutter at this point.  It has some nice movement, but he can leave it hanging sometimes.","ERC has some interesting stuff, but the lack of a setup traditional four seamer is a bit concerning to me.  He has posted 3.05 JA ERA (SIERA) in AA and has been better than Cunningham this year, who is a level lower - but Cunningham has a very good fastball / slider combo that I think pushes him to higher top of the rotation potential whereas ERC has a kitchen sink, middle of the rotation arsenal.",151,50/55,40/45,40/45,,,,,,,45/50,,,,60/65,45/55,,
