,rank,player_name,positions,organization,eta,comp,prime_skills,ranking_explanation,previous_rank,CH_grade,CU_grade,Command_grade,FA_grade,FA2 (92-94 mph)_grade,FA2 (93-97 mph)_grade,FA2/FS (92-96 mph)_grade,FA4 (93-96 mph)_grade,FA4 (94-100 mph) w/ arm side run_grade,FC_grade,FS_grade,KC_grade,Kick CH (84-89 mph)_grade,SI_grade,SL_grade,ST_grade,SW_grade
21,75,Owen Murphy,SP,Braves,Late 2026,Bryce Miller,"Murphy is a former first rounder with ridiculous fastball characteristics (up to 22” IVB on it.) and just returned from Tommy John.  The fastball runs into the lower/mid-90s with excellent ride to it and he’s good and pounding it into the top of the zone.  He throws a curve against a 12/6 slider, it would be killer if he could add a sweeper to the arsenal or something with more horizontal movement and the change up has some splitter characteristics.","I love Murphy, it’s good to have him back and the command has been sublime since returning from TJ.  The velocity is down a bit, but with the movement there and the command actually improved he should be able to have a normal offseason and could perhaps add some velocity in a pitching lab.  Ultimately I like his stuff better than Lowder’s and thus he gets the edge despite the fact Lowder will almost definitely break camp with the big league squad.",137,40/45,55/60,60/65,60/65,,,,,,,,,,,60/65,,
22,76,Trey Gibson,SP,Orioles,Early/Mid 2026,Bigger Drew Rasmussen,"Gibson is a dude, he’s been one of the most consistent starters in the minors all season.  He has a 1.98 JA ERA and pitches from a very over the top delivery which you don’t see too often, but is becoming more popular between guys like Gibson, Tong and Yesavage.  Gibson throws two different fastballs between the four-seamer and the two-seamer (which also sometimes gets labeled as a sinker) and two different sliders (between a sweeper that also gets labeled as a slider, while his gyro slider gets labeled as a cutter).","Gibson is a tunnel master, all of his pitches tunnel together except for the curve ball, but I’m a fan of the fastballs and the two sliders as above average to plus pitches and with better stuff, despite not having the command of Lowder I give Gibson the edge.",N/A,30/40,40/55,45/50,50/55,,,55/60,,,,,,,,60/60,,60/60
23,77,Rhett Lowder,SP,Reds,Debuted (IL),Logan Webb,"Lowder has three above average pitches with the 2-seamer being his best fastball and is known for his pin-point control coming from a quick 3/4 whip-it style arm-slot.  He’s a smart pitcher and knows how to mix well, but the question is how much Great American Ballpark will hurt him.  He’s been hurt the majority of the year and is slated to get some innings in the Arizona Fall League for a hopefully healthy 2026 season.  The change up could be an elite pitch as it has some dive like a sinker.","Lowder has missed the entire season more or less in 2025 and is supposedly going to be ready to go for the Arizona Fall League.  He doesn’t really have an elite pitch, which is why I have never been too high on him, but the stuff works well together and he’s a very polished pitcher assuming when he returns to the mound his command is still plus.",95,55/65,,60/65,,55/55,,,50/50,,,,,,,50/55,,
24,78,Tyler Bremner,SP,Angels,Mid/Late 2026,Sandy Alcantara,"Bremner has a high effort ¾ arm-slot delivery and features a primary fastball / changeup combo with work needed on the breakers.  Knowing the Angels, he will be a quick mover.  The fastball has good velocity, but with lackluster camera angles I’m not entirely convinced of the characteristics, though there does appear to be some run to it, while the change up is about as close to an airbender as you can get with a starter, it’s going to be a dominant pitch.  I actually like the sweeper and despite reports, to me it looks like he has two different sliders, one is a sweeper - the one I like and the other is kind of a spike ball gyro slider, which I think is only average at best.","If Bremner can develop the sweeper I think he goes from being a solid #3 type to a potential front line #1 or #2 guy, the fastball / change up combo alone isn’t enough to get him there and the video I’ve seen of the sweeper make it look like it could be a pretty savage.",N/A,70/70,,35/40,60/60,,,,,,,,,,,40/40,,45/55
25,79,Cam Schlittler,SP,Yankees,Debuted (in MLB),Michael King-esk,"Schlittler had been a consistent elite performer in the minors all year until the call up, as he’s a big righty at 6’6 225 lb with an extremely effective high heat FB that generates some of the best swing and miss in baseball on a fastball and a high velo gyro slider (that also gets classified as a cutter).","Cam Schlittler has developed a sinker on the fly at the MLB level and that has really helped his arsenal as he has never been able to get the feel on a change up and it helps him get a little east into his repertoire.  He’s a big dude and the majority of the guys in the wider tier of pitching prospects have a bit iffy command, but generally roll big time velocity and I know Wiggins has some pretty numbers, but I think Schlittler has better stuff.",N/A,,45/50,45/50,65/65,,,,,,55/65,,,,50/50,,,50/55
26,81,Travis Sykora,SP,Nationals,Mid 2027,Logan Gilbert,Sykora has some really sick stuff as a former third rounder and is a big time name to watch.  He’s a giant at 6’ 6” with a 44.4% whiff rate in the minors and needs to be up in A+ or AA at this point.  Sykora rocks a mid to high 90s fastball with obviously ridiculous extension due to his size with more run than ride and he also has a devastating low to mid 80s splitter and mid 80s hard vertical slider.  About a month ago it was announced Sykora needed Tommy John surgery and this is what pushed him down the rankings - otherwise he would be an easy top 20-25 prospect.,"This dude is a freak and could be the top prospect when he returns.  The only reason Wiggins and some of these other guys are ahead of Sykora at this point is proximity, so Sykora is a nice breaking point where the pitchers under him are all guys that will still likely debut in a similar or later timeframe despite the TJ or guys that don’t have upper end of the rotation potential.",24,,,40/50,65/70,,,,,,,60/65,,,,55/60,,
27,87,Troy Melton,SP,Tigers,Debuted (in MLB),Bigger Nate Eovaldi,"He has a strong, plus arsenal across the board with very good fastball command.  He has a good, athletic build at 6’ 4” 210 lb with a ¾ arm slot from the right side.  The fastball has some very nice ride from a lower release point, making it very deceptive with a very sharp horizontally breaking slider and with leaning plus command, Melton is a likely very solid #3 starter moving forward.","Melton has six plus pitches per Stuff+; which is based more on movement profiles and than on actually outcomes, but with his command profile and the solid repertoire, which is a bit of a lesser Cam Schlittler profile in my opinion and while he does have some plus pitches, I’m not sure any of these lean elite, though the fastball and slider are close to being potential 65 pitches and I’m sure pitching with Tarik Skubal can only make him better.",N/A,,45/50,55/60,60/60,,,,,,60/60,35/40,,,40/55,50/60,,
28,89,Daniel Eagen,SP,Diamondbacks,Late 2026,Ryan Pepiot,"Eagen has been one of the most consistent performers in the minors this year as a flier of a third rounder in 2024 ala Quinn Mathews and Zebby Matthews last year, he has the now popular super over the top arm-slot of Yesavage, Tong, Gibson and a bunch of the other breakout guys this year.  Eagen is rocking a 2.46 JA ERA (SIERA) and has a nice four pitch mix with an underrated fastball with a ton of ride and some arm-side movement, a potential plus sweeping slider and a plus diving 12/6 curve.","Eagen has been on a dominant run with 29 strikeouts and 4 walks in his last three starts, including his AA debut where he threw absolute fire.  Eagen has a killer three pitch mix and still has developmental time to add another pitch or a tick or two of velocity.  He’s one of the biggest pitching risers this season and it’s well deserved.  I bumped him ahead of Messick and Rojas when doing final research, as I think the elite fastball, curve, sweeper combo is just a better play long-term than the fastball/change up/kitchen sink play of Messick and because he’s already pitched more innings in one season than Rojas ever has in pro ball.",N/A,30/40,60/65,45/50,60/65,,,,,,,,,,,,,50/60
29,90,Ryan Sloan,SP,Mariners,2028,Chris Carpenter-ish w/ a slider instead of a curve,"He’s a big dude for a high school guy at 6’ 5” 220 pounds with a mid 90s fastball in the 95-97 mph range with above average ride, a plus sweeper that has curve shape, but slider velocity and dives right off the plate when it’s on, a solid split changeup and an electric hard vertical slider/cutter with plus to plus, plus command of his stuff for his age.  The gyro slider and splitter play off each other very nicely, he’s a fun pitcher.  Sloan has a 2.76 JA ERA (SIERA) on the season, including having pitched in high A.","Sloan may not have some of the big strikeout numbers that other prospect pitchers ranked lower might have, but the stuff is electric from a high pedigree pitcher in an organization that really knows how to effectively develop starters, especially with this type of arsenal.  Tink gets the edge to sloan because of a superior fastball and the proximity, but with the injury history this is a close matchup.  Eagen gets a slight proximity bump and has movement on his side, while Sloan is the safer bet to be a good #2 starter to help anchor a rotation for a long time. Top 150 Rank:  99",,,,60/70,60/60,,,,,,,50/60,,,,50/55,,55/60
30,102,Cam Caminiti,SP,Braves,2028,A raw McKenzie Gore with more wiry mechanics,"Caminiti has an athletic build at 6’ 2”, 195 pounds with a mid-to-upper 90s fastball from the left side with a fun under ¾ arm-slot, but inconsistent secondaries outside of the sweeper/slider (which has become nasty). The fastball has some natural ride and glove-side run as he almost just slings it from his arm-slot and the sweeper against lefties is funny, because guys think they are about to get nailed and flinch at the pitch that lands in the strike zone.   He’s run a 2.84 JA ERA (SIERA) on the season.","Caminiti has shown some impressive stuff and has improved as the season has gone on, especially the sweeper that is becoming a dominant pitch.  The change up has evolved into a splitter with some drop to it that is a nasty change of pace against the fastball and slider. Unlike some of the other young guys, Caminiti's pitch count has been increasing as the season has gone on and he is getting stronger.  Caminiti gets the slight edge to Messick with a much better arsenal overall, he could be a top of the rotation guy, whereas Messick looks like a solid #3-4 starter - but has proximity on his side. Top 150 Rank:  113",,,40/45,40/50,60/65,,,,,,,50/55,,,,,,60/65
31,103,Brody Hopkins,SP,Rays,2026,Shades of a wild Zach Wheeler,"Hopkins has some really great stuff, but has had rough control so far this season.  He’s almost a side-armer (Funky slightly under ¾ arm-slot) that is tough to pick up and comes in at 96-98 mph with a crazy 88-90 mph slider.  He’s a bit of a slinger and on some of the breaking pitches, his arm angle and wrist change to try to get the spin he wants which leads to inconsistencies in the delivery and lack of tunneling.  Hopkins is throwing less than 50% strikes per game - he needs to clean up the command to live up to his potential.  The curve ball has good depth on it, but it’s rarely in the zone, while the vertical cutter is just a tighter bridge between his sweeper and fastball.  The arsenal overall is dirty, I love the sinker and sweeper and he has very good extension.","Hopkins has some command issues and I previously have noted he reminds me of a righty version of Cooper Hjerpe (in my prospect to prospect comp) and has posted a 3.28 JA ERA (SIERA) on the season.  He may run into issues in AAA due to the ABS, because his stuff is more likely to generate swings and misses outside of the zone (ala Quinn Mathews) rather than called strikes landing in the zone.  Hopkins vs. Messick is an interesting one, as Messick has way better command, but Hopkins has a much better arsenal overall and does not have the proximity.  I’m a bit of a stuff-ist with pitchers, thus the edge to Hopkins.",N/A,40/40,50/55,35/40,60/60,,,,,,45/50,60/65,,,,,,60/65
32,104,Parker Messick,SP,Guardians,Debuted (in MLB),Framber Valdez / lefty Sonny Gray light,"Shorter heavy set lefty who is a classic Guardians command guy who is breaking ball heavy and a former second rounder out of FSU.  He’s been primarily throwing fastball and changeup this season even though his slider and sinker are both very solid pitches, but the change up has become his primary strikeout pitch with a 23.1 SwStr% on the season at AAA, where he has posted a 3.03 JA ERA (SIERA) on the year before the call up.","He’s a bit of a bull dog on the mound and as a command first guy there should be a pretty smooth transition up level and unsurprisingly his walk rate has increased about 2% thanks to the ABS at AAA, but it should bounce back to the 8% range he’s had throughout his entire career in the majors - though it’s been even better in his first two starts in the majors.  Messick doesn’t have the same stuff as Melton, who he is behind or Kendry Rojas (who I have him bumped ahead for durability reasons), but we are at this edge of proximity starting pitchers to high ceiling pitchers who are much further away and as a guy who always logs innings and is in the majors, Messick deserves an edge to guys who may never get to this point because it’s still a long road.",107,65/70,40/50,50/55,40/45,,,,,,,40/45,,,,45/55,,
33,107,Jack Wenninger,SP,Mets,Mid 2026,Roy Halladay meets Emmet Sheehan w/ a splitter,"The Wenninger splitter is a monster, this guy is quickly becoming one of my favorite starters in the minors and is on the fast track as a big 6’ 4” dude with wide shoulders and long legs - the classic early 2000s workhorse ace frame.  His dominant splitter is complimented by a mid 90s fastball with a hard slider that also gets a lot of swinging strikes.  The arsenal is further complimented by a vertical gyro slider that he throws as a spike pitch with nice depth and a progressively better curve that acts as his off-tempo pitch.","Wenninger has a great frame and has an aura of being an old school professional pitcher about him.  Wenninger is rocking a 2.89 JA ERA (SIERA) on the season and is coming off a rough three game stretch post All Star, but has come out of it the last couple of starts.  Wenninger is polished and has a work-horse build.  While I think Rojas might have a better arsenal than Wenninger overall since Wenninger lacks a dominant east to west pitch (splitter goes west to east), Wenninger has the durability you want to see in a solid mid-rotation piece - I think he’s a lock for a good #3-#4 starter while Rojas has #2 upside, but could end up in the pen if he can’t build innings.",82,,45/55,50/55,55/55,,,,,,,60/70,,,,45/50,,
34,109,Kendry Rojas,SP,Twins,Early/Mid 2026,Christopher Sanchez,"Rojas has a 2.35 SIERA this year and started running into trouble post trade deadline as the Twins traded for him from the Blue Jays.  He’s an athletic lefty with a snappy delivery from a ¾ arm slot.  His primary fastball is a high run sinker, but his sinking change up (22.6 SwStr%) and slider (20.4 SwStr%) are elite pitches that generate elite swing and miss.  Rojas demonstrates average to plus command from the left side.  The fastball has high potential with up to 19” of IVB, but it’s not nearly as good at generating swing and miss as the sinker.","Rojas fell a bit in my rankings post deadline, as his walk rate has jumped over 8% and the swinging strike rate is down 4% in three starts at AAA for the Twins, though it should be noted the Blue Jays AAA home park factor is 96 and the Twins is 105, so this may play a small role.  Rojas is a plus player across the board without any real elite attributes, but until the trade he was a consistent performer who profiles as a good #3 starter with health (which his maximum innings in pro ball is 84 in 2023).",N/A,55/60,,40/60,45/55,,,,,,,55/60,,,,55/60,,
35,116,Wei-en Lin,SP,Athletics,2027,Jesus Luzardo mash with Shota Imanaga,"This lefty out of Taiwan has been near invincible in his first pro season with a 1.91 JA ERA (SIERA) and is only 19-years-old, rare for an international prospect from the far east.  He has a high IVB fastball at 18” IVB that darts in against a fairly nasty 87-89 mph sweeper, a slower loopier 2-plane knuckle-curve and a very solid change up.  He has a slight build at 6’1” and only about 180 pounds, but has great locations with only a 5.5% walk rate - he puts the ball where he wants it to go.","The Athletics are being cautious with Lin this year, limiting his pitch count to less than 50 pitches since the start of June, hence the lower innings count.  The command has gotten worse at high A, which I would attribute more to the innings count than to his overall command.  Rojas gets the nod to Lin as he’s closer to the majors and while they both have been limited innings-wise this year, Rojas is due to injury while Lin is because it’s his first season in state-side pro ball.",111,50/50,,55/65,55/60,,,,,,,,45/55,,,,,50/60
36,119,Michael Forret,SP,Orioles,Early 2027,Pablo Lopez / Tanner Bibee mash,"Forret is a nasty kitchen sink, off-tempo athletic righty, rather than a power velocity type.  The video we have on him from high A sucks, so hopefully now that he’s in AA we get better video moving forward (I say that and the early video is from an angle behind the plate - crap).  He went to Tread last year and added a couple ticks to his fastball, sitting 94-95 with nice ride on the four seamer, then he throws a sinker with good ride to it to throw hitters off balance.  His best secondary is a nasty vertical sweeper, but he also has a gyro slider type spike curve ball / AKA “death ball” that was developed at Tread.  He also developed a nasty kick change at Tread (which has more negative vert like a splitter) against his traditional change up.  He’s a true pitcher that loves his craft, which is why he’s so good - rather than a thrower pounding velocity.","Forret might be one of the most underrated starters in the minors and a partial explanation is he hasn’t had many ridiculous strikeout games with elite numbers, but is just steadily, consistently good each time out.  He also has been getting capped around 75 pitches per game, which is limiting his innings and inability to pile up strikeouts, but he is rocking a 2.18 JA ERA (SIERA) on the season.  The individual pitches may not be as good as what Dasan Hill throws, but the sum of the parts and the better command give Forret the nod.",N/A,40/50,45/50,50/55,55/60,,,,,,,55/60,,50/60,,,,60/60
37,120,Dasan Hill,SP,Twins,2027,Max Fried light,"Dasan Hill is a lean lefty who looks like a lefty George Kirby on the mound and throws a 95-97 mph sinker as his primary fastball (even though the four seamer is arguably a better pitch), but the breakers that are elite pitches as the 81-84 mph slider is a two plane sweeper netting a 14.9 SwStr% on the year, the 82-85 mph kick change up is generating a 19.3% SwStr% and the 11-5 curveball is generating a 21.6% SwStr% and should be thrown more.","I saw Dasan Hill’s first professional start in person and posted a ton of video on X and on YouTube from behind the plate.  Hill was extremely impressive and I see a lot of good starters in the Florida State League.  Watching him reminded me of Shane McClanahan at first, but the movement on the primary fastball is completely different and upon second consideration his profile is more of the Max Fried type.  Hill should scrap throwing the sinker so much and throw the four seamer and curve more.  His command has been getting worse as the season has gone on and the Twins are babying him.  The arsenal is great though and I’d bet the command comes around next year.",105,60/65,50/55,25/45,55/60,,,,,,,35/40,,,,,,55/65
38,121,Johnny King,SP,Blue Jays,2028,Shades of Carlos Rodon,"King is an athletically built lefty with a plus high rising fastball from the left side and a plus sinker with some good run to it and he dots it into the zone nicely for strikes.  Those two pitches are a fun combo that keep hitters off balance, because they tunnel so well together.  The slider isn’t high velo, but it does have a lot of sweeping movement to it across the zone, while the curve almost looks like a slow traditional slider with two-plane break at almost 10 to 4 o’clock with a 22.6 SwStr% at A ball.  King has a 2.58 JA ERA (SIERA) on the year.","King is another guy I’ve seen live this year, catching the first low A start of his career.  The change up is an underrated pitch with a lot of room to run and at only 19-years-old you know he will be adding velocity as he develops.  Hill has nastier stuff, 100%, but King is a bit more polished.  I’m going to lean Hill as I was just blown away with how good he looked when I saw him in April.",105,40/50,45/55,35/50,55/60,,,,,,,,,,55/60,45/55,,
39,122,Luis Perales,SP,Red Sox,Late 2026,Bryce Miller with worse command,Perales has a smaller 6’ 1” frame (for a starter) with a baller mid 90s fastball that tops out at 99 with excellent ride complimented by two breakers (one being a hard gyro slider / cutter that sits 86-92 with the other having a wider vertical break that I might classify as a hard curve or sweeper that sits closer to 80-84) and a nasty splitter that sits in high 80s.  The stuff is all north/south except the splitter and he needs a pitch that can effectively break east to west to perfect the arsenal.,"Perales was off my rankings list last time around since he had to get Tommy John surgery last year, but he began a throwing program in early May and has still yet to return, so it appears the Red Sox are being overly cautious, which is concerning to me and helps to explain the rankings drop, though there is new video of him throwing 98 mph.  Perales has very high upside with killer stuff and coming off the significant injury should hopefully have wind in his sails healthwise moving forward.",94,,,40/50,60/65,,,,,,45/55,60/65,,,,40/45,,
40,125,Didier Fuentes,SP,Braves,2028,Freddy Peralta / Jose Soriano mash,"The Braves obviously called Fuentes up way too early (ala AJ Smith-Shawver) as they continue to be the Angels of the East, but thankfully it didn’t negatively affect him too much in his return to the minors.  He has a lower, ¾ arm-slot that provides for a lot of ride on the fastball, which is his best pitch.  There is some relief risk with Fuentes since he’s a primary two pitch guy as he needs to develop at least one more pitch that can go east/west, maybe a sinker - he’s still very young so there is a lot of time to develop without rushing him to the majors again.  The curve has two-plane break and nice depth, but needs work on spotting locations.","Fuentes was placed on the IL at the beginning of the month with an unspecified injury and has yet to return.  I’m sure rushing him between all levels of the entire organization was not great for his health and hopefully it’s not an arm issue keeping him out.  Fuentes has a 2.53 JA ERA (SIERA) on the season, which is insane for a dude who literally made a major league start this year at 19-years-old.",N/A,,40/45,45/60,60/70,,,,,,,30/40,,,,,,50/60
41,126,Connor Prielipp,SP,Twins,Early 2026,Shades of Johan Santana,"Prielipp is a big lefty with deception in the delivery at a ¾ arm slot.  He was a second rounder in 2022 even coming off an injury and might have been the top pick if he hadn’t been hurt.  He hovers around 95-96 MPH on the fastball and has an incredibly sick classic 2-plane slider that nets over 3,000 RPM and has topped out at 90 mph with a developing, leaning plus change up (16.7% SwStr% at AAA).","Prielipp had Tommy John back in 2021 while in college and then had to get Internal Brace surgery in 2023 (possibly a failed Tommy John) so there is some massive injury risk here, but he’s a high level arm and is worth buying when he’s healthy.  He has had some ridiculously bad luck with a .406 BABIP against this year and .411 at AA (which must have the worst defense in baseball) against a 3.01 JA ERA (SIERA) this year.  He’s finally been building up the pitch count with 70+ pitches in his last three starts and 80+ in his last start.  I had expected all this stuff to click earlier in the year, but he has #2 SP stuff when things all start to click together.",129,55/60,,50/55,60/60,,,,,,,,,,,65/70,,
